video_id,title,publishedAt,channelId,channelTitle,categoryId,trending_date,tags,view_count,likes,comment_count,thumbnail_link,comments_disabled,ratings_disabled,description
"owE2J3CTJa4","22 *NEW* Dollar Tree gems you didn't know existed in 2022! 🤫","2022-05-03T17:05:12Z","UCJA8OyDxRY-wm0ya2gtHOsw","Do It On A Dime","26","22.07.05","doitonadime|home organization|home organizing|organizing tips|budget organization|dollar tree|cleaning|do it on a dime|clean with me|dollar tree hacks|dollar tree organization|dollar tree secrets|shop with me|2022","274609","23579","577","https://i.ytimg.com/vi/owE2J3CTJa4/default.jpg","False","False","Hey, guys!  Today we are headed to Dollar Tree for an ALL new shopping vlog for 2022.  What is your favorite hack?Dollar Tree Glue Gun Recall: https://www.cbsnews.com/news/dollar-tree-recall-hot-glue-gun-crafters-square-fires-burns/DIY Balloon Arch: https://youtu.be/UDnF8MGtVbw#doitoandime #dollartree #homehacks➡️GET DOLLAR TREE PRODUCTS: http://bit.ly/2CQEeH9➡️SHOP ITEMS I *LOVE* FROM VIDEOS: https://www.amazon.com/shop/doitonadime➡️ Cricut Starter Kit: Cricut Joy https://shrsl.com/2tv2yBasic Tool Set https://shrsl.com/2tv37Vinyl Starter Kit https://shrsl.com/2tv42Want to save more money when you shop?  These APPS ARE FREE! ➡️GET IBOTTA (Dollar Tree is on Ibotta with digital coupons): https://ibotta.com/r/onadime➡️GET RAKUTEN- formerly Ebates- (Cash back from all your favorite stores with discounts and get $10 FREE using this link):https://www.ebates.com/r/DOITON7?eeid=35386📝 BLOG: http://www.doitonadimeblog.com/📘 FACEBOOK: http://www.facebook.com/DoItOnADime📸 INSTAGRAM: http://instagram.com/doitonadime/❤️ TIKTOK: https://www.tiktok.com/@doitonadimeofficial?lang=en📌 PINTEREST: http://www.pinterest.com/doitonadime/Write me at:Kathryn DoitonadimeP.O. Box 1436Matthews, NC USA28106-1436Music licensed by Epidemic Sound.FTC Disclaimer: This is not a sponsored video.  All opinions are genuinely my own.  This post also contains affiliate links and I earn a small commission if you make a purchase after clicking on my links.  It doesn't cost you any extra.  Thank you for your continued support to keep Do It On A Dime going!"
"Q33XE_ksUCU","NBA YoungBoy - Loner Life (Music Video)","2022-05-01T21:00:09Z","UClW4jraMKz6Qj69lJf-tODA","YoungBoy Never Broke Again","10","22.07.05","YoungBoy Never Broke Again|NBA YoungBoy|YoungBoy Quando Rondo|YoungBoy Leak|Make No Sense YoungBoy|Youngboy Lost Motives|YoungBoy NBA Music Video|YoungBoy Never Broke Again TOP|nba youngboy top|YoungBoy NBA TOP album|7KTt4_M09Rw|0C80BSgjb8M|qChxuVxs8FA|dYk-yCsuTUo|6MCSr65d9Xc|ALimx-H8C6s|YoungBoy Never Broke Again Sincerely Kentrell|Sincerely Kentrell|Youngboy NBA Sincerely Kentrell|Sincerely Kentrell album|YBNBA Sincerely Kentrell|YB Sincerely Kentrell|Kentrell","4272181","242263","15837","https://i.ytimg.com/vi/Q33XE_ksUCU/default.jpg","False","False","YoungBoy Never Broke Again –  ‘Sincerely, Kentrell’ OUT NOW: https://youngboy.lnk.to/SincerelyKentrellID Subscribe for more official content from YoungBoy NBA: https://youngboy.lnk.to/Subscribe Connect with YoungBoy Never Broke Again: http://www.youngboynba.comhttps://www.facebook.com/nbayoungboyhttps://www.twitter.com/GGYOUNGBOYhttps://www.instagram.com/nba_youngboyhttps://www.soundcloud.com/nba-youngboy The official YouTube channel of Atlantic Records artist YoungBoy Never Broke Again. Subscribe for the latest music videos, performances, and more. #YoungBoyNeverBrokeAgain #SincerelyKentrell #"
"j1AuFXa_g0o","The Witch TERRIFIES Simon Cowell to the CORE! | Auditions | BGT 2022","2022-04-30T20:00:34Z","UCUtZaxDF3hD5VK4xRYFBePQ","Britain's Got Talent","24","22.07.05","britain's got talent|britains got talent|talent|bgt|ant and dec|ant|dec|simon cowell|david walliams|alesha dixon|amanda holden|Britain's Got Talent Unseen|BGT Unseen|got talent|bgt auditions|bgt judges|britains got talent auditions|british talent show|ant and dec on bgt|Great Britain|amazing auditions|london auditions|BGT 2022|Britain's Got Talent 2022|witch bgt|bgt witch|scary bgt|bgt scary|witch|scary audition bgt|witch audition","9916831","114514","6130","https://i.ytimg.com/vi/j1AuFXa_g0o/default.jpg","False","False","Between the light and the dark, the good and the evil, what will you choose?The Witch sends SHIVERS down our spines with one of our CREEPIEST auditions yet!See more from Britain's Got Talent at http://itv.com/BGTCatch up  on...ITV Hub: https://www.itv.com/hub/britains-got-talent/STV Player: https://player.stv.tv/summary/britains-got-talentSUBSCRIBE: http://bit.ly/BGTsubFacebook: http://www.facebook.com/BGTTwitter: http://twitter.com/BGTInstagram: https://www.instagram.com/bgt/TikTok: https://www.tiktok.com/@bgt"
"YcxeACHYsqQ","Wynonna Judd Describes Naomi Judd’s Final Hours","2022-05-02T15:31:20Z","UCNl9LUgT_E1hxd4JMinnwkw","Taste of Country","10","22.07.05","The Judds|Naomi Judd|Wynonna Judd|Hall of Fame Speech|Wynonna Judd Hall of Fame|How did Naomi Judd die","1576464","16229","1685","https://i.ytimg.com/vi/YcxeACHYsqQ/default.jpg","False","False","Wynonna Judd gave an emotional and revealing speech at the Country Music Hall of Fame Medallion Ceremony. #thejudds #naomijudd #wynonnajudd #countrymusichalloffame On Sunday May 1, the Judds were inducted into the Country Music Hall of Fame. Wynonna Judd and her mother Naomi Judd are country music icons, but one day before their induction, the 76-year-old mother died. Still, daughter Wynonna took the stage alongside sister Ashley Judd and said a few words about her final moment with her mother. Then she delivered a touching prayer. 0:00 | Wynonna Judd’s Hall of Fame Speech0:20 | Ashley Judd reflects on her mother Naomi 0:35 | Naomi Judd dies at 76 1:20 | Ricky Skaggs induction speech for the Judds 1:45 | Wynonna on her final moments with Naomi 2:40 | Wynonna Judd’s moving prayer Celebrating Naomi Judd's beautiful, complicated life → https://youtu.be/YcxeACHYsqQIf you're new, Subscribe! → http://bit.ly/subscribe-taste-of-country Download the app → http://tasteofcountry.com/app/ Go here → http://tasteofcountry.com/Like us → https://www.facebook.com/thetasteofcountryFollow us → https://twitter.com/tasteofcountryGet our newsletter → http://tasteofcountry.com/newsletter/#CountryMusic #Nashville"
"Yx3K3g4CtoQ","Lady Gaga - Hold My Hand (From “Top Gun: Maverick”) [Official Audio]","2022-05-03T04:00:18Z","UC07Kxew-cMIaykMOkzqHtBQ","LadyGagaVEVO","10","22.07.05","Lady|Gaga|Hold|Hand|(Audio)|Interscope|Records|Pop","2352112","123732","13194","https://i.ytimg.com/vi/Yx3K3g4CtoQ/default.jpg","False","False","Listen to “Hold My Hand” (Music From The Motion Picture Top Gun: Maverick”): http://LadyGaga.lnk.to/HoldMyHand Follow Lady Gaga:Facebook: http://gaga.lk/facebookInstagram: http://gaga.lk/InstagramSnapchat: http://gaga.lk/SnapchatTwitter: http://gaga.lk/TwitterWebsite: http://www.ladygaga.com/Official Store: http://gaga.lk/GagaStoreEmail List: http://gaga.lk/News Follow Top Gun:Instagram: https://www.instagram.com/topgunmovie/Twitter: https://twitter.com/topgunmovieFacebook: https://www.facebook.com/TopGunMovie/ Website: https://www.topgunmovie.com/ Music video by Lady Gaga performing Hold My Hand (Audio). © 2022 Interscope Recordshttp://vevo.ly/uhxumn"
"4EvNu9WVVFc","First Round, Gm 1: Penguins @ Rangers 5/3 | NHL Playoffs 2022","2022-05-04T04:42:08Z","UCqFMzb-4AUf6WAIbl132QKA","NHL","17","22.07.05","Hockey|Ice hockey highlights 2022|NHL|National Hockey League|New York Rangers|New York Rangers vs. Pittsburgh Penguins|Pittsburgh Penguins|hockey game|hockey games 2022|ice hockey|ice hockey highlights|nhl 21|nhl 22|nhl 22 be a pro|nhl 22 review|nhl big hits|nhl highlights|nhl highlights 2021|nhl highlights 2022|nhl hockey games 2022","163936","2310","559","https://i.ytimg.com/vi/4EvNu9WVVFc/default.jpg","False","False","Extended highlights of the Pittsburgh Penguins at the New York Rangers"
"hS0mjrMhQ2E","Las Vegas police: Body found in barrel at Lake Mead may have been there for decades","2022-05-03T13:30:03Z","UCpR_4YnLJAphcr0VI5yR5SA","FOX5 Las Vegas","25","22.07.05","KVVU|Fox5|Fox5Vegas|Las Vegas|Vegas","335418","3379","1847","https://i.ytimg.com/vi/hS0mjrMhQ2E/default.jpg","False","False","Las Vegas police said a body found in a barrel at Lake Mead over the weekend may date back to the 1980s. Authorities said more remains could be discovered as the water level in Lake Mead continues to drop. DETAILS: https://bit.ly/3vEDPFR"
"F_PNk1h-B5M","Body language expert analyzes Amber Heard in Depp Trial","2022-05-05T02:11:23Z","UCo5E9pEhK_9kWG7-5HHcyRg","COURT TV","25","22.07.05","court tv live trial 2021|court tv live stream|court tv|court tv trials|court tv live|court tv trials 2021|court tv full trials|live court tv full trials|live court tv|live court trials|live court cases|law and crime|live court cam|true crime daily|courtroom trials|trials|Johnny Depp|Amber Heard|johnny depp amber heard|johnny depp lawsuit|amber heard trial|johnny depp trial|amber heard lawsuit|defamation trial|johnny depp court|defamation lawsuit","256527","3064","808","https://i.ytimg.com/vi/F_PNk1h-B5M/default.jpg","False","False","We spoke with a body language expert about #AmberHeard's expressions in the #JohnnyDepp defamation trial to see what she might be feeling behind all the testimony we heard today. WATCH #CourtTV LIVE - #DeppvHeard Trial - https://court.tv/liveCOURT TV IS BACK! 24/7 LIVE gavel-to-gavel coverage, in-depth legal reporting, and expert analysis of the nation’s most important and compelling trials.WATCH COURT TV LIVE: https://www.courttv.com/title/court-tv-live-stream-web/?trk=YouTubeWATCH TRIALS ON DEMAND:https://www.courttv.com/programming/trial-archives/?trk=YouTubeWHERE TO WATCH: https://www.courttv.com/where-to-watch/?trk=YouTube"
"UxavheYIgMs","Met Gala 2022: Live From E! Stream FULL Livestream | E! News","2022-05-03T01:24:57Z","UCjDsbbzHgTrGc4Ff26TJtsA","E! News","24","22.07.05","E! News|E! Entertainment|News|E!|Top Stories|Pop Culture|Breaking News|Breaking|Live|Interviews|Red Carpet|Fashion|Trending|Celeb News|Gossip|Hollywood|Entertainment|Celebrity|Celebrities|Celebs|Met Gala|2022 Gala|2022 Met Gala|Celebs Met Gala|Met Gala Red Carpet|Celebrity Met Gala Carpet|Met Gala Red Carpet 2022|Met Gala Celeb Red Carpet|Met Gala Live|Met Gala Live Red Carpet|2022 Met|Met Red Carpet|2022 Met Gala Live|Met Gala Red Carpet Livestream","787084","9845","664","https://i.ytimg.com/vi/UxavheYIgMs/default.jpg","False","False","Met Gala co-chairs Regina King, Blake Lively, Ryan Reynolds and Lin-Manuel Miranda and A-list stars are paired with elite fashion designers for In America: An Anthology of Fashion theme. See the stars come together in New York City for one of fashion's most anticipated nights. Take a look! #metgala #metgala2022 #livestream #enews Subscribe: http://bit.ly/enewssub About E! News:The E! News team brings you the latest breaking entertainment, fashion and Pop Culture news. Featuring exclusive segments, celebrity highlights, trend reports and more, the E! News channel is the only destination Pop Culture fans need to stay in the know.Download The E! News App For The Latest Celebrity News and Trending Videos: https://eonline.onelink.me/yMtl/4ead5017Your favorite shows, movies and more are here. Stream now on Peacock. https://bit.ly/PeacockEEntConnect with E! News:Visit the E! News WEBSITE: http://eonli.ne/enewsLike E! News on FACEBOOK: https://www.facebook.com/enews/Check out E! News on INSTAGRAM: https://www.instagram.com/enews/Follow E! News on TWITTER: https://twitter.com/enewsMet Gala 2022: Live From E! Stream FULL Livestream | E! Newshttps://youtu.be/UxavheYIgMshttp://www.youtube.com/user/enews"
"g8iidxp43fQ","Yungeen Ace - Sleazy Flow Remix (feat. GMK ) [Official Music Video]","2022-05-01T21:00:11Z","UCf1Q757aKSmywQDQhiTtGFA","Yungeen Ace","10","22.07.05","yungeen ace|jacksonville florida|florida|jacksonville|cinematic music group|cinematic music|cinematic|lil durk|moneybagg yo|lil baby|nba youngboy|youngboy never broke again|nocap|dababy|spinabenz|jaydayoungan|all on me|kodak black|sleazy flow|GMK","2132054","99711","4278","https://i.ytimg.com/vi/g8iidxp43fQ/default.jpg","False","False","Listen to Yungeen Ace's All On Me https://yungeenace.ffm.to/allonme.OYDListen to GMK’s “New 50’s” Out Now https://youtu.be/Nobk6gNIBVIText Yungeen Ace 904-204-4544Shop ATK https://www.lifeofatk.com/​Follow Yungeen Ace:http://www.instagram.com/yungeenace/​​​​http://www.facebook.com/yungeenacemusichttp://twitter.com/yungeenace​​​​http://soundcloud.com/yungeenace​​​​http://spoti.fi/2qlMNET​​​​https://apple.co/2mtKyRJ​​​​Follow GMKhttps://instagram.com/rackracergmk_?igshid=YmMyMTA2M2Y=https://open.spotify.com/artist/45n8IV3vVbqD8xm8aVtfUj?si=A1JEuRVtRnit6y68-himFAhttps://music.apple.com/us/artist/gmk/15027082052022 Cinematic Music Group /ATK#yungeenace #gmk #sleazyflow"
"HLLofrwRlBg","10 Crazy Useful Gameplay Secrets in Elden Ring","2022-05-02T23:39:31Z","UCe0DNp0mKMqrYVaTundyr9w","VaatiVidya","20","22.07.05","guide|walkthrough|lore|dark|souls|remastered|dlc|two|bloodborne|story|vaatividya|vaati|vidya|videos|(video|game)|shadows|twice|from|software|sekiro|ringed|city|ashes|ariandel|combat|tips|tricks|elden|ring|trailer|demon's souls|remake|remaster|ps5|playstation 5|exclusive|xbox series x|queen marika|lands between|tarnished|great runes|demigods|secrets|hints|discoveries|crystal darts|watchdogs|how to beat|night sorceries|greatsword|frozen needle|chain casting|mimic tear","1641312","83840","3108","https://i.ytimg.com/vi/HLLofrwRlBg/default.jpg","False","False","Check out ParryGod's content: https://www.youtube.com/c/TheParryGod►Displate Metal Prints at https://bit.ly/3kDjpF4►Clothing Merch at https://vaatividya.com/TIMESTAMPS00:00 Crystal Darts control golems00:58 Night Sorceries don't trigger dodges02:00 Crouch attacks can be OP03:17 Weapon Feints are a thing04:29 Certain spells can be chain-casted05:49 Mimic Tear can become a tank07:15 Armor Alteration changes a lot09:09 You can destroy the chariots11:58 Weather affects damage12:44 Use all buff types to become strongerKINDLE THE CHANNEL [become a patron]►http://www.patreon.com/vaatividyaSPECIAL THANKS TO►TheParryGod, for editing many recent videos - https://www.youtube.com/user/xricsxPLAYLISTS►My Best Videos: http://bit.ly/2oMp66a►Elden Ring News: https://bit.ly/2ZkDV2d►Sekiro Lore: https://bit.ly/2KGEzD1►Sekiro Secrets: https://bit.ly/2IsObhW►Dark Souls 3 Lore: http://bit.ly/2n0bU13►Dark Souls 3 News: http://bit.ly/1NQbgbW►Bloodborne Lore: http://bit.ly/1X9doOQ►Demon's Souls Lore: http://bit.ly/16mIF86►Dark Souls Remastered Lore: http://bit.ly/13x6nNs►Dark Souls 2 Lore: http://bit.ly/1dedWjI►Souls-like: http://bit.ly/1xCPDnuSOCIAL►Follow me on Twitter: https://twitter.com/VaatiVidya►Follow me on Tumblr: http://vaatividya.tumblr.com/►Follow me on Twitch.tv: http://www.twitch.tv/vaatividya►Follow me on Facebook: https://www.facebook.com/Vaatividya►Follow me on Patreon: http://www.patreon.com/vaatividya►Join me on Discord: http://discord.gg/vaatividyaTHUMBNAIL ART►Janice ChuPATRONS►I'd like to give sincere thanks to all my patrons - your contributions have changed the course of my life, allowing me to put more emphasis on video production in the future.►Special thanks to Soul of Cinder-tier Patrons: Ricky, Dread, AJ, Liam, Meistermuall, ndr.alng, Healther, Armand, Anthony, Sean, James, TAC, Thomas, Hastur, One Unimpressed Boi, Matthew, and Rune."
"bG19b06NG_w","How Wells & Aquifers Actually Work","2022-05-03T12:30:19Z","UCMOqf8ab-42UUQIdVoKwjlQ","Practical Engineering","27","22.07.05","Well|Aquifer|groundwater|hydrogeology|hydraulic conductivity|vector field mathematics|3Blue1Brown|water table|casing|gravel pack|aquitard|artesian well|contamination|Injection well|Aquifer Storage and Recovery|ASR|Edwards Aquifer|hydraulic fracturing|fracking","1566964","43628","1299","https://i.ytimg.com/vi/bG19b06NG_w/default.jpg","False","False","Correcting the misconceptions that abound around water below the ground📺  Get a year of CuriosityStream AND Nebula for 26% off, just $15! http://www.curiositystream.com/practicalengineeringIt is undoubtedly unintuitive that water flows in the soil and rock below our feet. This video covers the basics of groundwater engineering, including how wells are built, how injection wells work, and how aquifers interact with surface water features.Errata: Deep well jet pumps exist that can lift water greater than 100' using an ejector and two pipes.Practical Engineering is a YouTube channel about infrastructure and the human-made world around us. It is hosted, written, and produced by Grady Hillhouse. We have new videos posted regularly, so please subscribe for updates. If you enjoyed the video, hit that ‘like’ button, give us a comment, or watch another of our videos!CONNECT WITH ME____________________________________Website:         http://practical.engineeringTwitter:           https://twitter.com/HillhouseGradyInstagram:     https://www.instagram.com/practicalengineeringReddit:            https://www.reddit.com/r/PracticalEngineeringFacebook:      https://www.facebook.com/PracticalEngineerGrady​Patreon:         http://patreon.com/PracticalEngineeringSPONSORSHIP INQUIRIES____________________________________Please email my agent at practicalengineering@standard.tvDISCLAIMER____________________________________This is not engineering advice. Everything here is for informational and entertainment purposes only. Contact an engineer licensed to practice in your area if you need professional advice or services. All non-licensed clips used for fair use commentary, criticism, and educational purposes.SPECIAL THANKS____________________________________This video is sponsored by Curiosity Stream.Stock video and imagery provided by Getty Images, Shutterstock, and Videoblocks.Music by Epidemic Sound: http://epidemicsound.com/creatorTonic and Energy by Elexive is licensed under a Creative Commons Attribution LicenseSource: https://www.youtube.com/watch?v=U6fBPdu8w9UProducer/Writer/Host: Grady HillhouseEditor/Production Assistant: Wesley CrumpScript Editor: Ralph CreweGraphics: Standard Studios"
"HoQsrReqmyo","LE SSERAFIM 르세라핌 INTRO+FEARLESS @ LE SSERAFIM DEBUT SHOWCASE FEARLESS","2022-05-03T14:00:02Z","UCs-QBT4qkj_YiQw1ZntDO3g","LE SSERAFIM","10","22.07.05","[none]","2983381","166826","5128","https://i.ytimg.com/vi/HoQsrReqmyo/default.jpg","False","False","#LE_SSERAFIM #DEBUT_SHOWCASE #FEARLESS#르세라핌 #데뷔쇼케이스#LE_SSERAFIM #르세라핌 공식 채널#LE_SSERAFIM #르세라핌 OFFICIAL CHANNELOFFICIAL INSTAGRAM https://www.instagram.com/le_sserafim/OFFICIAL TWITTER https://twitter.com/le_sserafimOFFICIAL JAPAN TWITTER https://twitter.com/le_sserafim_jpOFFICIAL FACEBOOK https://www.facebook.com/official.les...OFFICIAL WEVERSE https://weverse.onelink.me/qt3S/t2ra8uwjOFFICIAL V LIVE https://www.vlive.tv/channel/818FB5OFFICIAL WEIBO https://weibo.com/LESSERAFIM"
"QeVEhQGAUPM","Villarreal vs. Liverpool: Extended Highlights | UCL Semi-Finals - Leg 2 | CBS Sports Golazo","2022-05-03T21:06:02Z","UCET00YnetHT7tOpu12v8jxg","CBS Sports Golazo","17","22.07.05","Liverpool|Villarreal|Villarreal vs. Liverpool","1330040","12739","1615","https://i.ytimg.com/vi/QeVEhQGAUPM/default.jpg","False","False","Extended Highlights, Presented By HeinekenA 2-0 victory at Anfield sees Liverpool a result away from the final, but Villarreal has made a habit of stunning the world’s biggest clubs.Stream every UEFA Champions League match live on Paramount+:https://www.paramountplus.com/shows/uefa-champions-league/ #UCL #ChampionsLeague #UEFA #Liverpool #Villarreal"
"r5n1GCY-nYQ","iKON - '너라는 이유 (BUT YOU)' M/V","2022-05-03T09:06:30Z","UCWxCyZibDIWIrGIgP25mbfw","iKON","10","22.07.05","YG Entertainment|YG|와이지|K-pop|iKON|아이콘|김진환|송윤형|BOBBY|김동혁|구준회|정찬우|iKONIC|YUNHYEONG|DONGHYUK|DK|JAY|JINHWAN|CHANWOO|JU-NE|iKON ON AIR|아이콘 온에어","7504712","441846","84929","https://i.ytimg.com/vi/r5n1GCY-nYQ/default.jpg","False","False","너라는 이유 (BUT YOU)I’m in love again지금 옆에 그 사람은 어때?서로가 좋은 사람만날 거란 말도 더 이상 내겐 의미 없네  이젠 나도 누군갈 만나서다시 설레고잊으려 해 봐도허전하긴 마찬가지미련일까 익숙해진 걸까채워지지 않는걸낯선 사람을 만나고다 잊은 듯이 품에 안겨 봐도왜 이럴까 난 왜  너라는 이유I need you baby혹시나 우리가 또다시시작한다면 사랑한다면오로지 난 You, you-ooh I’m in love again친구들은 이런 내가 철없대아무렇지 않은 척잘 지낸다는 말도감정 없는 사람처럼 보인대상관없지 뭐I’m in love with you너에게 난 매일매일 돌아가Know you need me too누구보다 서로를 잘 알잖아Baby 너와의 시간들이 계속오버랩돼 무슨 짓을 해도Nobody but youI want nobody but you낯선 사람을 만나고 다 잊은 듯이 품에 안겨 봐도왜 이럴까 난 왜  너라는 이유I need you baby혹시나 우리가 또다시시작한다면 사랑한다면오로지 난 You, you-ooh시간이 갈수록그리워진 만큼 내 눈앞에 선명하게네 모습이 떠오르고여전히 널 원해어디에 있어도 내 맘속에 함께했던아름다운 순간들을 OohDon’t want no one but you, you낯선 사람을 만나고다 잊은 듯이 품에 안겨 봐도왜 이럴까 난 왜너라는 이유I need you baby혹시나 우리가 또다시시작한다면 사랑한다면오로지 난 You, you-ooh#iKON #아이콘 #4thMINIALBUM #FLASHBACK #TITLE #너라는이유 #BUTYOU #MV #YG🎧Stream on : https://smarturl.it/iKON_FLASHBACKMore about iKON @http://www.yg-ikon.com/http://www.youtube.com/OfficialYGiKONhttp://www.facebook.com/OfficialYGiKONhttp://www.twitter.com/ygent_officialhttp://www.weibo.com/iKONOFFICIAL"
"DDY6KjQCMoQ","Welcome to CLAN CAPITAL! Clash of Clans New Update!","2022-05-02T11:02:34Z","UCD1Em4q90ZUK2R5HKesszJg","Clash of Clans","20","22.07.05","clash of clans|COC|Clash of Clans Gameplay|Clash of Clans Strategy|Clash of Clans Animation|Clash of Clans Commercial|Clash of Clans Attacks|Clash of Clans Town Hall|Hog Rider|PEKKA|Clan Wars|season challenges|clan war leagues|clash on|clan game|clan games|clan capital|new update|new trailer|archer","13840851","164433","5755","https://i.ytimg.com/vi/DDY6KjQCMoQ/default.jpg","False","False","Welcome to the ultimate clan destination! A place where you and your clan can BUILD and BATTLE together! A place called CLAN CAPITAL!Follow us on our Socials!Twitter ► https://twitter.com/ClashofClans/Instagram ►https://www.instagram.com/clashofclans Facebook ►https://www.facebook.com/ClashofClans Attack. Defend. Strategize. Download for free for mobile devices. http://supr.cl/ThisArmyFrom rage-­filled Barbarians with glorious mustaches to pyromaniac wizards, raise your own army and lead your clan to victory! Build your village to fend off raiders, battle against millions of players worldwide, and forge a powerful clan with others to destroy enemy clans.PLEASE NOTE! Clash of Clans is free to download and play, however some game items can also be purchased for real money Also, under our Terms of Service and Privacy Policy, you must be at least 13 years of age to play or download Clash of Clans.A network connection is also required.FEATURES- Build your village into an unbeatable fortress - Raise your own army of Barbarians, Archers, Hog Riders, Wizards, Dragons and other mighty fighters- Battle with players worldwide and take their Trophies- Join together with other players to form the ultimate Clan- Fight against rival Clans in epic Clan Wars - Build 18 unique units with multiple levels of upgrades- Discover your favorite attacking army from countless combinations of troops, spells, Heroes and Clan reinforcements - Defend your village with a multitude of Cannons, Towers, Mortars, Bombs, Traps and Walls- Fight against the Goblin King in a campaign through the realmChief, are you having problems? Visit http://supercell.helpshift.com/a/clas...Privacy Policy:http://www.supercell.net/privacy-policy/Terms of Service:https://supercell.com/en/terms-of-service/Parent’s Guide:http://www.supercell.net/parents#clashofclans #clancapital"
