video_id,title,publishedAt,channelId,channelTitle,categoryId,trending_date,tags,view_count,likes,comment_count,thumbnail_link,comments_disabled,ratings_disabled,description
"XRlXpQA0KsI","Minecraft, But I Survive In a REAL Desert","2022-05-05T21:00:10Z","UC1n_yB_W-FZCbwajZPcs8Jw","UnspeakablePlays","20","22.07.05","minecraft|unspeakable|unspeakableplays|mini game|game|custom|games|maps|secret|redstone|funny moments|mcpe|minecraft pe|pocket edition|unspeakablegaming|trolling|gameplay|playthrough|tutorial|traps|glitch|funny|craziest|prank|pranks|no cursing|no swearing|creations|facts|how to|parody|adventure|comedy|video|unspeakableplays minecraft|Minecraft but|realistic minecraft|minecraft versus|minecraft challange|minecraft in real life|minecraft IRL|Minecraft 100 days","747383","18166","581","https://i.ytimg.com/vi/XRlXpQA0KsI/default.jpg","False","False","NEW MERCH! - https://www.unspeakable.com/PLAY NEW GAMES! - https://www.unspeakable.com/pages/play-gamesFOLLOW ME! - https://www.unspeakable.com/pages/linksPLEASE leave a like & subscribe this video was expensive!! THANK YOU! I love tacosMinecraft, But I Survive In a REAL Desert#Unspeakable#UnspeakablePlays#Minecraft"
"7fntgkx9z0E","His Wife Said it Wouldn't Fit","2022-05-05T19:00:03Z","UC6I0KzAD7uFTL1qzxyunkvA","Blacktail Studio","26","22.07.05","bookmatched guitar top|bookmatched wood|computer desk|custom desk|diy desk|do it yourself|do it yourself projects|expensive wood|figured woods|how to|how to build a desk|luxury desk|modern desk|most expensive wood|most expensive wood in the world|myrtle wood|woodworking|woodworking projects","249862","13817","1802","https://i.ytimg.com/vi/7fntgkx9z0E/default.jpg","False","False","The client's wife said this nearly nine-foot 500lb slab of live edge walnut was too big for their house. And I was a little nervous working on a $6700 chunk of wood that might not be able to be used. The husband said to go ahead though, so I just made the best table I could and hoped she was wrong. Blacktail Woodworking Plans: https://blacktailstudio.lpages.co/blacktail-studio-bookmatched-table-base-plans/Wife’s desk videos: https://youtu.be/hZCWjuxwN5chttps://youtu.be/OEfOqdxuvEYAriat: Save 10% off your first order - https://bit.ly/38iq0Ao Cam’s Favorites - https://bit.ly/3Dldleb Blacktail Virutal Epoxy Workshop, learn to make epoxy tables: https://www.blacktailstudio.com/resin-workshopsBlogs/related stuff: Table finishing: https://www.blacktailstudio.com/blog/how-to-finish-a-tableLive edge info: https://www.blacktailstudio.com/blog/live-edge-wood-for-beginners-part-oneBow tie inlay: https://www.blacktailstudio.com/blog/wood-inlay-for-beginners-bow-tie-jointNeed an arborist/guy who cuts trees down? https://ironmountaintreecare.com/Items used in this build:Wagner Moisture meter: https://www.wagnermeters.com/wood-moisture-meters/Black Forest Ceramic:https://blackforestwood.com/collections/black-forest-ceramics-1/products/ceramic-20ml-kitTable legs: Table legs: https://flowyline-official.myshopify.com/?rfsn=5707840.6acb09cPencil: https://amzn.to/3F0MiGePlaner: https://olivermachinery.net/C-channels: https://conceptthirteen.ca?ref=btjrt2lvnw8gAngle grinder: https://amzn.to/3pu2iXZTrack saw: https://www.timberwolftools.com/mafell-k85ec-circular-sawTable top epoxy (touch-ups/fast): https://amzn.to/3asufLqBandsaw blade: https://amzn.to/3F5uwS4CA glue: https://amzn.to/3tiiKNuRestorer: https://amzn.to/3vxClgcBosch router: https://amzn.to/3F3qfyIThreaded inserts: https://conceptthirteen.ca?ref=btjrt2lvnw8gFestool sander: https://amzn.to/3gVnlBgRoundover bit: https://amzn.to/3uwTwv0Lightstick (now $55): https://amzn.to/3faMWFuMesh sandpaper: https://amzn.to/3ptVj1kEpoxy thickener: https://amzn.to/3ktg2lJGem buffer: https://amzn.to/2N6qWRtPhotography light (similar): https://amzn.to/2RjiMqpCountersink: https://amzn.to/3k50ROEWhite buffing pads: https://amzn.to/3u85vzVFurniture bolts: https://amzn.to/2NdDAOgCordless router: https://amzn.to/3BtO53uTransfer punch: https://amzn.to/3LD7eph0:00 Intro0:58 How to tell if wood is dry1:59 Woodworking project 3:44 Live edge wood cleanup5:58 How to make penetrating epoxy7:14 Why C-channel slab table9:49 Live edge tip/trick11:52 First big mistake (today)13:49 Bow tie layout15:25 Dangerous woodworking16:44 Bow tie inlay20:04 More dangerous woodworking21:30 Finishing a live edge table23:49 Ceramic coat on wood25:26 Delivery daywww.blacktailstudio.com"
"Ky1c6d7v0pQ","Met Gala 2022: celebs fumbled the easiest theme ever","2022-05-05T16:42:51Z","UCoOss5XiPpnLHGmLrBvNkJg","Mina Le","1","22.07.05","met gala|mina le|the met|2022|commentary|fashion|review|style|analysis|essay|kim kardashian|marilyn monroe|billie eilish|gilded age|vogue|emma chamberlain|kylie jenner|normani|blake lively","517140","44825","2956","https://i.ytimg.com/vi/Ky1c6d7v0pQ/default.jpg","False","False","SUPPORTPatreon: http://patreon.com/gremlitaNewsletter: https://gremletter.substack.com/p/advice-01?showWelcome=trueDonate: https://ko-fi.com/minaleSOCIALSInstagram: http://instagram.com/gremlitaTikTok: https://www.tiktok.com/@gremlitaTwitter: https://twitter.com/gremlitaSnapchat Series: https://story.snapchat.com/p/469010a0-86f8-4ba9-bf72-eef87a53805a/987561961920512?sender_web_id=b2aad72b-d9a0-49ef-81ec-fba8ea49f9fb&device_type=desktop&is_copy_url=true&sender_web_id=7ff3ede4-7910-40d6-adf0-c719777bbfe3&device_type=desktop&is_copy_url=trueLetterboxd: http://boxd.it/7YgXbusiness email: MinaLeTeam@WMEAgency.comEdited by Israh S.0:00 - theme explanation5:54 - outfit reviews"
"dId7IA-AaEg","Doctor Strange in the Multiverse of Madness - Movie Review","2022-05-05T10:27:47Z","UC7v3-2K1N84V67IF-WTRG-Q","Jeremy Jahns","24","22.07.05","[none]","550131","32281","3652","https://i.ytimg.com/vi/dId7IA-AaEg/default.jpg","False","False","Thank you Displate for sponsoring! Click the link for 31% off 1 or 2 prints, and 41% off 3 or more prints for Displate's birthday celebration! https://displate.com/jeremyjahns?art=624726cc42ac1Sam Raimi brings some horror movie flavor to the MCU in DOCTOR STRANGE IN THE MULTIVERSE OF MADNESS!!! Here's my review!#DoctorStrange2 #MultiverseOfMadness"
"jUcvo7n8FtM","FINAL CHANCE for HELLUVA BOSS + HAZBIN HOTEL Spring Merch","2022-05-05T16:00:27Z","UCzfyYtgvkx5mLy8nlLlayYg","Vivziepop","1","22.07.05","Vivziepop|Zoophobia","395017","41169","1609","https://i.ytimg.com/vi/jUcvo7n8FtM/default.jpg","False","False","Get your *Limited Edition* Helluva Boss + Hazbin Hotel Merch HERE ► https://bit.ly/37mfpriThank you for your patience for episode 8! More updates coming soon."
"0lkSqR4vrIQ","THE MOMENT REAL MADRID KNOCK MAN CITY OUT CHAMPIONS LEAGUE","2022-05-04T23:38:53Z","UCnU7ly6zEcQxUScjhkgFYAQ","Thogden","17","22.07.05","real madrid|manchester city|champions league|benzema|comeback|ucl highlights|real madrid vs man city|man city|real madrid vs manchester city|real madrid manchester city|real madrid man city|real madrid vs manchester city 2022|real madrid vs man city highlights|real madrid v man city|real madrid vs manchester city highlights|real madrid 3-1 man city|madrid 3-1 city|madrid 3-1 man city|los blancos|real madrid fans|man city fans|real madrid highlights|thogden","1195355","53822","2882","https://i.ytimg.com/vi/0lkSqR4vrIQ/default.jpg","False","False","Inside Estadio Bernabeu for Real Madrid vs Man City in Champions League Semi Final 2nd leg, for this special moment...                                     ↓Open for links↓►FACEBOOK: https://www.facebook.com/Thogden►Twitter: http://twitter.com/thogden►INSTAGRAM: http://instagram.com/thogden►Business Enquiries: thogden.pr@gmail.com=============================================="
"Ihr6PpgW67U","WHO WORE IT BETTER? FT BROOKLYN & BAILEY","2022-05-04T21:00:07Z","UC-TFz4MD1ZzcY6NuZAP3Ndw","The Rybka Twins","24","22.07.05","Brooklyn and bailey|rybkatwins|teagan and sam|who wore it better|who wore it better challenge|fashion challenge|10 minute fashion challenge|$50 fashion challenge|target fashion challenge|target|twins vs twins|oler twins vs younger twins|identical twins","208550","9494","471","https://i.ytimg.com/vi/Ihr6PpgW67U/default.jpg","False","False","SUBSCRIBE TO BROOKLYN & BAILEY HERE: https://www.youtube.com/user/BrooklynAndBaileyWATCH THE VIDEO WE DID ON BROOKLYN & BAILEY'S CHANNEL HERE: https://youtu.be/cFUZYGRYK94So excited to be sharing our latest Collab video with Brooklyn & Bailey! In today's video it's the older twins vs the younger twins to see who can pick the best Target outfit for $50 in just 10 minutes. Instagram decides the winners but we want to know who you would pick to win so be sure to comment your fav fit down below! Hope you enjoy and thanks for watching!!! Love Teagan & Sam xo#identicaltwins #fashionchallenge #whoworeitbetter #brooklynandbaileySHOP MERCH HERE:https://rybkatwins.comPURCHASE Rybka Twins PIROUTTE BOARD HERE:https://rybkatwins.com/ FOLLOW US BTS HERE:INSTAGRAM: @rybkatwinsofficial @teagan_rybka @sam_rybkaTIKTOK: @rybkatwinsofficial FACEBOOK: The Rybka TwinsWE HAVE A BOOK!'Twinning it' is now available in stores where books are sold in AUSTRALIA & NEW ZEALAND! (Dymocks, Kmart, Big W & Target)OR ORDER TWINNING IT ONLINE HERE!!!Booktopia – https://bit.ly/2SnOPlAUS – Amazon US - https://amzn.to/2XSEXRVUK and Ireland –Amazon UK – https://amzn.to/2XWhe37"
"XyKgNozC6d0","Animated spellbook: Awaken D&D 5E","2022-05-05T12:30:09Z","UCCXR2kCo7Lcw_BKwWxo09kw","Zee Bashew","1","22.07.05","Animated|dungeons and dragons|spellbook|cantrip|how to be a druid|how to be a wizard|guide to spells|tutorials|d&d ideas|table top|zee|bashew|animated dungeon|sorcerer|first level spells|unlimited damage|jump|chaos bolt|DMG|north|Augury|Awakened|Awaken","172587","23205","1619","https://i.ytimg.com/vi/XyKgNozC6d0/default.jpg","False","False","The saddest pig.Paid Sponsor: TALESPIRE https://store.steampowered.com/app/720620?utm_source=ZeeThe Harmonica is In and Out by Ben-OrThe end theme is Joy Ride by Aves"
"bzuB5IjMou8","MY FORTNITE ICON SKIN!","2022-05-04T18:44:50Z","UCKfFviyQkZMTOIJpxfbESUg","Chica","20","22.07.05","chica|chica icon skin|fortnite icon skin|chica fortnite|fortnite","397835","24956","2962","https://i.ytimg.com/vi/bzuB5IjMou8/default.jpg","False","False","I announced my Fortnite Icon skin! I have no words and I am so grateful to my community. Thank you for making this possible! For more information on my skin and my Chica Fortnite Cup: fn.gg/ChicaSupport me by using my creator code in the item shop: chica   I stream Fortnite LIVE every day on Twitch! Follow my Twitch channel: https://www.twitch.tv/chicaSOCIAL MEDIA:🟣 Twitch: https://www.twitch.tv/chica🔵 ​Twitter: https://twitter.com/chicalive🟠​​​​​​ Instagram: https://www.instagram.com/chicalivee/⚫️ TikTok: https://www.tiktok.com/@chica⚪️ Business inquiries: xchica.adm@gmail.com#fortnite #chica #chapter3"
"VUXTzIxvtrk","I made Crossy Road in Minecraft!","2022-05-04T14:45:00Z","UC9mvRrl9o7rG65ABsGVvDBw","Mysticat","20","22.07.05","[none]","550752","36741","1779","https://i.ytimg.com/vi/VUXTzIxvtrk/default.jpg","False","False","this is unbelievably difficult...▬▬▬▬▬▬▬▬▬Funny people in the video:@rekrap2 @SeaWattgaming @EightSidedSquare @Wifies @Couriway @Fundy @AntVenom @SB737 @RubberRoss ▬▬▬▬▬▬▬▬▬Follow these for a cookie!🔵 Twitter - https://twitter.com/MysticatLive🟢 Twitch - https://twitch.tv/MysticatLive🟠 Discord - https://discord.gg/Mysticat▬▬▬▬▬▬▬▬▬Hey, I'm Mysticat! The cat that does the impossible! Subscribe to see things in Minecraft you wouldn't believe!#minecraft▬▬▬▬▬▬▬▬▬"
"CIVry7b31Is","OAKLEY’S COACHELLA BIRTHDAY PARTY 🎉","2022-05-05T01:00:06Z","UCTvgnaLSfM5nqrabqrRJXMg","LVE FAMILY","1","22.07.05","LAURAMELLADO|COACHELLA|BIRTHDAY|OAKLEY|1ST|LOVE|FAMILY|LVEFAMILY|FUN|PARTY|LIT|VLOGGING|INFLUENCER|HAPPYBIRTHDAY|love|LVE|VICTOOTALL","231807","11773","696","https://i.ytimg.com/vi/CIVry7b31Is/default.jpg","False","False","Don’t wait and check your rate today at https://upstart.com/lveOakleys First birthday!!! Thank you for always showing him so much love !!! S/O to ELEGANCIA EVENTS FOR THROWING THE SICKEST PARTY EVER!!!!! COACHELLA THEMED FIRST BIRTHDAY AND EVERYONE HAD A BLAST!!***FOLLOW US ON SOCIAL MEDIA***BUSINESS INQUIRIES : Laura@revel-mgmt.com ❤️LAURA'S SOCIAL MEDIA https://www.instagram.com/lauramellad...SNAPCHAT : lauramelladoTIK TOK : @LAURASMELLADOTWITTER : @LAURASMELLADOVICTOR'S SOCIAL MEDIAhttps://www.instagram.com/victootall/...Snapchat : victootallTIKTOK : @VICTOOTALL#LVEFAMILY"
"wj8LUqpSXgU","Dougie B - I'm Back (shot by KLO Vizionz)","2022-05-04T00:00:13Z","UCYrBk99J2v8c58BomaNnIBA","Dougie B","10","22.07.05","Dougie B|Dougie B I'm Back|Dougie B Kay Flock|Dougie B new song|Dougie B Brotherly Love|Brotherly Love|EliWTF|A Lau","426886","30922","2320","https://i.ytimg.com/vi/wj8LUqpSXgU/default.jpg","False","False","https://www.instagram.com/dougieb___/Prod. By A Lau & EliWTF"
"aeO-7QhKh7o","CANELO ALVAREZ RESPONDS TO JAKE PAUL: WHY DO YOU GUYS ASK ME ABOUT THAT FIGHT?","2022-05-04T22:20:02Z","UCCh-tgR7B-1jXvMZOE7ebiQ","Pro Boxing Fans","17","22.07.05","Boxing|Boxeo|Boxing News|Boxing Heads|Boxing Fan|Boxing Fanatik|Boxing Life|Boxing Talk|Boxing Latest|Boxing Updates|Fight|Fights|Canelo Alvarez|Jake Paul|Dmitry Bivol|Canelo vs Bivol|Canelo Alvarez vs Dmitry Bivol","705605","10523","2491","https://i.ytimg.com/vi/aeO-7QhKh7o/default.jpg","False","False","Ahead of his fight against Dmitry Bivol, Canelo Alvarez responds to Jake Paul calling him out. Check out the video! #CaneloAlvarez #JakePaul #CaneloBivol #Boxing🥊 SUBSCRIBE TO OUR YOUTUBE CHANNEL: https://www.youtube.com/user/proboxingfans/🥊 FOLLOW US ON TWITTER: https://twitter.com/ProBoxingFans🥊 FOLLOW US ON INSTAGRAM: https://www.instagram.com/proboxingfans/🥊 LIKE OUR FACEBOOK PAGE: https://www.facebook.com/proboxingfans/🥊 CHECK OUT OUR WEBSITE: https://www.proboxing-fans.com/"
"bUHZ2k9DYHY","Space DOES NOT Expand Everywhere","2022-05-04T20:15:02Z","UC7_gcs09iThXybpVgjHZ_7g","PBS Space Time","27","22.07.05","Space|Outer Space|Physics|Astrophysics|Quantum Mechanics|Space Physics|PBS|Space Time|Time|PBS Space Time|Matt O’Dowd|Einstein|Einsteinian Physics|General Relativity|Special Relativity|Dark Energy|Dark Matter|Black Holes|The Universe|Math|Science Fiction|Calculus|Maths|Holographic Universe|Holographic Principle|Rare Earth|Anthropic Principle|Strong Anthropic Principle|cosmology","373335","14837","2323","https://i.ytimg.com/vi/bUHZ2k9DYHY/default.jpg","False","False","PBS Member Stations rely on viewers like you. To support your local station, go to:http://to.pbs.org/DonateSPACESign Up on Patreon to get access to the Space Time Discord!https://www.patreon.com/pbsspacetimeSpace is big, and it’s getting bigger. But where does all that new space actually come from? And is it popping into existence all around you right now? Is that why the remote control is always further away than I thought?Check out the Space Time Merch Storehttps://www.pbsspacetime.com/shopSign up for the mailing list to get episode notifications and hear special announcements!https://mailchi.mp/1a6eb8f2717d/spacetimeHosted by Matt O'DowdWritten by Matt O'Dowd Post Production by Leonardo Scholzer, Yago Ballarini, Pedro Osinski, Adriano Leal & Stephanie FariaGFX Visualizations: Ajay ManuelDirected by Andrew KornhaberAssociate Producer: Bahar GholipourExecutive Producers: Eric Brown & Andrew KornhaberExecutives in Charge (PBS): Adam Dylewski, Maribel Lopez Director of Programming (PBS): Gabrielle Ewing Spacetime is produced by Kornhaber Brown for PBS Digital Studios.This program is produced by Kornhaber Brown, which is solely responsible for its content.© 2022 PBS. All rights reserved.End Credits Music by J.R.S. Schattenberg: https://www.youtube.com/user/MultiDroidekaSpecial Thanks to Our Patreon SupportersBig Bang SupportersAdam HillierBryce FortMark EvansDavid TaicletDaniel AlexiucPeter BarrettDavid NeumannCharlieLeo KoguanSandy WuAhmad JodehAlexander TamasMorgan HoughAmyJuan BenetVinnie FalcoFabrice EapMark RosenthalDavid NicklasQuasar SupportersAlex KernEthan CohenStephen WilcoxChristina OegrenMark HeisingHank SHypernova SupportersWilliam BryanGregory ForfaKirk HonourdrollereJoe MoreiraMarc ArmstrongScott GorlickPaul Stehr-GreenAdam WaltersRussell PopeBen DeloScott GrayАнтон КочковJohn R. SlavikMathewDonal BotkinJohn PollockEdmund FokschanerJoseph Salomonechuck zegarJordan YoungDaniel MuzquizGamma Ray Burst SupportersThomas TarlerbsgbryanSean McCaulCarsten QuinlanSusan AlbeeFrank WalkerMatt QWhizBangeryAvi YashchinMHL SHSKory KirkTerje VoldAnatoliy NagornyycomboyBrett BakerJonathan ConerlyAndre StechertRoss BohnerPaul WoodKent Durhamjim bartoshNubbleChris NavridesScott R CalkinsThe Mad MechanicEllis HallJohn H. Austin, Jr.Diana SBen CampbellFaraz KhanAlmog CohenAlex EdwardsÁdám KettingerMD3Endre PechDaniel JenningsCameron SampsonPratik MukherjeeGeoffrey ClarionNateDarren DuncanRuss CreechJeremy ReedEric WebsterDavid JohnstonWeb BrowserMichael BartonChristopher BarronJames RamseyMr TAndrew MannIsaac SuttellDevon RosenthalOliver FlanaganBleys GoodsonRobert WalterBruce BSimon OliphantMirik GogriMark DelagasseMark Daniel CohenBrandon LattinNickolas Andrew FreemanShane CalimlimTybie FitzhughRobert IlardiEric KieblerCraig StonahaMartin SkansThe Art of SinGraydon GossFrederic SimonTonyfaceJohn RobinsonA GDavid NealKevin LeejustahatJohn FunaiTristanBradley JenkinsKyle HoferDaniel StříbrnýLuaanCodyThomas DoughertyKing ZeckendorffNick VirtueScott GossettDan WarrenPatrick SuttonJohn GriffithDaniel LyonsDFaulkKevin Warne"
"6E44tBMCKog","NIGHTMARE CUPHEAD VS THE DEVIL (Indie cross Aftermath)","2022-05-04T18:00:32Z","UCFAn3uATFn-3fJMztiH5Qzw","MORØ Nighteye","24","22.07.05","Indie cross|Devil|Cuphead|Cuphead show|DLC|devil's gambit|Knockout|FNF INDIE CROSS Album|Friday Night Funkin' VS Indie Cross V1 FULL WEEK + Cutscenes & Ending (Cuphead Sans Bendy) (FNF Mod)|Update|FNF|Brightfyre loves gro-|uhh|Sans?|Idk|Naruto|weeeeeeeeeeeeeeeeee|Tags go brrr|Death|Despair|Badtime|FNF mods","688376","40402","3447","https://i.ytimg.com/vi/6E44tBMCKog/default.jpg","False","False","NOTE: DO NOT REUPLOAD MY ANIMATION VIDEOS (Reaction videos are good)Support me here If you can:  http://ko-fi.com/moro44564Follow me on Twitter: https://twitter.com/moro_nighteyeCheck out Dexter (VA of the Devil) https://twitter.com/DexterJManningOther credits are in the video"
"NlXYiUDyhkg","crazy taxi rip-offs","2022-05-04T16:53:36Z","UCj74rJ9Lgl3WTngq675wxKg","Noodle","20","22.07.05","[none]","286981","33922","1768","https://i.ytimg.com/vi/NlXYiUDyhkg/default.jpg","False","False","Get Honey for FREE today ▸http://joinhoney.com/noodleHoney finds coupons with one click. Thank u Honey for sponsoring :)Crazy taxi on Steam:https://store.steampowered.com/app/71230/Crazy_Taxi/Crazy Taxi mods I highly recommend: https://cookieplmonster.github.io/mods/crazy-taxi/https://steamcommunity.com/sharedfiles/filedetails/?id=964260789Tips for playing the game I wish I knew while recording:https://esports-news.co.uk/2010/11/25/crazy-taxi-hints-and-tips/I'm on Patreon and Twitter also;https://www.patreon.com/LegitNoodlehttps://twitter.com/LegitimatNoodle00:00 - Intro2:18 - Ad Break3:36 - Road Rage6:25 - Taxi Chaos9:15 - ConclusionPatrons who supported me in making this video:OZ-10Heather WaldronImTheRealSlayerJoshua OddieAceDefective04PMcCrearyDadwelltkSkylineShifteyinjayRobux GeneratorPatrickSpaceyBalty BTravis OlbrichJunospowerNick ProvenzanoMr. AnimoSketchKoshikage YiraKyle_Da_Red_RebelFaintTurnipWillis HarveyPatrick KennedyGeroyuniAlabasterSteven BennisJason OffenbakerKal AulaniBen JunyaJ Name DudeI'm a Jenius!LegumemuttonJadeskyeEric LinkellyRicardo FariasApimHBenjamin ThornberryEkin SigicxplorAndrew LehmannMeerkatSebastian OsoskySchmitzelShuderN30NPUM4Keele DillonEdgy Heckerpuka_tchouJustin BullHeli WangBilly VinsonThe Shady BoiWeston HawkDurkeyturkeyStevesfinesthourAlex VelezGeffDamonackDAREKONn.e.c.Jacques L’HommeamoethystJacob JerniganPreston SchwartzZach AideIoannis A.Cameron WiseWithervoodoofluxRyan BurgersEl LoraxAlex GriffinNDKfilmsAlex FernandezAmicusCmSpacecrabsSam StaabCorgiTheLadOscar ErikssonSuperCyborgShrimp The KidRowsellBenjamin BricknerVinomakonRemnant JohnMalcolm YeenAmora Neke LukisanThings Shall Get Loud NowPioinNotimeformetaAndroos ExistsThe DebstersParallelYorarasbrosWinterGloopGuyDanAiden ChidseyDramadudeFirePitOceanMan20BuckMinhJB Bongrandandrew j.StuffFromDanMegan EbbersSpritecladeimazubaConnor JohnsonAdam O'DellCovelionErameysJoBot.11DevzJonathan DodeesyntTristanCrunchy_RocksCarter JMaxley FraserClefspereFoehn GalletVolraan ZebricJoySparxJoshuaSkrimish10Teagan Marie MulfordKatzeSwooceMasterMariannaGrav GCallsign CarrotJesseTerrence P.Rainie ParkerRiverSujiAuralyticalWunderballJames WebsterSkyeelZurroRyan Scott HillierMarron TurnerRustyCherrySojeuMellow MichaelHonaKyle JacksonLamaatmurRaenir SalazarErmel TwanoWill ManningMason WilderoryloriPineconeDylan NorthrupWilscwilBlooGremlinBrian NoviusAvery SwansonSeñor ChowMASTER GSam PrattManda FOhMySamurguyWhiteghost117Chase CastleErik LarsenSquidHominidCrispyCringeNatashaThe Stephen Hawkins Treadmill ExperienceCaseyEmber ReviewsTrey DickersonAndres RodriguezDrake KudrnaPoGrimbeanieFerdinand RemenecBest Boy KevinDayanara SergesANTHONY DUARTEiwavvaJames  QueenAck mackAnxiousCombatWombatAndrew NietoLauren KlingeleLiamGary SpinradGiovanni LupoZyroableeSentientTurtleJamichael FolsonJ1411MarketttJoelEthanNindotaWillis ScothornShaggy_OneErikSam CotterYami ShaggyLuke SpicerJesús FloresMashProTatoSaltTeaFruitSnackBanditRobertMarkChristina SomeoneShin GuardianTITO woodsBolexleAPGreg BaloneyCojo490QuiltyPleasuresChotskiesMatthew RothmannAndrew KMatt, flamin hot braindead.Andrew RossCale EQuiet269NehklesThrinmonButtsmcgeeA TreeComrade of HomotopiaKenneth SabianBenTnflatei0nLuke ShepherdDaniel DorfmanACarrDanny DeVoid of LifeDanny Wolf-Hero The Triggered Aussie-DenebKusinwolfCharles KuzmechRamseyTheresa KulpaChristopher StollJer456KloudHeckYeckJesse BartelsJean MachineBenedikt MüllerKeybladestrike1AllOrNothing21Trevor harringtonReferenceMakerCortSorry OfficerElysium ErvinEuroPascal#sponsored"
"9VNjnYZ8Swk","Shocker is completely destroyed... What happened? An up close look at the damage. Totaled","2022-05-04T23:13:12Z","UCZ12ruq_7FaMfyN5XUQfUqA","Kye Kelley Racing","2","22.07.05","Kye Kelley|shocker|no prep kings|street outlaws|Nola|504|street outlaws New Orleans|drag racing|street racing|no prep|street outlaws live|kye kelly|street outlaws no prep kings|team nola|kye kelley racing|kye kelley shocker crash|kyle kelley|drag race|street race|street outlaws race|musi|lizzy musi|pat musi|pat musi engines|nitrous|nos|shocker crash|destroyed|totaled|crash|wreck|street racing crash|show stopper|kye kelley wreck|kye kelley new car","358484","7400","979","https://i.ytimg.com/vi/9VNjnYZ8Swk/default.jpg","False","False","Shocker is completely destroyed. Here's exactly what happened, what the plan is for the future, and an up close look at what's left of the car and the damage is sustained . Totaled. Be sure to like the video and subscribe to the Channel! Videos will be coming at you regularly! Find me on social media also!Merchandise: www.kyekelleyracing.comFacebook: Kye Kelley RacingInstagram: @therealkyekelleyTikTok: @therealkyekelley"
"HD6_0c8Fgnk","Dave Chappelle attacked during performance","2022-05-04T11:33:51Z","UCgVZ0mrM3liHNhRYC5Mchgg","WPLG Local 10","25","22.07.05","dave chappelle|entertainment","712183","4091","1258","https://i.ytimg.com/vi/HD6_0c8Fgnk/default.jpg","False","False","Comedian Dave Chappelle was allegedly attacked during a performance Tuesday night."
"LiNxfFkymTk","[BE ORIGINAL] LE SSERAFIM(르세라핌) 'FEARLESS' (4K)","2022-05-04T14:00:11Z","UCEIi7zFR_wE23jFncVtd6-A","STUDIO CHOOM [스튜디오 춤]","24","22.07.05","M2|엠투|스튜디오 춤|스춤|Studio choom|COVERS|커버스|DANCE THE X|댄스 더 엑스|댄스|DANCE|비 오리지널|BE ORIGINAL|커버|COVER|르세라핌|LE SSERAFIM|le sserafim|lesserafim|르세라핌 데뷔|르세라핌 fearless|le sserafim fearless|사쿠라|김채원|허윤진|카즈하|김가람|홍은채|KIM CHAEWON|HUH YUNJIN|KAZUHA|KIM GARAM|HONG EUNCHAE|SAKURA","3567563","311008","8713","https://i.ytimg.com/vi/LiNxfFkymTk/default.jpg","False","False","[BE ORIGINAL] LE SSERAFIM 'FEARLESS'[비 오리지널] 르세라핌 'FEARLESS'완성형 아이돌의 피어리스한 퍼포❤🔥짱세라핌 칼군무에 미소가 절로 꽃핌(2:55) 데뷔부터 레전드 찍었드아아아!!!#LE_SSERAFIM #르세라핌 #BEORIGINALStream various performance video on STUDIO CHOOM!👉SUBSCRIBE👈YouTube: https://www.youtube.com/STUDIOCHOOMFacebook:  https://www.facebook.com/StudioCHOOMInstagram: https://www.instagram.com/studio_choom/Naver TV: https://tv.naver.com/cjenm.STUDIOCHOOM"
