video_id,title,publishedAt,channelId,channelTitle,categoryId,trending_date,tags,view_count,likes,comment_count,thumbnail_link,comments_disabled,ratings_disabled,description
"p38WgakuYDo","Bad Bunny - Moscow Mule (Official Video) | Un Verano Sin Ti","2022-05-06T04:00:11Z","UCmBA_wu8xGg1OfOkfW13Q0Q","Bad Bunny","10","22.07.05","Bad|Bunny|Bad Bunny|YHLQMDLG|EUTDM|UnVeranoSinTi|Un Verano Sin Ti|UVST|Un Verano|Me Porto Bonito|PR|PFKR|P FKN R|Puerto Rico|Reggaeton|Urban|Urbano|Regueton|Regeton|Visualizer|360|3D|360 degrees|oculus|headset|occulus|beach|Moscow Mule|Moscu Mule|Moscow|Mule","11784604","1285720","45174","https://i.ytimg.com/vi/p38WgakuYDo/default.jpg","False","False","Bad Bunny - Moscow Mule (Official Video) | Un Verano Sin TiUn Verano Sin Ti https://www.unveranosinti.com/  World's Hottest Tour https://worldshottesttour.com/Suscríbete al canal/Subscribe to the channel: https://rimas.io/ytbadbunny​Más de Bad Bunny / More from Bad Bunny:EUTDM- https://rimas.io/EUTDM​Una Vez ft. Mora - https://youtu.be/gSMYGP0TYC4​Sigue a Bad Bunny / Follow Bad Bunny:Spotify: https://rimas.io/spotifybb​Apple Music: https://rimas.io/applemusicbb​Instagram: https://www.instagram.com/badbunnypr​#BadBunny​ #UnVeranoSinTi​ #MoscowMule"
"0NzlbBmkM3E","A$AP Rocky - D.M.B. (Official Video)","2022-05-05T16:00:12Z","UCHE7rAi1Fw1CBmQXFtvJmrw","LIVELOVEASAPVEVO","10","22.07.05","ASAP Rocky|rihanna|asap rocky music|asap rocky new music|rih rih|fenty|rocky music|asap rocky babushka|asap rocky babushka boi|asap rocky babushka boy|asap rocky Rihanna perform|asap rocky interview|asap rocky fashion killa|asap rocky peso|a$ap rocky|a$ap rocky fell in love with you|asap rocky fell in love with you|asap rocky D.M.B.|asap rocky dmb|ANTI|kendrick lamar|Vince staples|schoolboy|pusha|Flatbush|joey","3920044","363957","16975","https://i.ytimg.com/vi/0NzlbBmkM3E/default.jpg","False","False","A$AP ROCKY’S “D.M.B.”: https://AsapRocky.lnk.to/DMBOFFICIAL VIDEO FOR ”D.M.B.” BY A$AP ROCKYLISTEN TO A$AP ROCKY: https://AsapRocky.lnk.to/listenYDFOLLOW A$AP ROCKY:FACEBOOK: https://AsapRocky.lnk.to/followFIINSTAGRAM: https://AsapRocky.lnk.to/followIITWITTER: https://AsapRocky.lnk.to/followTIWEBSITE: https://AsapRocky.lnk.to/followWI#ASAPRocky #DMB #OfficialVideo #HipHop"
"xn21hH7kyx8","Bad Bunny (ft. Chencho Corleone) - Me Porto Bonito  (360° Visualizer) | Un Verano Sin Ti","2022-05-06T04:02:01Z","UCmBA_wu8xGg1OfOkfW13Q0Q","Bad Bunny","10","22.07.05","Bad|Bunny|Bad Bunny|YHLQMDLG|EUTDM|UnVeranoSinTi|Un Verano Sin Ti|UVST|Un Verano|Me Porto Bonito|PR|PFKR|P FKN R|Puerto Rico|Reggaeton|Urban|Urbano|Regueton|Regeton|Visualizer|360|3D|360 degrees|oculus|headset|occulus|beach|Me Porto Bien","5249016","461174","8355","https://i.ytimg.com/vi/xn21hH7kyx8/default.jpg","False","False","Bad Bunny - Me Porto Bonito (ft. Chencho Corleone) (360° Visualizer) | Un Verano Sin TiUn Verano Sin Ti https://www.unveranosinti.com/  World's Hottest Tour https://worldshottesttour.com/Suscríbete al canal/Subscribe to the channel: https://rimas.io/ytbadbunny​Más de Bad Bunny / More from Bad Bunny:EUTDM- https://rimas.io/EUTDM​Una Vez ft. Mora - https://youtu.be/gSMYGP0TYC4​Sigue a Bad Bunny / Follow Bad Bunny:Spotify: https://rimas.io/spotifybb​Apple Music: https://rimas.io/applemusicbb​Instagram: https://www.instagram.com/badbunnypr​#BadBunny​ #UnVeranoSinTi​ #MePortoBonito© 2022 Rimas Entertainment"
"a5rlgE6dcBY","Bad Bunny - Después de la Playa (360° Visualizer) | Un Verano Sin Ti","2022-05-06T04:03:16Z","UCmBA_wu8xGg1OfOkfW13Q0Q","Bad Bunny","10","22.07.05","Bad|Bunny|Bad Bunny|YHLQMDLG|EUTDM|UnVeranoSinTi|Un Verano Sin Ti|UVST|beach|playa|360|3D|BadBunny|new album|un verano sin ti|Side A|Side B|playita|benito|Benito|Music|Musica|new. music friday|Merengue|Urban|RnB","4292927","343102","9510","https://i.ytimg.com/vi/a5rlgE6dcBY/default.jpg","False","False","Bad Bunny - Después de la Playa (360° Visualizer) | Un Verano Sin TiUn Verano Sin Ti https://www.unveranosinti.com/  World's Hottest Tour https://worldshottesttour.com/Suscríbete al canal/Subscribe to the channel: https://rimas.io/ytbadbunny​Más de Bad Bunny / More from Bad Bunny:EUTDM- https://rimas.io/EUTDM​Una Vez ft. Mora - https://youtu.be/gSMYGP0TYC4​Sigue a Bad Bunny / Follow Bad Bunny:Spotify: https://rimas.io/spotifybb​Apple Music: https://rimas.io/applemusicbb​Instagram: https://www.instagram.com/badbunnypr​#BADBUNNY​ #UNVERANOSINTI​ #DespuesdelaPlaya© 2022 Rimas Entertainment"
"Wg86eQkdudI","House of the Dragon | Official Teaser Trailer | HBO Max","2022-05-05T15:00:00Z","UCx-KWLTKlB83hDI6UKECtJQ","HBO Max","1","22.07.05","hbo|hbo max|hbo max movie|hbo max series|hbo youtube|hbo max youtube|hbo max trailer|hbo trailer|hbo video|hbo max originals|house of the dragon|targaryens|game of thrones|GOT|HOTD|daenerys targaryen|viserys targaryen|Rhaenyra Targaryen|princess rhaenerya|targaryen dynasty|dragons|mother of dragons|a song of ice and fire|house of the dragon teaser|house of the dragon hbo|house of the dragon hbo max|house of the dragon teaser trailer|balerion|meraxes","5738758","92804","6909","https://i.ytimg.com/vi/Wg86eQkdudI/default.jpg","False","False","History does not remember blood. It remembers names. August 21. #HouseoftheDragonAbout HBO Max:HBO Max is WarnerMedia’s direct-to-consumer offering with 10,000 hours of curated premium content. HBO Max offers powerhouse programming for everyone in the home, bringing together HBO, a robust slate of new original series, key third-party licensed programs and movies, and fan favorites from WarnerMedia’s rich library including Warner Bros., New Line, DC, CNN, TNT, TBS, truTV, Turner Classic Movies, Cartoon Network, Adult Swim, Crunchyroll, Rooster Teeth, Looney Tunes and more. #HBOMax #WarnerBrosDiscovery SUBSCRIBE TO HBO MAXhttp://bit.ly/HBOMaxYouTubeGET HBO MAXhttps://itsh.bo/ways-to-getMORE HBO MAXHBO Max: https://hbom.ax/YT Follow HBO Max on Instagram: http://bit.ly/HBOMaxInstagramFollow HBO Max on TikTok: https://hbom.ax/HBOMaxTTFollow HBO Max on Twitter: http://bit.ly/HBOMaxTwitter Like HBO Max on Facebook: http://bit.ly/HBOMaxFacebook"
"rP09GUQFDFk","Future - WAIT FOR U (Official Music Video) ft. Drake, Tems","2022-05-05T16:00:26Z","UCFNosi99Sp0_eLilBiXmmXA","FutureVEVO","10","22.07.05","future|kevin samuels|healing together|worst day|future worst day|worst day future|healing together future|future healing together|future keving samuels|kevin samuels future|young thug|chainz|chief keef|yo gotti|meek mill|nav|gucci mane|french montana|quavo|21 savage|migos|future never liked you|never liked you future|future drake tems|tems drake future|drake|tems|future drake|drake future|drake tems","2695914","142911","10198","https://i.ytimg.com/vi/rP09GUQFDFk/default.jpg","False","False","Future feat. Drake & Tems - WAIT FOR U (Official Music Video)I NEVER LIKED YOU available at: https://future.lnk.to/I_NEVER_LIKED_YOUFollow Future:https://www.facebook.com/FutureOfficialhttps://twitter.com/1futurehttps://www.instagram.com/future/https://www.youtube.com/user/officialfuturevideos/featuredDirected by Director XProduced by Taj Critchlow(C) & (P) 2022 Epic Records, a division of Sony Music Entertainment. With Freebandz.#Future #Drake #Tems #WAITFORU"
"XJdXmpJCfUI","NBA YoungBoy - Don’t Rate Me Ft Quavo","2022-05-06T04:02:09Z","UClW4jraMKz6Qj69lJf-tODA","YoungBoy Never Broke Again","10","22.07.05","[none]","670096","103686","8778","https://i.ytimg.com/vi/XJdXmpJCfUI/default.jpg","False","False",""
"yQBImEeXNZ4","Jack Harlow - First Class [Official Music Video]","2022-05-06T04:00:12Z","UC6vZl7Qj7JglLDmN_7Or-ZQ","Jack Harlow","10","22.07.05","jack harlow|jack rapper|harlow rapper|private garden|jack harlow what’s poppin|jack harlow whats popping|jack harlow whats poppin|whats poppin song|confetti|sweet action|sweet action ep|tyler herro|jack harlow tyler herro|whats poppin|first class|fergie|viral|trending|first class by jack harlow|jack harlow first class leak|jack harlow first class tiktok|tiktok|jack harlow first class leaked|angus cloud 9|sweet sweet semen","1305350","145913","7891","https://i.ytimg.com/vi/yQBImEeXNZ4/default.jpg","False","False","Listen to 'Come Home the Kids Miss You': https://jackharlow.lnk.to/CHTKMYFirst Class produced by:Charlie HansomeJasper HarrisAngel BabeTruth LopezRoget ChahayedNickie Jon PabonDirected by Jack BegertWritten by Floridaman, Jack Harlow, Ace ProCreative Director: Ace ProStarring AnittaProd. Co: Psycho FilmsEP: Sam Canter, Christian SuttonProducer: Brendan GarrettDP: Chris RipleyProd. Designer: Eric HerseyPM: Zack StaufferProd. Coordinator: Keats Boyd1st AD: Jonas MoralesEditor: Jack BegertAddtl. Editor: Jake Torchin, Will TookeVFX: Justin JohnsonColor: Chris RipleyMarketing: Ali BVideo Commissioner: Kareem Johnson / OverScene, LLCAtlantic Video Services: Lily ThrallFOLLOW JACK HARLOWWebsite: https://www.jackharlow.us/Instagram: https://JackHarlow.lnk.to/InstagramTwitter: https://JackHarlow.lnk.to/TwitterFacebook: https://JackHarlow.lnk.to/FacebookLISTEN TO JACK HARLOWYoutube: https://JackHarlow.lnk.to/YouTubeSoundCloud: https://JackHarlow.lnk.to/SoundCloudSpotify: https://JackHarlow.lnk.to/SpotifyApple: https://JackHarlow.lnk.to/AppleThe official YouTube channel of Generation Now and Atlantic Records artist Jack Harlow. Subscribe for the latest music videos, performances, and more.SUBSCRIBE TO JACK’S YOUTUBE: https://JackHarlow.lnk.to/YouTubeLYRICS:I been a GThrow up the LSex in the A-M uh huh O-R-O-U-S yeahAnd I can put you in First class, Up in the sky I can put you in First class up in the, up-up in the I been a GThrow up the LSex in the A-M uh huh O-R-O-U-S yeahAnd I can put you in First class, Up in the sky I can put you in First class up in the, up-up in the I can see the whole city from this balconyBack in 2019 I was outside freely but now they got it out for meI don’t care what frat that you was in you can’t alpha meKeep dreaminPineapple juice I give her sweet, sweet, sweet (semen)I know what they like so I just keep cheesin’Hard drive full of heat seekingTryna come the same day as Jack rethink itYou don’t need Givenchy You need Jesus Why do y’all sleep on me I need reasonsI got plaques in the mail Peak season Shoutout to my UPS workers making sure I receive itYou can do it too, believe itI been a GThrow up the LSex in the A-M uh huh O-R-O-U-S yeahAnd I can put you in First class, Up in the sky I can put you in First class up in the, up-up in the Yes I amThey say you a superstar now, damn, I Guess I amYou might be the man well thats Unless I amOkay I’ll confess I amGo ahead and get undressed (I am)Okay cool you on Sunset? I amI’m boutta slideOkay I’m outsideOkayThis lifestyle don’t got many downsides‘Cept for the lack of time I get round my Family makin sure they never downsizeI got visions of my mom sayin wait this house mine?Can’t lie I’m on Angus Cloud nineI got em on the bandwagon now bout timeI ain’t even got no downtimeEvery time I speak she say yeah that sounds fineI been a GThrow up the LSex in the A-M uh huh O-R-O-U-S yeahAnd I can put you in First class, Up in the sky I can put you in First class up in the, up-up in the I been a GThrow up the LSex in the A-M uh huh O-R-O-U-S yeahAnd I can put you in First class, Up in the sky I can put you in First class up in the, up-up in the #JackHarlow"
"q6x7HwjdJJU","Poppy Playtime Chapter 2 Part 1 - HUNTED BY MOMMY LONG LEGS.","2022-05-05T22:50:12Z","UC5enhS5tdXhHNbj8s_kdBUw","FusionZGamerr","20","22.07.05","poppy playtime chapter 2|poppy playtime|mommy long legs|poppy playtime chapter 2 ending|poppy playtime chapter 2 fusionzgamer|poppy playtime chapter 2 walkthrough|poppy playtime chapter 2 full game|poppy playtime chapter 2 gameplay|huggy wuggy|poppy playtime secrets","885503","48952","8795","https://i.ytimg.com/vi/q6x7HwjdJJU/default.jpg","False","False","Poppy Playtime Chapter 2 gameplay walkthrough. We meet Poppy for the first time and she has some interesting things to tell us.. We also get a first look at Mommy Long Legs and she is way more terrifying then Huggy Wuggy and Kissy Missy..Game: https://store.steampowered.com/app/1817490/Poppy_Playtime__Chapter_2/#poppyplaytime #poppyplaytimechapter2Poppy Playtime Chapter 2 Part 1: HUNTED BY MOMMY LONG LEGS."
"X4r_eTtS4Lo","Morgan Wallen - Thought You Should Know (Lyric Video)","2022-05-06T04:00:12Z","UCiQtJ9wVv8R-x7GKHzgZu8A","MorganWallenVEVO","10","22.07.05","Morgan|Wallen|Thought|You|Should|Know|(Lyric|Video)|Big|Loud|Records|Republic|Country","226968","16840","845","https://i.ytimg.com/vi/X4r_eTtS4Lo/default.jpg","False","False","Music video by Morgan Wallen performing Thought You Should Know (Lyric Video). © 2022 Big Loud Records, under exclusive license to Mercury Records/Republic Records, a division of UMG Recordings, Inchttp://vevo.ly/njxVJE"
"q9Ugy77WQ7M","Kevin Samuels Passes Away At 56 - HP News","2022-05-06T03:35:02Z","UCABZ7Z6SBTp4IsARDceOq7w","Comedy Hype","23","22.07.05","comedy|jokes|laughter|stand-up|comedy hype news|ch news show|kevin samuels|real talk|tariq nasheed|women in comedy|best|hype plus|breaking news|the breakfast club|cnn|hot 97|shaq|dl hughley|joe rogan|relationship advice|breaking|news|culture news|dr ruth|katt williams","529774","12948","5195","https://i.ytimg.com/vi/q9Ugy77WQ7M/default.jpg","False","False","https://www.comedyhype.com/ - Relationship guru, Kevin Samuels reportedly has been confirmed to be dead at 56. HP News reports his sudden passing. Instagram: @ComedyHype & Twitter: @ComedyHype_"
"mvxQYPR4lmU","Taylor Swift - This Love (Taylor's Version) (Lyric Video)","2022-05-06T04:00:30Z","UCANLZYMidaCbLQFWXBC95Jg","TaylorSwiftVEVO","10","22.07.05","taylor swift|taylor|swift|this love|this love taylor’s version|this love taylor swift|taylor’s version|taylors version|taylor swift new album|taylor swift new music|taylor swift lyrics|1989|1989 taylor’s version|1090 taylors version|official taylor swift lyrics|taylor rerecord|taylor reissue|taylor new version|1989 rerecord|1989 remaster|1989 new version|taylor swift 1989|1989 taylors version|taylor swift rerecord","1312576","262816","17485","https://i.ytimg.com/vi/mvxQYPR4lmU/default.jpg","False","False","Official lyric video for “This Love (Taylor’s Version)”.Get the song here: http://taylor.lnk.to/thislovetv►Subscribe to Taylor Swift on YouTube: https://ts.lnk.to/subscribe  ►Exclusive Merch: http://taylorswift.lnk.to/store►Follow Taylor Swift online:Instagram: http://instagram.com/taylorswift  TikTok: http://tiktok.com/@taylorswiftFacebook: http://facebook.com/taylorswift  Tumblr: http://taylorswift.tumblr.com  Twitter: http://twitter.com/taylorswift13  Snapchat: http://snapchat.com/add/taylorswiftWebsite: http://www.taylorswift.com  ►Follow Taylor Nation OnlineInstagram: http://instagram.com/taylornation  Tumblr: http://taylornation.tumblr.com  Twitter: http://twitter.com/taylornation13Official Lyrics: Clear blue waterHigh tide came and brought you inAnd I could go on and on, on and on, and I willSkies grew darkerCurrents swept you out againAnd you were just gone and gone, gone and gone In silent screamsIn wildest dreamsI never dreamed of this This love is goodThis love is badThis love is aliveBack from the deadThese hands had to let it go freeAnd this love came back to me Tossing, turningStruggled through the night with someone newBaby, I could go on and on, on and onLantern, burningFlickered in the night for only youBut you were still gone, gone, goneIn losing gripOn sinking shipsYou showed up just in time This love is goodThis love is badThis love is aliveBack from the deadThese hands had to let it go free andThis love came back to meThis love left a permanent markThis love is glowing in the darkThese hands had to let it go free andThis love came back to me Your kiss, my cheekI watched you leaveYour smile, my ghostI fell to my kneesWhen you’re young, you just runBut you come back to what you need This love is goodThis love is badThis love is aliveBack from the deadThese hands had to let it go free andThis love came back to me This love left a permanent markThis love is glowing in the darkThese hands had to let it go free andThis love came back to me This love came back to me #taylorswift #thislove #taylorsversionMusic video by Taylor Swift performing This Love (Taylor's Version) (Lyric Video). © 2022 Taylor Swift"
"qlLNGcltxoo","Poppy Playtime Chapter 2 Part 2 - RESCUED BY KISSY MISSY","2022-05-05T23:53:02Z","UC5enhS5tdXhHNbj8s_kdBUw","FusionZGamerr","20","22.07.05","poppy playtime chapter 2|poppy playtime|mommy long legs|poppy playtime chapter 2 ending|poppy playtime chapter 2 fusionzgamer|poppy playtime chapter 2 walkthrough|poppy playtime chapter 2 full game|poppy playtime chapter 2 gameplay|huggy wuggy|poppy playtime secrets|kissy missy|poppy playtime chapter 2 kissy missy","753500","36956","6847","https://i.ytimg.com/vi/qlLNGcltxoo/default.jpg","False","False","Poppy Playtime Chapter 2 gameplay walkthrough Part 2. We meet Kissy Missy for the first time and she rescued us from a trap.. we also take on Huggy Wuggy and his clones in the new  Wack a Wuggy!Game: https://store.steampowered.com/app/1817490/Poppy_Playtime__Chapter_2/#poppyplaytime #poppyplaytimechapter2Poppy Playtime Chapter 2 Part 2 - RESCUED BY KISSY MISSY"
"2LDaxyu5KUI","SI SUPIERAS (DANNYLUX)","2022-05-05T10:04:53Z","UC7EkN9gnsj0yxQNYSeVyahQ","Various Artists - Topic","10","22.07.05","Eslabon Armado|NOSTALGIA|SI SUPIERAS (DANNYLUX)","588182","47428","0","https://i.ytimg.com/vi/2LDaxyu5KUI/default.jpg","False","False","Provided to YouTube by Del Records, Inc.SI SUPIERAS (DANNYLUX) · Eslabon ArmadoNOSTALGIA℗ 2022 DEL RecordsReleased on: 2022-05-06Auto-generated by YouTube."
"_BMLHC6oNzY","First Couple To Have A Baby","2022-05-06T13:00:32Z","UCy0Pr5u-MwGXXzp_GDd4m_g","Julie Nolke","23","22.07.05","[none]","184866","29815","1420","https://i.ytimg.com/vi/_BMLHC6oNzY/default.jpg","False","False","Head on over to watch First Couple to Move in Together on Ryan's channel! https://youtu.be/9-pybk6XIlsAlso subscribe to  @Ryan George  Sign up for my Patreon so I can keep making videos and subscribe you weirdos: https://www.patreon.com/julienolkeWriter: Julie Nolke and Ryan George Actors: Julie Nolke and Ryan George Camera: Sam LarsonEditor: Alec McKay"
"vqPIvA9ATO4","Jack Harlow - Churchill Downs feat. Drake [Official Audio]","2022-05-06T04:00:31Z","UC6vZl7Qj7JglLDmN_7Or-ZQ","Jack Harlow","10","22.07.05","jack harlow|jack rapper|harlow rapper|private garden|jack harlow what’s poppin|jack harlow whats popping|jack harlow whats poppin|whats poppin song|sweet action|sweet action ep|tyler herro|jack harlow tyler herro|whats poppin|first class|fergie|viral|trending|first class by jack harlow|jack harlow first class leak|jack harlow first class tiktok|tiktok|jack harlow first class leaked|angus cloud 9|sweet sweet semen|Dua Lipa|Churchilll Downs|Drake|Leak","498584","40554","2472","https://i.ytimg.com/vi/vqPIvA9ATO4/default.jpg","False","False","Listen to 'Come Home the Kids Miss You': https://jackharlow.lnk.to/CHTKMYFOLLOW JACK HARLOWWebsite: https://www.jackharlow.us/Instagram: https://JackHarlow.lnk.to/InstagramTwitter: https://JackHarlow.lnk.to/TwitterFacebook: https://JackHarlow.lnk.to/FacebookLISTEN TO JACK HARLOWYoutube: https://JackHarlow.lnk.to/YouTubeSoundCloud: https://JackHarlow.lnk.to/SoundCloudSpotify: https://JackHarlow.lnk.to/SpotifyApple: https://JackHarlow.lnk.to/AppleThe official YouTube channel of Generation Now and Atlantic Records artist Jack Harlow. Subscribe for the latest music videos, performances, and more.SUBSCRIBE TO JACK’S YOUTUBE: https://JackHarlow.lnk.to/YouTube#JackHarlow #ChurchillDowns #Drake #ComeHomeTheKidsMissYou"
"PwY-jVSM-f0","I used an A.I. to make videogame characters fight to the death","2022-05-05T20:43:03Z","UClyGlKOhDUooPJFy4v_mqPg","DougDoug","20","22.07.05","DougDoug|DougDoug Youtube Channel|Channel Youtube DougDoug|doug doug|twitch|twitch chat|dougdoug twitch chat|twitch chat plays|dougdoug twitch|ai|artificial intelligence|novelai|novel ai|inferkit|gpt3|kirby|snake|link|mario|tournament|senator armstrong|armstrong|gandhi|civilization|civ 6|nuke|doom guy|skyrim|dragonborn|trevor|sonic|tails|master chief|halo|matt|wii sports|sans|kratos|solid snake|metal gear solid","625924","56599","4596","https://i.ytimg.com/vi/PwY-jVSM-f0/default.jpg","False","False","I used Artificial Intelligence to make every videogame character fight to the deathThis was streamed live on Twitch! https://bit.ly/DougTwitchFull stream recording: https://www.youtube.com/watch?v=Nbk4W1zULVYArtwork by Wafferscotch! https://twitter.com/wafferscotchEdited by Berry Bebop! https://www.youtube.com/c/berrybebopMy 2nd Channel: http://bit.ly/dougdoug2Twitter: https://twitter.com/DougDougFoodSubscribe: https://bit.ly/dougdougsubsubMore DugDug:Latest Uploads: https://www.youtube.com/watch?v=rp4cH7mb4X4&list=PLzTxt5iYdhziB3Zf03HR_aZWgJ49ffj-d&index=2Explained with Food: https://www.youtube.com/playlist?list=PLzTxt5iYdhzjMJF--_xpj4s4jgOPe0NWFDougDoug Challenges: https://www.youtube.com/playlist?list=PLzTxt5iYdhzh_SW60_g3HPVjBupwUZOFAPopular Videos: https://www.youtube.com/playlist?list=PLzTxt5iYdhzgrLpm-SQNNAVOw0gVs8Iu_About DougDoug:Doug is a sentient bell pepper who was hired by the FBI to crack gaming challenges and also talk about things with food#ArtificialIntelligence #Ai #DougDoug"
"jbauJUkbt1c","Rest in Power @Kevin Samuels","2022-05-06T05:28:38Z","UC62oKTWLypC5ZczOXRFPtpA","Mediocre Tutorials and Reviews","24","22.07.05","kevin samuels","301715","32244","6577","https://i.ytimg.com/vi/jbauJUkbt1c/default.jpg","False","False","100% of the proceeds of this video will be donated directly to Kevin's family.  Rest in Power, my brother."
"3Yh_6_zItPU","Obi-Wan Kenobi | Official Trailer | Disney+","2022-05-04T12:46:12Z","UCZGYJFUizSax-yElQaFDp5Q","Star Wars","24","22.07.05","[none]","7734861","331322","18120","https://i.ytimg.com/vi/3Yh_6_zItPU/default.jpg","False","False","The story begins 10 years after the dramatic events of “Star Wars: Revenge of the Sith” where Obi-Wan Kenobi faced his greatest defeat—the downfall and corruption of his best friend and Jedi apprentice, Anakin Skywalker, who turned to the dark side as evil Sith Lord Darth Vader.The series stars Ewan McGregor, reprising his role as the iconic Jedi Master, and also marks the return of Hayden Christensen in the role of Darth Vader. Joining the cast are Moses Ingram, Joel Edgerton, Bonnie Piesse, Kumail Nanjiani, Indira Varma, Rupert Friend, O’Shea Jackson Jr., Sung Kang, Simone Kessell and Benny Safdie.“Obi-Wan Kenobi” is directed by Deborah Chow and executive-produced by Kathleen Kennedy, Michelle Rejwan, Deborah Chow, Ewan McGregor and Joby Harold."
"O2CIAKVTOrc","Lady Gaga - Hold My Hand (From “Top Gun: Maverick”) [Official Music Video]","2022-05-06T16:00:13Z","UC07Kxew-cMIaykMOkzqHtBQ","LadyGagaVEVO","10","22.07.05","Lady|Gaga|Hold|Hand|Interscope|Records|Pop","583286","91961","8399","https://i.ytimg.com/vi/O2CIAKVTOrc/default.jpg","False","False","Listen to “Hold My Hand”, available now: http://LadyGaga.lnk.to/HoldMyHandPre-order “Top Gun: Maverick (Music From The Motion Picture)”, available May 27: http://TopGunMaverick.lnk.to/Soundtrack Directed by Joseph Kosinski – Director of Top Gun: Maverick Follow Lady Gaga:Facebook: http://gaga.lk/facebookInstagram: http://gaga.lk/InstagramSnapchat: http://gaga.lk/SnapchatTwitter: http://gaga.lk/TwitterWebsite: http://www.ladygaga.com/Official Store: http://gaga.lk/GagaStore Email List: http://gaga.lk/NewsFollow Top Gun:Instagram: https://www.instagram.com/topgunmovie/Twitter: https://twitter.com/topgunmovieFacebook: https://www.facebook.com/TopGunMovie/Website: https://www.topgunmovie.com/Music video by Lady Gaga performing Hold My Hand. © 2022 Interscope Recordshttp://vevo.ly/aVxKZo"
"3o8w042VdOk","Real Madrid vs. Manchester City: Extended Highlights | UCL Semi-Finals - Leg 2 | CBS Sports Golazo","2022-05-04T21:56:30Z","UCET00YnetHT7tOpu12v8jxg","CBS Sports Golazo","17","22.07.05","Manchester City|Real Madrid|Real Madrid vs. Manchester City","2293388","27821","4063","https://i.ytimg.com/vi/3o8w042VdOk/default.jpg","False","False","Extended Highlights, Presented By HeinekenThe first leg of Real Madrid vs. Manchester City was an instant classic. Will the scintillating Karim Benzema and Real Madrid overcome their 4-3 deficit?Stream every UEFA Champions League match live on Paramount+:https://www.paramountplus.com/shows/uefa-champions-league/ #UCL #ChampionsLeague #UEFA #RealMadrid #ManchesterCity"
"T2fjQrsKbAM","BoyWithUke - Understand (Official Video)","2022-05-06T04:00:09Z","UCcUcckay9ZVzIZ92kEqz5Yw","BoyWithUkeVEVO","10","22.07.05","BoyWithUke|boywithuke understand|understand boywithuke|understand|understand official video|understand video|understand tiktok|boywithuke tiktok|tiktok|serotonin dreams","724254","106435","8101","https://i.ytimg.com/vi/T2fjQrsKbAM/default.jpg","False","False","Stream/Download Serotonin Dreams here: https://BoyWithUke.lnk.to/SeratoninDreams Spotify: https://BoyWithUke.lnk.to/SpotifyApple Music: https://BoyWithUke.lnk.to/AppleMusicInstagram: https://BoyWithUke.lnk.to/InstagramTikTok: https://BoyWithUke.lnk.to/TikTokAll other links and socials: https://linktr.ee/Boywithuke The official YouTube channel of BoyWithUke.Subscribe :DMusic video by BoyWithUke performing Understand. © 2022 Boywithuke, LLC, under exclusive license to Mercury Records/Republic Records, a division of UMG Recordings, Inc."
