video_id,title,publishedAt,channelId,channelTitle,categoryId,trending_date,tags,view_count,likes,comment_count,thumbnail_link,comments_disabled,ratings_disabled,description
"ImbkiI_F30I","FIGHT HIGHLIGHTS | Katie Taylor vs. Amanda Serrano","2022-05-01T11:00:07Z","UCurvRE5fGcdUgCYWgh-BDsg","DAZN Boxing","17","22.07.05","dazn|boxing|highlights|full fight|ko|knockout|top 10|The DAZN Boxing Show|Pelea|Boxeo|Pugile|dazn boxing|Katie Taylor|Amanda Serrano|Katie Taylor vs. Amanda Serrano fight|Katie Taylor vs. Amanda Serrano fight highlights|Katie Taylor vs. Amanda Serrano highlights|Katie Taylor highlights|Amanda Serrano highlights|Katie Taylor fights|Amanda Serrano fights","936486","19183","6257","https://i.ytimg.com/vi/ImbkiI_F30I/default.jpg","False","False","April 30th, 2022 -- Katie Taylor vs. Amanda Serrano from Madison Square Garden.Subscribe to our YouTube channel 👉  http://bit.ly/DAZNBoxingYouTubeDownload the DAZN app now 👉  http://bit.ly/DAZNYoutubeFollow DAZN Boxing On Social Media 👇Twitter: https://www.twitter.com/DAZNBoxingInstagram: https://www.instagram.com/DAZNBoxingFacebook: https://www.facebook.com/DAZNThe DAZN Boxing Show ► https://bit.ly/3EQ70HNDazn Rewind ► https://bit.ly/32iAaRT#Dazn #DaznBoxing #KatieTaylor #AmandaSerrano"
"js9qxptr-6w","Moving on...","2022-05-01T18:00:11Z","UC-kOXc3gBwksVfmndSEz7jg","WILDCAT","22","22.07.05","WILDCAT|I AM WILDCAT|Tyler Wine|Vlog|IRL|Announcement|PAX|Sub Goal|Trailer|Teaser","1344058","114292","3892","https://i.ytimg.com/vi/js9qxptr-6w/default.jpg","False","False","Subscribe: https://youtube.com/TylerWinePAX Vlog: https://www.youtube.com/watch?v=2UIPJLDyEaw"
"0VrCKKDjLkM","From 1st Round NFL Draft Prospect to Completely Undrafted! (What Happened To Justyn Ross?)","2022-05-02T00:30:00Z","UCazhpToa5Z07lgnUL6fYdEw","FlemLo Raps","17","22.07.05","FLEMLO RAPS|justyn ross|justyn ross undrafted|justyn ross injury|justyn ross vs alabama|justyn ross freshman highlights|justyn ross draft|justyn ross spinal injury|justyn ross clemson highlights|what happened to|american football|nfl|2022 nfl draft|nfl draft news|justyn ross 2022|justyn ross vs|justyn ross draft projection|justyn ross nfl","366815","12270","1621","https://i.ytimg.com/vi/0VrCKKDjLkM/default.jpg","False","False","Sponsored by Manscaped. Learn more about Testicular Cancer and get 20% OFF @Manscaped with promo code TCSFLEMLO at https://manscaped.com/tcs #sponsored #shavetosave Get the new Lawn Mower® 4.0 TCS Special Edition trimmer and help @MANSCAPED raise awareness and give back to the Testicular Cancer Society. Visit https://manscaped.com/tcs to learn more about how to “check yo’ self” while enjoying your MANSCAPED™ products at home, or make a donation to https://testicularcancersociety.org today to save lives (and balls!)INSTAGRAM: https://www.instagram.com/flemloraps/TWITTER: https://twitter.com/FlemLoRaps"
"92Nog640NOU","I Survived 100 Days in River Monsters Minecraft... Here's What Happened","2022-04-30T15:30:00Z","UCiSVf-UpLC9rRjAT1qRTW0g","Forge Labs","20","22.07.05","minecraft|minecraft 100 days|100 days in minecraft|#minecraft|minecraft song|minecraft house|minecraft music|minecraft video|minecraft house tutorial|minecraft videos|100 days in minecraft modded","3567033","157049","13245","https://i.ytimg.com/vi/92Nog640NOU/default.jpg","False","False","I Survived 100 Days in River Monsters Minecraft... Here's What Happened. Download Monster Legends before May 10th and get my monster!https://monsterlegends.onelink.me/X4Sc/ForgeLabsNEW MERCH!https://forgelabs.ggSubscribe Here! http://bit.ly/ForgeLabsSubJoin My Discord! https://discord.gg/ForgeLabsTwitter: https://twitter.com/ForgeLabsPatreon: https://www.patreon.com/ForgeLabsEdited by Wisefish:https://www.youtube.com/channel/UCvsVl1wbrffYn5NuTysLHqQ#100Days #Minecraft #HardcoreMinecraft -----------------------------------------------------------------------------------------------------------I TRIED to Survive VR Hardcore Minecraft For 100 Days And This Is What Happenedhttps://youtu.be/jEEYUG1adZcVideo Includes:Hardcore Minecraft 100 DaysHardcore Minecraft 100 Days Gameplay100 Days in MinecraftHardcore Minecraft VR Lets PlayHardcore Minecraft VRHardcore Minecraft VR 100 Days 100 days in minecraft moddedEdited By WiseFish:https://www.youtube.com/channel/UCvsVl1wbrffYn5NuTysLHqQ"
"3l04R6SEtBY","Witness Vapes & Starts Driving During Testimony","2022-04-27T21:30:00Z","UCz8K1occVvDTYDfFo7N5EZw","Law&Crime Network","24","22.07.05","law and crime|law and crime network","12149489","188962","15514","https://i.ytimg.com/vi/3l04R6SEtBY/default.jpg","False","False","During the defamation trial on Wednesday, a pre-recorded deposition of Alejandro Romero was played in court. During his testimony, Romero was vaping and began to drive while answering questions. Johnny Depp and other members of the court struggled to maintain their composure, some even laughing.#JohnnyDepp #Testimony #FunnyWatch Law&Crime Network NOW  on YouTubeTV!https://tv.youtube.com/welcome/?utm_servlet=prod&zipcode=99202SUBSCRIBE TO OUR NEWSLETTER: https://bit.ly/LawandCrimeNewsletterOTHER WAYS TO WATCH LAW&CRIME NETWORK IN YOUR AREA:https://lawandcrime.com/where-to-watch/READ MORE GREAT ARTICLES FROM LAW&CRIME NETWORK HERE:https://lawandcrime.comSUBSCRIBE TO ALL OF Law&Crime Network YouTube Channels:Main Channel: https://www.youtube.com/channel/UCz8K1occVvDTYDfFo7N5EZwChannel B: https://www.youtube.com/channel/UCVXOqoOCYbi-iXChKAl6DTQChannel C: https://www.youtube.com/channel/UCXCLaaClAWQiTkl3pw9ZdLwChannel D https://www.youtube.com/channel/UCMV3pzWIhJGLYzoHyxBjjNw"
"je4Y5WyPsyk","Minecraft Manhunt, But The Game Changes Every Minute...","2022-05-01T19:00:53Z","UCBAu5h7VZBV2HaXBuZcz9aA","KIER and DEV","20","22.07.05","minecraft manhunt|minecraft speedrunner vs hunter|minecraft speedrunner vs assassin|minecraft manhunt but i secretly used|minecraft manhunt but|minecraft manhunt with a twist|extreme minecraft manhunt|dream manhunt|minecraft speedrunner vs mage|minecraft speedrunner vs 5 hunter|minecraft speedrunner vs 4 hunters|dream 4 hunters finale|dream 5 hunters|minecraft challenge|speedrunner vs hunter|4 hunters|tapl uhc|minecraft but lava rises every minute|redstone|VR","532664","33507","3375","https://i.ytimg.com/vi/je4Y5WyPsyk/default.jpg","False","False","Make sure you guys download Buff using our link in the description: https://link.buff.game/KierAndDev1Minecraft Manhunt, But Everything Changes Every Minute...Second Channel: https://www.youtube.com/channel/UCmTWO2mXHnRXHe6Jcb15I2w/featuredOur Twitch Channels:KIER and DEV: https://www.twitch.tv/kieranddevKier: https://www.twitch.tv/kierisbackandhungryDev: https://www.twitch.tv/realitsdevOur Twitters:Dev: https://twitter.com/RealItsDevKier: https://twitter.com/RealKierrrrOur Instagrams:https://www.instagram.com/realitsdev/https://www.instagram.com/kierrrr1/server: https://mcprohosting.com/ Use code kieranddev for 20% OFF your first month=======================================Join our discord server: https://discord.gg/d3FMVTkVh6=======================================Twitter: https://twitter.com/DevKier ======================================#Minecraft #MinecraftManhunt #Manhunt"
"sdk5KHP20Co","I Survived 100 Days with the Warden","2022-05-01T16:00:22Z","UCk56ama_RvUkMzexS8I9SIQ","Branzy","20","22.07.05","[none]","839149","27364","1122","https://i.ytimg.com/vi/sdk5KHP20Co/default.jpg","False","False","Minecraft's Warden is tough, but spending 100 Days with it turned out to be an emotional roller coaster. Is the Warden really a monster? Is 100 Days in Minecraft enough time to overcome your fear of the deep dark?This was done in Snapshot 21w15a so somethings have already changed, and more probably will."
"StoLyOWxnSE","Naomi Judd's Cause Of Death Leaves Fans With So Many Questions","2022-05-01T21:17:05Z","UCJ7dtuZhjFSJvb_CZjWJkng","The List","24","22.07.05","the list|naomi judd|fans|questions|passing away","375478","5078","1154","https://i.ytimg.com/vi/StoLyOWxnSE/default.jpg","False","False","Watch this video for more on why Naomi Judd's cause of death left fans with so many questions. #NaomiJudd #Musician #SingerRead full article: https://www.thelist.com/849039/naomi-judds-cause-of-death-leaves-fans-with-so-many-unanswered-questions/"
"yEktiuOE-3o","If Shark Tank was Asian 2","2022-05-01T17:00:10Z","UCP0_k4INXrwPS6HhIyYqsTg","Steven He","23","22.07.05","Steven He|Comedy|Sketches|Funny|laugh|tntl|skit|Asian|Chinese|Irish|shark tank|parody|oscar slap|meme|will smith|chris rock|uncle roger|joma tech|nathan doan|twosetviolin|collab|trending","1384267","99516","3092","https://i.ytimg.com/vi/yEktiuOE-3o/default.jpg","False","False","Download Mobile Legends: Adventure for free: https://bit.ly/n22StevenHe. Use the code CK3VEF2228D to get 20 Summons and 1000 Diamonds! Don’t forget to participate in the New Era events to obtain free heroes and other rewards!#MobileLegendsAdventure #idleRPG #ComedyTwoSetViolin: https://www.youtube.com/c/twosetviolin/Nigel Ng: https://www.youtube.com/c/mrnigelngJoma Tech: https://www.youtube.com/c/JomaOppaNathan Doan: https://www.youtube.com/channel/UCdyM...Jeenie.Weenie: https://www.youtube.com/channel/UCWc8...Patreon:https://www.patreon.com/stevenheInstagram:https://www.Instagram.com/thestevenhereddit:https://www.reddit.com/r/stevenhe"
"gSva10cuutQ","Hawaii vlog","2022-05-02T09:00:18Z","UCNYi_zGmR519r5gYdOKLTjQ","Jennierubyjane Official","22","22.07.05","YG Entertainment|YG|와이지|K-pop|BLACKPINK|블랙핑크|블핑|제니|Jennie|BLINK|블링크","2563444","455587","17157","https://i.ytimg.com/vi/gSva10cuutQ/default.jpg","False","False","#JENNIE #제니 #Hawaii #vlog #브이로그"
"ZTpRsEp-_04","I Turned an Entire Planet Into 100% Pure Lunacy - Planet Crafter","2022-04-30T19:01:22Z","UCto7D1L-MiRoOziCXK9uT5Q","Let's Game It Out","20","22.07.05","let's game it out|lets game it out|let game it out|let'sgameitout|letsgameitout|letgameitout|game it out|gameitout|lgio|josh let's game it out|let's game it out josh|lgio josh|josh lgio|let's game it out simulator|josh simulator|funny moments|planet crafter|the planet crafter|planet game|craft game|planet crafter game|planet crafter gameplay|let's game it out planet crafter|lgio planet crafter","2730144","121362","5137","https://i.ytimg.com/vi/ZTpRsEp-_04/default.jpg","False","False","JOIN MY STREAMS! ► https://www.twitch.tv/letsgameitoutMerch!  ► http://bit.ly/LetsGameItOutStoreSubscribe if you enjoy! ► http://bit.ly/letsgameitout_showTwitter ► https://twitter.com/letsgameitoutFacebook ► https://www.facebook.com/letsgameitoutWant more LGIO?!More Simulator Mayhem ► https://www.youtube.com/watch?v=UqaNKNgSxYI&list=PLrBjj4brdIRzn3ja4BfqYUForg0p-p5wiFunny Tycoon Games ► https://www.youtube.com/watch?v=UqaNKNgSxYI&list=PLrBjj4brdIRwf14QPGmfDXCQQrDs860igThe Finest One-Offs ► https://www.youtube.com/watch?v=zIOFGCbwJSs&list=PLrBjj4brdIRwKf72d6spk7fSHhwwYuQu1Some Truly Bizarre Games  ► https://www.youtube.com/watch?v=zIOFGCbwJSs&list=PLrBjj4brdIRyM5mUsHwPN0PH6UVNfeNl2#LetsGameItOut #Simulation #PlanetCrafterI Turned an Entire Planet Into 100% Pure Lunacy - Planet Crafter - Let's Game It Out----------Check it out on Steam ► https://store.steampowered.com/app/1284190/The_Planet_Crafter/More about The Planet Crafter (from Steam):From Hostile to HabitableYou are sent on an hostile planet with one mission: Make it habitable for Humans. You'll have to survive, collect resources, build your base and machines in order to heat the planet, create an atmosphere with enough oxygen and eventually geo-engineer an entire planet!Survive, Collect, CraftGather minerals and resources to survive. Craft all the tools you'll need in order to fulfill your mission. Explore old crashed ships and ruins and discover a planet full of mystery.Build you own baseYou'll need a base and all sorts of machines to make yourself at home, and be able to bring life on this planet!Key Features:Character Thirst, Oxygen, Temperature, Health MechanicsBase BuildingCraftingMining oresBuild machines to create atmospheric pressureBuild machines to heat the planetCreate a biosphere with oxygenCreate life on a planet!"
"CdzGHBUEMY8","President Biden complete remarks at 2022 White House Correspondents' Dinner (C-SPAN)","2022-05-01T02:40:29Z","UCb--64Gl51jIEVE-GLDAVTg","C-SPAN","25","22.07.05","WHCD|White House Correspondents' Dinner|Nerd Prom|WHCA|Biden|Joe Biden|President of the United States","886307","14910","7459","https://i.ytimg.com/vi/CdzGHBUEMY8/default.jpg","False","False","From C-SPAN coverage, President Biden remarks at the 2022 White House Correspondents' Dinner.   Watch the complete video here: https://www.c-span.org/2022-White-House-Correspondents-Association-Dinner/ Download the FREE C-SPAN Now App. https://www.c-span.org/c-spanNow/Discover the C-SPAN Video Library at https://www.c-span.org/quickguide/C-SPAN: Created by Cable in 1979. Offered as a public service.Subscribe to our YouTube channel: https://www.youtube.com/user/CSPAN Follow us:Facebook: https://www.facebook.com/CSPANTwitter: https://twitter.com/cspanInstagram: https://www.instagram.com/cspan/Subscribe:C-SPAN Podcasts: https://www.c-span.org/podcasts/Newsletters: https://www.c-span.org/connect/#cspan"
"OOwWgx2qcTM","Etho Plays Minecraft - Episode 567: A Tough Situation","2022-05-01T18:34:19Z","UCFKDEp9si4RmHFWJW1vYsMA","EthosLab","20","22.07.05","Minecraft|Minecraft Lets Play|Minecraft LP|Minecraft Gameplay|Farm|Etho|Minecraft Game|Minecraft Building|Minecraft Survival|Minecraft Mods|Redstone|House|Update|Snapshot|1.18|Caves and Cliffs","450389","77109","8278","https://i.ytimg.com/vi/OOwWgx2qcTM/default.jpg","False","False","Hey everyone, good to be back! Today's episode is a simple talk & cave style one where I try to explain a bit about what has been going on with my situation. We also check out a new cool and cozy double skeleton farm & mini farm setup.Twitter: http://www.twitter.com/EthoLPTwitchTV: http://www.twitch.tv/ethotv/World Download (550): https://drive.google.com/file/d/1aJ6we_pq1pqU_4ofgXD3ACfEGasBNBQn/view?usp=sharingReminder: People advertising, spamming, or being rude in the channel comments will be blocked."
"dOSr_EXx5SY","The WORST kidnappers in Australia","2022-04-30T14:00:01Z","UCtPrkXdtCM5DACLufB9jbsA","MrBallen","22","22.07.05","strange|dark|mysterious|true|story|scary|scary story|horror story|disturbing|narration|narrator|storyteller|storytime|storytelling|unsolved mystery|solved mystery|true crime|order of nine angles|cult|australian|australia|doomsday|sacrifice|human sacrifice|satan|satanic|symbols|kidnapped|kidnapping|kidnappers|cults|bush|forest|woods|alpine national park|national park|missing person|missing people|police|helicopter|lying|scam|fake|indian|Julian Buchwald|carolynne Watson","2611492","156853","17944","https://i.ytimg.com/vi/dOSr_EXx5SY/default.jpg","False","False","Get Current, use my code ballen500 for a chance to win and learn more 👉https://www.current.com/ballen500(Banking services provided by Choice Financial Group and Metropolitan Commercial Bank, Members FDIC.)*WARNING* -- Sexual content Time Stamp:#1 -- Roadkill -- 0:56 -- A man gets out of his car to inspect a dead animal on the side of the road🔊 For more stories check out the MrBallen Podcast: Strange, Dark & Mysterious Stories which is available on Spotify, Apple Podcasts, Amazon, Google and everywhere else you get your podcasts! (Links below)🔊 Podcast Links:Spotify: https://open.spotify.com/show/4NZWQf0wUsaT0tO9unlmra?si=eae7653b836f4370Apple: https://podcasts.apple.com/us/podcast/mrballen-podcast-strange-dark-mysterious-stories/id1608813794 Google: https://podcasts.google.com/feed/aHR0cHM6Ly9hbmNob3IuZm0vcy84MDg0YWQwYy9wb2RjYXN0L3Jzcw?sa=X&ved=2ahUKEwjYweb83Pr1AhWSGVkFHZD8BkAQ9sEGegQIARACAmazon Music: https://music.amazon.com/podcasts/6d261659-cc8d-478c-b052-19dfeb25dcf5/mrballen-podcast-strange-dark-mysterious-stories Follow me on Instagram, Twitter and the rest of social media 👉 @MrBallenMrBallen merchandise 👉 www.shopmrballen.comOur 2nd YouTube channel 👉 @MrBallen Shorts Spanish Language channel 👉 @MrBallen en Español Our most popular series: Top 3 places you CAN'T GO & people who went anyways... 👇👉https://www.youtube.com/watch?v=-lOsTCBg4fQ&list=PLgRgJrlop--N6CvmlUJ0nEwR_hasZvA6mPlease post story suggestions on our subreddit 👉 r/mrballen (https://www.reddit.com/r/mrballen/)Please invite the Like Button over for a nice, casual game night, and then as soon as they step foot inside your house, ambush them and then have a priest perform an exorcism on them. Also please subscribe/turn on all notifications so you don't miss any of our 1 or 2 weekly stories!**SPOILERS BELOW THIS POINT** Primary sources:1) Case 07: Julian Buchwald and Carolynne Watson -- @Casefile Presents -- https://www.youtube.com/watch?v=kUC4dWpdWmY2) Square Mile of Murder podcast episode: 34: Julian Buchwald Kidnapping -- https://squaremileofmurder.com/julian-buchwald-kidnapping/3) Nailed, bailed, jailed then derailed. The bush plot that cost a man his country -- https://www.theage.com.au/national/victoria/nailed-bailed-jailed-then-derailed-the-bush-plot-that-cost-a-man-his-country-20160427-gofuxd.html4) Man who kidnapped girlfriend for sex loses appeal in Oz -- https://www.deccanherald.com/content/213097/man-kidnapped-girlfriend-sex-loses.html5) Satanic Kidnap 'Fake' Claim -- https://www.dailyrecord.co.uk/news/uk-world-news/satanic-kidnap-fake-claim-9715876) Gippsland man appeals kidnap sentence -- https://www.abc.net.au/news/2011-08-25/gippsland-appeals-kidnap-sentence/28557507) Wanted German passed himself off as an Indian -- https://www.smh.com.au/national/wanted-german-passed-himself-off-as-an-indian-20091004-ghhv.html8) Wikipedia page for Alpine National Park -- https://en.wikipedia.org/wiki/Alpine_National_ParkMusic by: @CO.AG Music Intro video by :Tiktok @mr.poopniteInstagram @mr.poopnite_DISCLAIMER: All materials in these videos are used for entertainment purposes and fall within the guidelines of fair use. No copyright infringement intended. If you are, or represent, the copyright owner of materials used in this video, and have an issue with the use of said material, please send an email to mrballen@night.coCopyright © 2022 MrBallen. All rights reserved.#australia #kidnappers #mrballen"
"eFqPSQbaTPo","Building a 5 Acre Pond! (Adding Vegetation)","2022-05-01T23:31:42Z","UC8ha6SsRNvDGkwcPTCXkW3g","BamaBass","22","22.07.05","[none]","436128","20865","1509","https://i.ytimg.com/vi/eFqPSQbaTPo/default.jpg","False","False","Building a 5 acre pond for our two pet bass! Subscribe for weekly pond build videos: http://bit.ly/Bama_Bass Get 2 lbs. of ground beef for life with with a new ButcherBox subscription:https://bchrbox.co/BamabassBBDay 1 Pond Build: https://youtu.be/zZ49jSdHKWsDay 2 Pond Build: https://youtu.be/eb-WwV3FB1oDay 3 Pond Build: https://youtu.be/Ii_C0gu14WgDay 4 Pond Build: https://youtu.be/QmG8dmtany8Day 5 Pond Build: https://youtu.be/iL8-RPtT9ckDay 6 Pond Build: https://youtu.be/MOGtGnccRGwDay 7 Pond Build: https://youtu.be/Ho4AJF3NlJkDay 8 Pond Build: https://youtu.be/8yt0heEw_CUAdding Structure: https://youtu.be/bF-ObQ-tl5kFilling it with Water: https://youtu.be/PXcCzL_rgxoHurricane Update: https://youtu.be/iQuiaWysdsINew Pet Ducks: https://youtu.be/iCm7uHmej_YThe Final Chapter: https://youtu.be/hqhBLwQUb-8Big Problems: https://youtu.be/jOz8JIn4krwFilling it with Water: https://youtu.be/4oxkuPGt3rUFilling it with Water Part 2: https://youtu.be/aBjs9iwNe50Filling it with Water Part 4: https://youtu.be/tDbG7bi__L4Filling it with Water Part 5: https://youtu.be/pPUm6HCF97sFilling it with Water Part 6: https://youtu.be/YfdIG7LHYf4Filling it with Water Part 7: https://youtu.be/jSUAmIraAtUFilling it with Water Part 8: https://youtu.be/SALU9KG0l1UHydroseeding: https://youtu.be/ReI_vZcjtQkFixing a Leak: https://youtu.be/MeNjGeXtvqcAdding Fish: https://youtu.be/sT9TEEgaHCIInstalling Aerators: https://youtu.be/f0eVXgMTT8oUnderwater Lights: https://youtu.be/JpmeYKqffZESpring Planting: https://youtu.be/5vFBdETEtAcNew Fishing Cabin:  https://youtu.be/bv_obw2HeeU New Cabin Tour: https://youtu.be/SL1sMht8MpQStocking Shad: https://youtu.be/mSHYDnR_dRUFollow us on social media:http://facebook.com/bamabassofficialhttp://instagram.com/_bamabass_http://twitter.com/_bamabass_"
"HpcMKZUs2QY","Hermitcraft 9: Episode 4 - MEGA BASE PLANS","2022-04-30T20:00:03Z","UChFur_NwVSbUozOcF_F2kMg","Mumbo Jumbo","20","22.07.05","Hermitcraft 9: Episode 4 - MEGA BASE PLANS|Hermitcraft|Hermitcraft 9|Hermitcraft 9: Episode 4|MEGA BASE|Hermitcraft Season 9|Hermitcraft starter town|Hermitcraft starter base|starter base|Mumbo Jumbo Mega base|Mumbo|Mumbo Jumbo|Mega base|Hermit Grian|Grian|Minecraft mega base|Minecraft industrial district|industrial district|minecraft secure vault|secure vault","2559085","140238","10652","https://i.ytimg.com/vi/HpcMKZUs2QY/default.jpg","False","False","Visit http://www.audible.com/Mumbo or text mumbo to 500-500.And a big thank you to Audible for sponsoring this Hermitcraft episode.In this episode of Hermitcraft Season 9, Mumbo leaves the Hermitcraft starter town, the Hermitcraft starter base, and begins work on the new Mumbo Jumbo Mega base, which is neighbours with fellow Hermit Grian. This Minecraft mega base features a Minecraft industrial district, a minecraft secure vault and more. Filming channel: https://www.youtube.com/user/ThatMumboJumbo2Instagram: https://www.instagram.com/officialmumbo/Twitter: https://twitter.com/ThatMumboJumbo"
"WzgZi8RZxb0","IRL mini golf and games with @WILDCAT and @fourzer0seven!!","2022-05-01T23:45:41Z","UC1o9zvRwIqP_K5ByWs-EVwA","BigJigglyPanda","22","22.07.05","bigjigglypanda|big jiggly panda|gaming|bigjigglypanda laugh|bigjigglypanda laughing|bigjigglypanda rage|bigjigglypanda raging|big jiggly|panda|bigjigglypanda react|bigjigglypanda reaction|bigjigglypanda game|vlog|bigjigglypanda vlog|golf|golf it|mini golf|bigjigglypanda golf|fourzer0seven|wildcat|scotty|i am wildcat|iamwildcat|putt putt|mini golf irl|arcade|arcade games|wildcat vlog|fourzer0seven vlog","242267","16857","356","https://i.ytimg.com/vi/WzgZi8RZxb0/default.jpg","False","False","We finally tried it again. @scotty came down to visit @wildcat and I and we went out to a cool place to play some golf it IRL, aka, mini golf. Yes, I am typing key words here to get clicks. After crushing the competition in a hole in one challenge we went inside and played some arcade games! It was a ton of fun, hope y'all enjoy the video! Twitter -http://www.twitter.com/bigjigglypandaInstagram - http://instagram.com/bigjigglyMerch - https://shop.3blackdot.com/collections/big-jiggly-pandaFriends in the Video - Check Them Out!@fourzer0seven @Scotty @WILDCAT Outro Song - Gigglebytes by D1ofAquavibehttps://youtu.be/zyqmZgrZc9w"
"WgdABWxoAB4","The 2,000,000 Scoville Chicken Tender.... (HWHAP)","2022-05-01T05:41:03Z","UCd1fLoVFooPeWqCEYVUJZqg","Matt Stonie","24","22.07.05","Matt Stonie|Megatoad|Competitive Eating|Food Challenge|Speed Eating|Eating Challenge|Spicy Food|Spicy Challenge|Hot Wings|Ghost Pepper|Chicken Wing|Chicken Tender","5576829","247412","7313","https://i.ytimg.com/vi/WgdABWxoAB4/default.jpg","False","False","Get 10% off your first month! - https://www.betterhelp.com/stonie/Take charge of your Mental Health!Video Sponsored by : BetterHelpToday I'm taking on the HOTTEST Chicken Tender I've ever eaten!Houston''s Hot Chicken, here in Vegas, has a 2 Million Scoville chicken tender named the 'Houston we have a problem'. Can I handle the heat?ENJOY!!!---Socials & Stuff----FACEBOOK - https://www.facebook.com/mattmegatoadstonieINSTAGRAM - https://www.instagram.com/matt_stonieTWITCH - https://www.twitch.tv/mattstonieTIKTOK - https://vm.tiktok.com/ZMRheEAwc/TWITTER - https://www.twitter.com/mattstonieWEBSITE - http://www.mattstonie.comMailing Address:P.O. Box 46908Las Vegas, NV 89102Credits:Royalty Free Music by http://audiomicro.com/royalty-free-musicMusic and Sound Effects from Video CoPilot's Proscores & Design Studio FXMusic from Epidemic Sounds"
