video_id,title,publishedAt,channelId,channelTitle,categoryId,trending_date,tags,view_count,likes,comment_count,thumbnail_link,comments_disabled,ratings_disabled,description
"ktluMBr4VXM","Gervonta Davis KO's Rolando Rolly Romero in RD6","2022-05-29T05:05:17Z","UCWXYAGB9SadlL6p5Bb66wWw","Premier Boxing Champions","17","22.29.05","Boxing|PBC|premier boxing champions|ko|tko|knockouts|al haymon|showtime boxing|wilder|broner|fighting|highlights|wbo|wba|wbc|ibo|ibf|boxing highlights|gervonta davis|gervonta davis knockouts|gervonta davis highlights|gervonta tank davis|tank davis|davis vs romero|davis ko romero|davis knockout|Davis vs Romero highlights|davis vs romero KO|rolly romero ko|gervonta davis KO|rolly romero|rolando romero|romero knockout|gervonta davis vs rolando romero","2131440","25717","5303","https://i.ytimg.com/vi/ktluMBr4VXM/default.jpg","False","False","Gervonta Davis said he wanted to deliver punishment to Rolando Rolly Romero for all the talking he's done in the build up the fight. In RD6 he lands a beautiful left hook that sent Romero face first into the ropes.An incredible finish to an incredible fight.#DavisRomero #GervontaDavis #RollyRomeroVisit PremierBoxingChampions.com for more info.SIGN UP FOR FIGHT ALERTS: https://pbcham.ps/FightAlertsFOLLOW US:https://twitter.com/premierboxinghttps://instagram.com/premierboxinghttps://www.facebook.com/premierboxingchampions"
"2jrcndaXKJI","Liverpool vs. Real Madrid: Extended Highlights | UCL Final | CBS Sports Golazo","2022-05-28T22:03:05Z","UCET00YnetHT7tOpu12v8jxg","CBS Sports Golazo","17","22.29.05","Champions League|Europa League|Soccer|UEFA|UCL|European Soccer|European Football|European Futbol|UEL","1095138","15626","2499","https://i.ytimg.com/vi/2jrcndaXKJI/default.jpg","False","False","Extended Highlights, Presented By HeinekenTwo of Europe’s most legendary clubs face off in Paris for its most prestigious prize as Mo Salah leads out Liverpool versus Karim Benzema and Real Madrid.Stream every UEFA Champions League match live on Paramount+:https://www.paramountplus.com/shows/uefa-champions-league/ #UCL #ChampionsLeague #UEFA #RealMadrid #Liverpool"
"6zaQCau4KH0","Gervonta Davis Said He Didn't Even Throw That Hard On Romero KO Punch | SHOWTIME PPV","2022-05-29T05:22:13Z","UCFPoJNd0d4k1H9A6UOlikcg","SHOWTIME Sports","17","22.29.05","showtime|shosports|sports|Floyd Mayweather|Money Mayweather|Logan Paul|Jake Paul|Paul Brothers|Showtime Boxing|Boxing|Shosports|Showtime Boxing PPV|Showtime PPV|Press Conference|Tyron Woodley|Paul Woodley|boxer|Ufc|Canelo Alvarez|Mexican Boxer|Biggest Boxing Fights Ever'|Gervonta Davis|Rolando Romero|Rolly Romero|Davis Romero|Tank Davis|Tank Davis KOs|Knockouts|Gervonta Davis Knockouts|Tank KOs Romero|Davis Knocksout Romero","1053213","18289","3289","https://i.ytimg.com/vi/6zaQCau4KH0/default.jpg","False","False","After knocking out Rolly Romero, Gervonta Davis spoke with Jim Gray about his big win, future plans, and his power. #showtime #showtimeppv #boxing #gervontadavis Don't miss out on the action! Visit the below links to sign up for reminders!Championship Boxing: https://s.sho.com/3oiG6REBellator: https://s.sho.com/3eSmXDbSubscribe to the SHOWTIME Sports YouTube channel: https://goo.gl/s8CWVTFollow SHOWTIME Sports:Facebook: https://www.facebook.com/ShoSports/Twitter: https://twitter.com/SHOsportsInstagram: https://instagram.com/shosportsOfficial Site: https://www.sho.com/sportsFollow SHOWTIME Boxing:Facebook: https://www.facebook.com/ShoBoxingTwitter: https://twitter.com/ShowtimeBoxingInstagram: https://instagram.com/showtimeboxingSnapchat: https://www.snapchat.com/add/showtimeboxingTumblr: http://showtimeboxing.tumblr.com/Follow SHOWTIME Basketball:Instagram: https://www.instagram.com/showtimebasketballTwitter: https://twitter.com/shobasketballFollow ALL THE SMOKE:Instagram: https://www.instagram.com/allthesmoke/YouTube: https://bit.ly/2OLkr50 Follow BELOW THE BELT with Brendan Schaub:Facebook: https://www.facebook.com/BelowTheBeltSHOTwitter: https://twitter.com/btbshowtimeInstagram: https://www.instagram.com/belowthebelt/YouTube: http://s.sho.com/BelowtheBeltFollow MORNING KOMBAT:Instagram: https://www.instagram.com/morningkombat/YouTube: https://bit.ly/2lPpvsjFollow INSIDE THE NFL:Facebook: https://www.facebook.com/insidetheNFLTwitter: https://twitter.com/insidetheNFLInstagram: https://www.instagram.com/insidetheNFL/Follow 4th and Forever:Instagram: https://www.instagram.com/4thandforever/YouTube: http://bit.ly/30iZqSZFollow SHOWTIME:Facebook: https://www.facebook.com/showtimeTwitter: https://twitter.com/ShowtimeInstagram: https://instagram.com/showtime/Youtube: https://www.youtube.com/user/SHOWTIMEOfficial Site: https://www.sho.com/"
"-4fSxhT1lqo","ROLLY ROMERO IMMEDIATE REACTION AFTER KNOCKOUT LOSS TO GERVONTA DAVIS; WANTS REMATCH ASAP","2022-05-29T05:51:15Z","UCmxZw7N4Jyljr1RbSs4Ymaw","FightHype.com","17","22.29.05","[none]","642829","7894","4902","https://i.ytimg.com/vi/-4fSxhT1lqo/default.jpg","False","False","Multi-division world champion Gervonta Davis and top lightweight contender Rolly Romero faced off in their highly-anticipated May 28 showdown at Barclays Center in Brooklyn, New York. You don't want to miss what went down before, during, and after the fight. Check it out!"
"vRR0NzkVUq4","Film Theory: Encanto, The Madrigal Family SECRET!","2022-05-28T17:05:05Z","UC3sznuotAs2ohg_U__Jzj_Q","The Film Theorists","1","22.29.05","encanto|encanto theory|disney|disney theory|dolores|encanto dolores|encanto secret|encanto song|encanto songs|we don't talk about bruno|we don't talk about bruno song|encanto tiktok|mirabel|bruno|bruno encanto|encanto pressure|movie encanto|full movie encanto|encanto soundtrack|bruno song|tiktok encanto|encanto all songs|mirabel theory|encanto miracle|film theory|film theorists|matpat|film theory encanto|disney encanto|encanto movie","1199349","75635","3979","https://i.ytimg.com/vi/vRR0NzkVUq4/default.jpg","False","False","Get your Theory Wear! ► https://theorywear.com/By the end of Encanto, we see Dolores united with her prince charming - or at least that is what it seems like from the outside. Theorists, when watching Encanto for the 100th time, my mind started thinking a little too hard about the whole Madrigal family and their magical, secluded town. Let's just say MAYBE they should hold off on the wedding for a while...Get your Theory Wear! ► https://theorywear.com/Don't miss a Film Theory! ► http://bit.ly/1dI8VBH  Need Royalty Free Music for your Content? Try Epidemic Sound.Get Your 30 Day Free Trial Now ► http://share.epidemicsound.com/TheFilmTheoristsMORE FILM THEORIESRick's True CRIME! | Rick and Morty ►► https://bit.ly/2MVhP2WWill MORTY KILL RICK?! ►► https://bit.ly/2qKFFFVHow PICKLE RICK Functions! ►►► https://bit.ly/2JvU4fTBlair Witch's SECRET DANGER!  ► https://bit.ly/2qhmv7aAriel & Hercules Are RELATED?! ► https://bit.ly/32WnVWiCredits:Writers: Matthew Patrick and Zach StewartEditors: Forrest Lee and Danial BanditRants KeristoufiAssistant Editor: Caitie Turner (viridianrosette)   Sound Editor: Yosi Berman    #Encanto #Disney #Mirabel #Dolores #Bruno #EncantoSongs #WeDontTalkAboutBruno #EncantoTheory #DisneyTheory #Theory #FilmTheory #Matpat #Trailer"
"eXVaJDG0DNA","Moneybagg Yo - See Wat I’m Sayin [Official Music Video]","2022-05-27T16:00:26Z","UC7r-J2sPQVv9i3iNcte1u-A","MoneybaggYoVEVO","10","22.29.05","Moneybagg|See|Wat|I’m|Sayin|CMG/N-Less/Interscope|Records|Hip|Hop","1934979","64166","2971","https://i.ytimg.com/vi/eXVaJDG0DNA/default.jpg","False","False","“See Wat I’m Sayin” Out Now: http://MoneybaggYo.lnk.to/SeeWatImSayin  Follow Moneybagg Yo:https://www.instagram.com/moneybaggyo/https://twitter.com/moneybaggyohttps://www.facebook.com/moneybaggyoLyrics: Tay Keith fuck these n*ggas upSee wat I’m sayin (sayin)I’ma make em see wat I’m sayinFirst they want smoke now they just playinN*ggas real hoes, know wat I’m sayinDat’s what I’m sayinSee wat I’m sayinI’ma make em see wat I’m sayinTryna f*ck me soon as I landTurned her out she rep my brandGoFour b*tches can fit in the PhantomI be with Baby when I’m in AtlantaSince I got money they calling me handsomeI fell in love with this girl she a dancerUgh , I think her name was BreannaI get mad at the hoe blocked her numberHead was trash so I had to dump herLeft her a**’d out like MadonnaGoGet it in by the load break it down sell it wholeEither way I’m doing numbers (real sh*t)20 M’s to the good I need some moreTryna buss the clock for a Honda M’sSmashing this nasty lil b*tch I hit from the back, pulling her frontalEvery day I can give it, I’m really too humbleF*ck it I’m shirt and top off for the summerGave ItI’ma make em see wat I’m sayin (visual)Hopping out the jet with them bands (typical)Load up the Drac leave em laying (critical)Gloc with a switch in yo hand (finish em)I know a b*tch got more money than her baby daddyN*gga just sad (pitiful)I know a click got more reppers than steppers1 gone shoot sumn maybe outta 10 of emI’ma make em see wat I’m sayinFirst they want smoke now they just playinN*ggas real h*es, know wat I’m sayinDat’s what I’m sayinSee wat I’m sayinI’ma make em see wat I’m sayinTryna f*ck me soon as I landTurned her out she rep my brandGoWhat should I go get nextPaint job wet on the new blue VetteCup full of purple I f*ck with the setCounting pink 50’s on a all black jetOrange HellCat when I wanna stand outRed & black Rolls when I wanna kick back5 rings on never gotta hand outSnuck percs on a plane with a pack of Tic-Taks (I Skated)One thing about dude he gone give it he in his bag (too deep)Put this sh*t together like Chinese letters sauce on the walk up (ooh wee)Know she get around she think I’m greenTalm bout she falling to deepYo time has expired 14 days b*tch yo game too weakWhy they feel like they can play with you BaggN*ggas want smoke til that fire on they a**Tell em pop out with they put up a** (please)Want some get back I’m more mad than sadTalk ya a** off (speak)Ain’t no n*gga doing what they say when they facing meA see me and get little run off four flats taking off like they racing me (poom gone)See wat I’m sayin (sayin)I’ma make em see wat I’m sayinFirst they want smoke now they just playinN*ggas real h*es, know wat I’m sayinDat’s what I’m sayinSee wat I’m sayinI’ma make em see wat I’m sayinTryna f*ck me soon as I land#MoneybaggYo #SeeWatImSayin Music video by Moneybagg Yo performing See Wat I’m Sayin. CMG/N-Less/Interscope Records; © 2022 CMG/N-Less/Interscope Recordshttp://vevo.ly/i9Ln8F"
"eqZ_E9nKdoM","Minecraft NOOB vs PRO: LONGEST STAIRCASE BUILD CHALLENGE","2022-05-28T18:00:18Z","UCJHBJ7F-nAIlMGolm0Hu4vg","Maizen","20","22.29.05","Minecraft|Maizen","2490490","51425","1995","https://i.ytimg.com/vi/eqZ_E9nKdoM/default.jpg","False","False","Today, we're going head-to-head in a staircase building competition! The goal is to create the toughest, most difficult staircase into the sky! Who's staircase was your favorite?  We hope you enjoy our videos! Have a great day!Maizen Merchandise ► https://shop-maizen.myspreadshop.com/"
"mbxtaGuOp2w","OFFLINETV DRINKS WATER","2022-05-28T20:45:00Z","UCDK9qD5DAQML-pzrtA7A4oA","OfflineTV","20","22.29.05","OfflineTV|Scarra|Poki|Pokimane|Lily|LilyPichu|DisguisedToast|Toast|TwitchTV|twitch|Streaming|Vlog|Fail|Epic|Gamers|Streamers|OTV|OTV Plays|OfflineTV plays|Michael Reeves|Michael|Reeves|offlinetv|masayoshi|quarterjade|sydeon|offlinetv water|otv drinks water|offlinetv drinks water|water|water taste test|offlinetv taste test","665123","54161","1549","https://i.ytimg.com/vi/mbxtaGuOp2w/default.jpg","False","False","Stay hydrated 💦Use code OFFLINETV16 for up to 16 FREE MEALS + 3 Surprise Gifts across 6 HelloFresh boxes plus free shipping at https://bit.ly/3JhWCv6!----------------------------------------------👕 Merch & Apparel:• OfflineTV - https://offlinetv.com📸 Follow OfflineTV:• Twitter - https://www.twitter.com/OfflineTV• Instagram - https://www.instagram.com/OfflineTV• TikTok - https://www.tiktok.com/@offlinetv• Reddit - https://www.reddit.com/r/offlineTV📝 OfflineTV Roster:• Scarra - https://twitter.com/scarra• Pokimane - https://twitter.com/pokimanelol• LilyPichu - https://twitter.com/LilyPichu• Disguised Toast - https://twitter.com/DisguisedToast• Michael Reeves - https://twitter.com/michaelreeves• QuarterJade - https://twitter.com/QuarterJade• Masayoshi - https://twitter.com/ItzMasayoshi• Sydeon - https://twitter.com/Sydeon• Yvonnie - https://twitter.com/yvonnie🎵 Music:•  Hyper Potions - Delfino Plaza (Remix)🎥 Producer & Director:• Max - https://twitter.com/MaxOlivo🎞️ Edited by: • Stevo - https://twitter.com/stevotevo#OfflineTV #Drinks #Water"
"G2X4U0EqHdc","I MOVED TO JAPAN","2022-05-28T19:30:10Z","UCFeqAfEuKm7lIg2ddQzh61A","Emirichu","22","22.29.05","[none]","946657","112793","6169","https://i.ytimg.com/vi/G2X4U0EqHdc/default.jpg","False","False","Check out Honkai: Star Rail here! : https://hoyo.link/2a8c2DA6 Pre-register to get a chance to try out the beta and a PlayStation 5!Gamersupps Collab Countdown: https://gamersupps.gg/products/waifu-cups-x-emirichuOutro Animation: https://twitter.com/flashjomm?lang=enMusic: Song : Daystar - A New Day! https://youtu.be/KkLH5KSQteYOutro Music: https://www.youtube.com/watch?v=71-FRUw4GK4Cute Food Prints: https://twitter.com/bestrolleverSophie Print: https://twitter.com/_oceaninspace?lang=enMY LINKS: Instagram: https://www.instagram.com/emirichuu/Twitter: https://twitter.com/EmirichuYTTwitch: https://www.twitch.tv/emirichuyt5:40 Sponsor7:00 Apartment Tour"
"4HLDaBGdnLc","Star Wars Jedi: Survivor - Official Teaser","2022-05-27T21:02:00Z","UCOsVSkmXD1tc6uiJ2hc0wYQ","EA Star Wars","20","22.29.05","Star Wars|star wars jedi survivor|jedi survivor|star wars survivor|star wars fallen order 2|jedi fallen order 2|survivor|fallen order 2|star wars game|SW|Jedi: Survivor|Survivor|JS|Jedi: Fallen Order|SWJFO|JFO|Jedi: Fallen Order 2|JFO 2|Cal Kestis|BD-1|Lightsaber|EA|EA Star Wars|EASW|Respawn|Respawn Star Wars|jedi fallen order|star wars jedi fallen order|star wars jedi trailer|star wars trailer|swjfo2","3176496","164846","9895","https://i.ytimg.com/vi/4HLDaBGdnLc/default.jpg","False","False","“What is your next move, Jedi?”Experience the next chapter of Cal Kestis’ journey in STAR WARS Jedi: Survivor - coming in 2023.Picking up five years after the events of STAR WARS Jedi: Fallen Order, Jedi: Survivor is a third person, narrative-driven action-adventure game from Respawn Entertainment, developed in collaboration with Lucasfilm Games.#jedisurvivor #starwarsjedisurvivor #starwars"
"QW3uHakpzn4","What if I Become EVERYONE? (Poppy Playtime: Chapter 2)","2022-05-28T13:35:09Z","UCWo0VLsZSEoD3zR0vSshTTw","POPPY PLAY GAME","20","22.29.05","poppy|poppy playtime|huggy wuggy|huggy wuggy glitches|poppy glitch|poppy bugs|poppy playtime secrets|poppy playtime glitches|poppy playtime update|poppy playtime 2|poppy playtime mod|poppy playtime game|poppy playtime hack|poppy playtime funny|poppy playtime secret|poppy playtime mobile release|poppy mobile|poppy playtime chapter 2|poppy playtime chapter 2 gameplay|huggy wuggy chapter 2|poppy playtime chapter 2 trailer|puppy playtime","2855957","33169","426","https://i.ytimg.com/vi/QW3uHakpzn4/default.jpg","False","False","What if I Become EVERYONE? (Poppy Playtime: Chapter 2)Did you like the video? Subscribe to the channel!Hello! Welcome to the POPPY PLAY GAME channel! On my channel you will find cool videos on the game Poppy Play Time.__________________poppy playtime,huggy wuggy,poppy playtime huggy wuggy,poppy playtime gameplay,poppy,poppy playtime horror game,poppy playtime mod,poppy playtime secrets,horror game,poppy playtime game,poppy playtime chapter 1,poppy playtime logic,huggy wuggy poppy playtime,poppy playtime mods,poppy playtime hack,hacking poppy playtime,huggy wuggy mod,poppy playtime funny,poppy playtime secret,from huggy wuggy,huggy wuggy was able to cry,he ran away,in the pit,able,poppy,poppy playtime,huggy wuggy,hugy wugy,huggy wuggy glitches,kissy missy,poppy glitch,poppy bugs,poppy playtime 2 chapter,poppy playtime secrets,poppy playtime glitches,poppy playtime update,poppy woppy,woppy"
"ydktnHRHzDc","I'm pissed off.","2022-05-28T17:00:33Z","UC2mP7il3YV7TxM_3m6U0bwA","jschlattLIVE","24","22.29.05","jschlatt|jschlattlive|jschlatt livestream|schlatt|livestream|twitch|jschlatt twitch|jschlatt livestream highlights","1155951","119358","5181","https://i.ytimg.com/vi/ydktnHRHzDc/default.jpg","False","False","NEW RAMMIE DROP THIS TUESDAY @ 3PM ET: https://rammie.comSchlatt talks about why he hates airplane wifi so much.Twitch: https://twitch.tv/schlattTwitter: https://twitter.com/jschlattInstagram: https://instagram.com/jschlattEditing by wheatskins: https://twitter.com/wheatskins_"
"8yS-Twk0Okk","100 Games - [Minecraft Bedwars]","2022-05-28T17:00:12Z","UC9FkeEFIGd9FXRfxpTltXYA","Luke TheNotable","20","22.29.05","luke thenotable|luke|the|notable|100 days|minecraft 100 days|100 days in|bedwars|100 days in bedwars|minecraft hardcore|minecraft bedwars|100 days minecraft|100 days minecraft modded|hardcore minecraft survival|100|100 drops|100 games|100 Games - [Minecraft Bedwars]|100 days - [minecraft bedwars]|100 games bedwars|bed wars|minecraft pvp|hypixel bedwars|i played 100 games of bedwars|surviving 100 days minecraft","425253","33659","2655","https://i.ytimg.com/vi/8yS-Twk0Okk/default.jpg","False","False","In this video, Luke TheNotable will play 100 Games of Minecraft Bedwars. This Minecraft minigame is one of the most popular in existence. Watch him try to god bridge and butterfly click his way to victory! Join the Luke TheNotable Discordhttps://discord.com/invite/lukethenotableFollow me on Twitter!! - https://twitter.com/LukeTheNotable Thumbnail Art - Maederhttps://twitter.com/itsmaederFollow Tors! https://twitter.com/TorsThe"
"4H1gCbxa_ls","Real Madrid's Champions League dressing room celebrations!","2022-05-29T00:48:05Z","UCWV3obpZVGgJ3j9FVhEjF2Q","Real Madrid","17","22.29.05","Real Madrid|Madrid|Real Madrid CF|Madridistas|Santiago Bernabéu|Bernabéu|Hala Madrid|Carlo Ancelotti|レアル・マドリード|ريال مدريد|레알 마드리드|Real Madrid Champions League|Champions League|UEFA Champions League|Champions League winners|Liverpool 0-1 Real Madrid|Liverpool vs Real Madrid|Liverpool - Real Madrid|Liverpool v Real Madrid|Vinicius|Vinicius Junior|Vini Jr.|Karim Benzema|Campeones|Champions|European Cup|Stade de France","3671410","169860","5119","https://i.ytimg.com/vi/4H1gCbxa_ls/default.jpg","False","False","Step inside the Real Madrid dressing room and see how Carlo Ancelotti's players, including Vini Jr., David Alaba, man of the match Thibaut Courtois and Karim Benzema, celebrated winning the club's 14th Champions League title! After beating Liverpool 1-0 at the Stade de France, Real Madrid celebrated like heroes in the dressing room - and you won't want to miss this video!#CHAMP14NS | #UCL🎥  SUBSCRIBE YOUTUBE: https://www.youtube.com/subscription_center?add_user=realmadridcf📱 FOLLOW US FACEBOOK: https://facebook.com/realmadridINSTAGRAM: https://instagram.com/realmadridTWITCH: https://www.twitch.tv/realmadridTWITTER: https://twitter.com/realmadridSNAPCHAT: https://snapchat.com/add/realmadrid💳 BECOME A MADRIDISTA: https://www.realmadrid.com/en/fans/madridistas/international🙌 JOIN THE MADRIDISTA NATION: https://www.facebook.com/becomesupporter/RealMadrid/?entrypoint_surface=youtube"
"lO1Oha6n6wM","Camila Cabello - UEFA Champions League Final 2022 Opening Ceremony","2022-05-28T22:09:08Z","UCio_FVgKVgqcHrRiXDpnqbw","Camila Cabello","24","22.29.05","[none]","2047076","125451","5384","https://i.ytimg.com/vi/lO1Oha6n6wM/default.jpg","False","False","Camila Cabello performing at the opening ceremony of the 2022 UEFA Champions League Final, presented by Pepsi Global, at Stade de France in Paris.Listen to Familia: https://camilacabello.lnk.to/FamiliaShop Camila Cabello Merch: https://camilacabello.komi.io/Bam Bam available at: https://CamilaCabello.lnk.to/BamBam Follow Camila Cabello:https://twitter.com/camila_cabellohttps://www.instagram.com/camila_cabellohttps://www.facebook.com/camilacabellohttps://www.camilacabello.comSubscribe to the official Camila Cabello YouTube channel: https://CamilaCabello.lnk.to/subscribe"
"M6H4dLs9kGU","WE ATTEMPTED THE DEADLY SWIM (Alcatraz to San Francisco)","2022-05-28T15:00:07Z","UC4ijq8Cg-8zQKx8OH12dUSw","Kara and Nate","19","22.29.05","alcatraz prison|alcatraz prisoners|alcatraz escape|san francisco|alcatraz prison escape|alcatraz prison tour|alcatraz prison history|swim alcatraz|swimming from alcatraz to san francisco|swim from alcatraz|al capone|alcatraz|california|california travel vlog|travel|vlog|couple vlog|daily vlog|alcatraz tour|alcatraz swim|physical challenge|escape from alcatraz|alcatraz documentary|alcatraz movie|alcatraz island|alcatraz museum","644990","29069","2054","https://i.ytimg.com/vi/M6H4dLs9kGU/default.jpg","False","False","We swam from Alcatraz to the San Francisco shore! Do you think you could do it?! 🦈 Get Surfshark VPN at https://surfshark.deals/karaandnate - Enter promo code KARAANDNATE for 83% off and 3 extra months for FREE! Credits:Thank you Pacific Open Water Swim Co. for keeping us safe!: https://www.pacificswim.co/ Jeff Cooperman: in-water GoPro footageChristopher Kam:  excellent footage of San Francisco and our entire swim :)Ben Possehl: zoom footage from shoreEpisode 825 | San Francisco, CA | Filmed May 2022✈️ We created FareDrop to help you score super cheap international flights! Try it risk free and get flight deals up to 80% off ➡️ https://faredrop.app/ytd_220129 ⬅️📸 Follow us on Instagram for behind the scenes content! @karaandnate https://www.instagram.com/karaandnate/ 📧 Sign up for our Sunday Summary email - https://karaandnate.com/sunday-summary/🎶 Download the copyright free songs we used in this episode: http://bit.ly/epidemic_sound——————————————————Who are Kara and Nate?! Watch our documentary here: https://www.youtube.com/watch?v=FuFv4iF8wgg&t=1sOriginally from Nashville, Tennessee, we got married 2013 and were super “normal.” I was a teacher and Nate started a small printing business from the spare bedroom of our apartment. We discovered the world of “travel hacking” & became obsessed. So after 2 years of obsessively saving $35k and over 2 million miles and points, we sold our cars and apartment and left home January 10, 2016 for a “one year” trip around the world. Our goal was to see as many places as possible before we ran out of money and went home to “normal life.” We started this travel vlog to share our experiences with friends and family, but quickly fell in love with this lifestyle and did everything we could to keep going. 4 years later, we achieved our new goal of visiting 100 countries and all 7 continents. We had no plans to slow down, until 2020 forced us to ;) Which is when we bought a converted van to start exploring our own country for the first time. Van life was a major adjustment and so different than flying every week like we were used to, but we are incredibly thankful to be able to continue doing something we love every day. 😊🎥🌎  #travel #travelvlog #alcatraz 0:00 Our biggest fear0:50 Why are we doing this?!3:41 Seeing Alcatraz for the first time4:19 INSIDE Alcatraz (prison tour)5:50 What we are wearing to swim7:29 BEST VPN8:35 MORNING OF THE SWIM12:42 JUMPING IN the San Francisco Bay19:19 Our final thoughts on the swim"
"KM0V1sMFjyA","Shipping Weird Items Prank","2022-05-28T21:30:40Z","UCpn_ODet9knMmEj5DB0_KnQ","Kanel Joseph","24","22.29.05","kanel|kanel joseph|pranks|prank|vlog","237934","19253","1384","https://i.ytimg.com/vi/KM0V1sMFjyA/default.jpg","False","False","Thanks for watching! You guys are the best!Merch: https://kaneljoseph.com/Instagram-  https://www.instagram.com/kaneljoseph/Twitter-  https://twitter.com/kaneljosephFacebook- https://www.facebook.com/mrkaneljosephBusiness Email: kaneljosephcontact@gmail.com"
"ErejfkJa6FE","I Survived 50 Hours in Fortnite","2022-05-28T18:04:14Z","UCvxfEIG3PHpgM0TMJJ_SH-w","Jarvis","22","22.29.05","I Survived 50 Hours in Fortnite|fortnite|jarvis|faze jarvis|jarvis fortnite|jarvis banned|banned|surviving|i survived|50 hours|surviving in fortnite|playing fortnite again|jarvis plays fortnite again|jarvis epic games|i protested at epic games hq|unbanned|faze jarvis unbanned|faze jarvis fortnite|faze fortnite","417617","17621","764","https://i.ytimg.com/vi/ErejfkJa6FE/default.jpg","False","False","Thank you Celsius for sponsoring today's video!Find some Celsius in a store near you - https://www.celsius.com/buy-locate/I Survived 50 Hours Playing Fortnite🕺 TikTok: @jarvis📸 Instagram: @fazejarvis🐦 Twitter: @liljarviss"
