video_id,title,publishedAt,channelId,channelTitle,categoryId,trending_date,tags,view_count,likes,comment_count,thumbnail_link,comments_disabled,ratings_disabled,description
"mX7N09dSDNY","Johnny Depp talks to shocked fans from his Cadillac truck on final day of trial","2022-05-28T03:35:14Z","UCrIe9KlOpcj6Osp6bu2j6DQ","Nicholas Ballasy","24","22.29.05","news|politics|congress|house|white house|democrats|democrat|republican|Donald trump|Joe biden|2021|interview|washington|Washington DC|D.C.|Johnny depp|amber heard|trial|Fairfax county|court|courthouse|Camille vasquez|ben chew|Benjamin chew|celebrites|fans|super fans|Judge Penny Azcarte|virginia|Washington post|newspaper|op-ed|opinion|article|report|media|spectators|pirates|aquaman|movie|movies|film|Pirates of the Caribbean|dating rumors|bob Marley|lawyer","2343501","41371","5631","https://i.ytimg.com/vi/mX7N09dSDNY/default.jpg","False","False","Actor Johnny Depp talked to shocked fans from his truck on final day of his defamation trial with his ex-wife Amber Heard. Attorneys on both sides made their closing arguments. The jury will decide the verdict in the coming days.#JohnnyDepp #AmberHeard #CamilleVasquez #BenChew #DeppHeard #TeamJohnnyDepp #JusticeforJohnnyDepp #DeppVsHeard Contact:Nick@Nickballasy.comwww.twitter.com/nicholasballasy"
"GXltg6NJoso","Anuel AA - ¿Qué Nos Pasó? (Video Oficial)","2022-05-27T00:00:17Z","UCRI7hheejBbWS6etTNwMT0g","Anuel AA","10","22.29.05","Anuel AA|anuel|Free anuel|Emmanuel|Real hasta la muerte|New Music|Reggaeton|Trap|Latin Trap|2022|¿Qué nos Pasó?|que nos paso|Anuel AA - Que Nos Pasó? (Video Oficial)|anuelaa|video oficial|¿Que nos paso?|las leyendas nunca mueren|las leyendas nunca mueren anuel|LLNM","7983412","238749","18060","https://i.ytimg.com/vi/GXltg6NJoso/default.jpg","False","False","Anuel AA - Que Nos Pasó? (Video Oficial)#AnuelAA #QueNosPasoEscúchalo en tu plataforma favorita: https://orcd.co/quenospasoSuscríbete a mi canal ➡️  https://radi.al/AnuelAA 🎵 Stream/Download:  Redes Socialeshttps://www.facebook.com/Anuel2bleAofficial/https://twitter.com/_anuel_aahttps://www.instagram.com/anuel/https://www.anuelaa.com"
"aq7W3fHnEFE","Busting 1000 Most Dangerous Myths!","2022-05-28T14:45:01Z","UC70Dib4MvFfT1tU6MqeyHpQ","Preston","24","22.29.05","funny|challenge|family|comedy|preston|brianna","1849324","72533","5450","https://i.ytimg.com/vi/aq7W3fHnEFE/default.jpg","False","False","Busting 1000 Most Dangerous Myths! with Preston 👊👕 MERCH - http://www.firemerch.com 👀 FOLLOW ME HERE!🡆 TikTok - https://www.tiktok.com/@preston🡆 Instagram - https://instagram.com/prestonplayz🡆 Twitter - https://twitter.com/Preston🡆 PrestonShorts - https://bit.ly/2VrTLIr🎮 Join my Fan Discord! 🡆 http://discord.gg/Preston------------------------------🡆 Airrack - Humans VS Robots: 100 Challengeshttps://www.youtube.com/watch?v=p2nubPAIGcA🡆 Vy Qwaint - HACKERS ARE BACK!https://www.youtube.com/watch?v=EeQ7bHhi7nw🡆FaZe Rug - I Started A Family Channel w/ My Ex Girlfriend...https://www.youtube.com/watch?v=bbk7jfXPfAkAdditional music provided by Epidemic SoundClick here for a free trial! 🡆 http://share.epidemicsound.com/TBNR"
"yVkk1i-ngWc","Si Fuera Fácil - Grupo Marca Registrada (Video Oficial)","2022-05-27T04:00:11Z","UCLsOayAeOIiMN3xuhudiXug","RB Music","10","22.29.05","musica|banda|perdidos de sinaloa|pancho barraza|martin castillo|nuevos ilegales|x30|el jerry|gerardo coronel|los minis|fidel rueda|mariachi|musica de banda|musica nueva|norteño|lo mas nuevo|viejitas|mix|videos en 360|corridos|romanticas|cumbias|pikadientes de caborca","1257626","88427","1999","https://i.ytimg.com/vi/yVkk1i-ngWc/default.jpg","False","False","RB Music © Preseta:Artista:Grupo Marca RegistradaTema: Si Fuera FácilCompositor: Ángel Mondragón Disquera: RB MusicEscucha este tema aquí▶ https://ffm.to/sifuerafacilEscucha más tema como este▶ https://ffm.to/elcapitanhttps://ffm.to/lavidaesdurahttps://ffm.to/sisupieran__https://ffm.to/nomeacuerdo1 https://ffm.to/eldelasavionetasSigue y escucha a Grupo Marca Registrada en tu plataforma favorita:https://ffm.bio/grupomarcaregistradaSigue A RB Music :Instagram: https://www.instagram.com/rbmusicoficialFacebook:  https://www.facebook.com/RBmusicOfficial#MarcaRegistrada #GrupoMarcaRegistrada #RBMusic    RB Music © Contacto para contrataciones e informaciónCelular y whatsapp 📲+1 (562) 572-4229 Correo📩 RicardoRBMusic@gmail.com"
"VoukjkkUBf0","Rob49 ft. Lil Double 0 - Athlete (Official Video)","2022-05-27T20:00:11Z","UCUdD69ZjWzkzqutB1JeBEGw","ROB49","10","22.29.05","Rob49|Rob 49|Rob49 DeeDay|DeeDay|Rob 49 DeeDay|Rob49 Pent House|Rob49 Penthouse|HipHop|Hip-Hop|New Orleans Rap|NOLA Rapper|New Orleans|Louisiana Rapper|Louisiana Rap|Complex|SayCheese|Music Video|Say Cheese|Music|Video|Viral Rap|Viral Rap Video|Akademiks|Lil Wayne|Tik Tok|Rob49 Vulture Island|Vulture Island|Lil Baby Vulture Island|Rob49 Welcome To Vulture Island|Rob49 Birdman|Rob49 Lil Double 0 Athlete|Rob49 Lil Double 0|Lil Double 0|Athlete|Double","136265","3257","185","https://i.ytimg.com/vi/VoukjkkUBf0/default.jpg","False","False","Stream Welcome To Vulture Island here: https://Rob49.lnk.to/VultureMixtapeFollow Rob49 here: Instagram: https://www.instagram.com/rob49up/Twitter: https://twitter.com/rob49up#Rob49 #LilDouble0 #Athlete"
"Iynpoh8tlTE","What if Goku was Locked in the Time Chamber for millennia and Betrayed? Part 6","2022-05-28T00:15:09Z","UCA_x6x5duIO78InVbhOI_5A","Daiku Theories Dbs","22","22.29.05","[none]","374205","32803","1562","https://i.ytimg.com/vi/Iynpoh8tlTE/default.jpg","False","False","After the tournament of power, the gods would realize that goku would be a big problem, and they would decide to catch him, that's why I bring you the theory, what would happen if Goku was locked in the time chamber for millennia and was betrayed part 6."
"0raH73ZCvZI","If McDonald's Made a Phone","2022-05-27T21:00:00Z","UCR9NuNwCUIhMOLUQnLN7_WA","Kyle Exum","23","22.29.05","kyle exum|if apple made a restaurant|mcdonalds|mcdonalds be like|robbing a mcdonalds|when a robber tries to rob you but you're broke|the kahoot rap|robbing a subway be like|robbing an apple be like|robbing apple be like|the reason mcdonalds doesn't deliver|bassthoven|mcdonalds robbery|when you rob a subway|trap 3 little pigs|when you don't know you're being robbed|subway be like|travis scott|travy patty|mc|mcscuse me|getting kidnapped with an optimist","285631","33180","6844","https://i.ytimg.com/vi/0raH73ZCvZI/default.jpg","False","False","Thanks for Watching! Like, Subscribe and Comment! 250K Likes and I’ll respond to every comment up until the 250K mark! Text Me: +1 860-385-6295Discord: https://discord.gg/aU3t2e6Z2090 Merch:  https://montlaurel.com/products/mont-laurel-x-kyle-exum-collab-t-shirt?_pos=1&_sid=26016b9e4&_ss=rFollow My Social Media:Instagram: http://www.Instagram.com/KyleExumTikTok: Kyle Exum Twitter: http://www.Twitter.com/KyleExumFacebook: http://www.Facebook.com/KyleExumOfficial Apple Music:  https://music.apple.com/us/artist/kyle-exum/956157064Spotify:  https://open.spotify.com/artist/6EYpuJIDJshhN4CHCg43te?si=8ggbOm3rSAuRSwag2MV9iwStream my “Trap 3 Little Pigs” Song: https://fanlink.to/Trap3LittlePigsApple Music:  https://music.apple.com/us/album/trap-3-little-pigs-single/1468734263Spotify: https://open.spotify.com/track/3WoHA0OFlzXofpKnblSFmr?si=QVTzn8XmQ3ipfH1Wpce1JgSoundCloud: http://www.soundcloud.com/kyleexumYou can Buy my Trap 3 Little Pigs Book Here: Trap 3 Little Pigs (Lyrically Accurate Version): https://amzn.to/30qvtzdTrap 3 Little Pigs (Young Readers Version): https://amzn.to/2LGEG2aStream my “The Exum Household” Album: https://fanlink.to/TheExumHouseholdBusiness Email: kyleexum@select.coMerchandise: https://exumerch.com/———————————————————————————For anyone looking to start your own YouTube channel, here’s the equipment I use to make my videos:Camera: https://amzn.to/2szlclaLighting Set-Up: https://amzn.to/2W5KgxSTripod: https://amzn.to/2RXftnnComputer: https://amzn.to/2RWuDJSMicrophone (For Parodies & Raps): https://amzn.to/2T5xDkjCamera Microphone: https://amzn.to/2S59u0d"
"tbbveDpUZv4","Willow | Official Teaser Trailer | Disney+","2022-05-26T18:47:22Z","UCnwY6fAhE3ePu0F2nMP-DLg","Lucasfilm","1","22.29.05","[none]","2139225","0","3360","https://i.ytimg.com/vi/tbbveDpUZv4/default.jpg","False","True","This fall, a new adventure begins. ✨ Watch the teaser trailer for #Willow, an Original series streaming November 30, only on #DisneyPlus."
"Ssp5KhmDOvs","Ranking Your CURSED Tiktoks","2022-05-26T17:00:13Z","UC2mP7il3YV7TxM_3m6U0bwA","jschlattLIVE","24","22.29.05","jschlatt|jschlattlive|jschlatt livestream|schlatt|livestream|twitch|jschlatt twitch|jschlatt livestream highlights","1621198","145750","4394","https://i.ytimg.com/vi/Ssp5KhmDOvs/default.jpg","False","False","TRY GAMERSUPPS FOR FREE: https://gamersupps.gg/schlatt& use code SCHLATT for 10% off everything!Schlatt ranks your HILARIOUS tiktoks.Twitch: https://twitch.tv/schlattTwitter: https://twitter.com/jschlattInstagram: https://instagram.com/jschlattI asked you guys to send in your FAVORITE tiktoks, your CURSED tiktoks, your WEIRD tiktoks, your SCUFFED tiktokts, or whatever other word I can throw in here for keyword optimization. They were Hilarious, Embarrassing, and Downright Scary at times.Editing help by wheatskins: https://twitter.com/wheatskins_"
"SlohDPSLwKA","Destiny 2: DUALITY DUNGEON FOR DUMMIES! | Complete Dungeon Guide & Walkthrough!","2022-05-27T21:36:23Z","UCLM1eE8w_DZ89n4yIxVbffA","KackisHD","20","22.29.05","destiny|destiny 2|destiny 2 update|destiny 2 gameplay|destiny 2 exotic|destiny 2 witch queen|destiny 2 exotic quest|destiny 2 new season|destiny 2 season 17|destiny 2 dungeon|season of the haunted|destiny 2 season of the haunted|destiny 2 trailer|vestige of dread|opulent key|nightmare containment|solar 3.0|destiny 2 event|new dungeon|destiny 2 duality dungeon|duality dungeon|duality dungeon guide|dungeon guide|duality dungeon destiny 2","268767","11023","607","https://i.ytimg.com/vi/SlohDPSLwKA/default.jpg","False","False","The Complete DUALITY DUNGEON GUIDE! Everything you need to know to beat this new Dungeon added to Destiny 2 in Season of the Haunted (Season 17).→ Buy One Get One FREE with AdvancedGG: https://advanced.gg/pages/bogo?ref=KHDTime Stamps:00:00 - How to Gain Access to the Dungeon01:04 - Navigate the Mindscape Jumping Puzzle03:20 - Nightmare of Gahlran First Encounter Guide07:26 - Dive Deeper Jumping Puzzle 08:26 - Find the Way Statue Puzzle & Secret Chest10:24 - Unlock the Vault Second Encounter Guide14:50 - Navigate the Vault Jumping Puzzle 16:10 - Nightmare of Caiatl Final Dungeon Boss GuideNew #Destiny2 video, Showcasing the complete dungeon guide and walkthrough for the new Duality Dungeon just released during during Season of the Haunted aka Season 17 (year 5) of Destiny 2! The new Witch Queen DLC is here! It provides a new campaign, new weapons, new exotic quests, and so much more! We have the latest witch queen updates and news! Season of the Risen and a new secret exotic quest are live! As well as the witch queen and all of it's new content! But today We have the Duality Dungeon Guide! Every single encounter, every single jumping puzzle from the start to the new Dungeon Final Boss, we have it all here! Get the new Heartshadow Dungeon Exotic Sword!  #SeasonOftheHaunted  #Destiny2News--- My Twitter: https://twitter.com/RickKackis"
"y0P96wmLzcQ","#1 HEAT at #2 CELTICS | FULL GAME HIGHLIGHTS | May 27, 2022","2022-05-28T03:42:43Z","UCWJ2lWNubArHWmf3FIHbfcQ","NBA","17","22.29.05","Basketball|G League|NBA|game-0042100306","2686270","30773","4029","https://i.ytimg.com/vi/y0P96wmLzcQ/default.jpg","False","False","Stay up-to-date on news, live scores and stats with the NBA App:https://app.link.nba.com/-App22Led by Jimmy Butler’s Playoff career-high 47 PTS (16-29 FG), along with 9 REB, 8 AST and 4 STL, the No. 1 seed Miami Heat defeated the No. 2 seed Boston Celtics in Game 6, 111-103. Kyle Lowry added 18 PTS and 10 AST for the Heat in the victory, while Jayson Tatum tallied 30 PTS and 9 REB for the Celtics. This best-of-seven series is now tied 3-3."
"A2aSmJ-SXCo","Post Malone Has His Brain Hacked By Spicy Wings | Hot Ones","2022-05-26T15:00:08Z","UCPD_bxCRGpmmeQcbe2kpPaA","First We Feast","24","22.29.05","First we feast|fwf|firstwefeast|food|food porn|cook|cooking|chef|recipe|cocktail|bartender|craft beer|complex|complex networks|spicy food|foodie|burgers|food documentary|post malone|post malone hot ones|post malone interview|post malone interview 2022|post malone hot wings|Post Malone cooped up|post malone rockstar|post malone circles","2448888","140803","8187","https://i.ytimg.com/vi/A2aSmJ-SXCo/default.jpg","False","False","Post Malone makes his triumphant return for the Season 18 Hot Ones premiere! Posty cemented his place in Hot Ones history when he first sat down with Sean Evans five years ago, so you already know how he is with spicy food. But now he's back, having smashed Billboard and streaming records as one of the highest-selling musicians of the last decade. And his long-awaited album, Twelve Carat Toothache, is coming soon. Watch as two brothers in spice reunite over a brand-new hot sauce lineup and discuss everything from ghosts, to Magic the Gathering, to the state of the music industry.BUY HOT ONES BONELESS CHICKEN BITES NOW: https://hotoneschallenge.com/MAKE A DIFFERENCE BY DONATING TO COMMON THREADS, THE BRAND-NEW CHARITY PARTNER OF HOT ONES: https://www.commonthreads.org/firstwefeast/BUY HOT ONES TRUTH OR DAB THE GAME NOW: http://truthordabgame.comBUY HOT ONES HOT SAUCE NOW: http://bit.ly/HotOnesSaucesNEWHOT ONES MERCH AVAILABLE NOW: https://bit.ly/2AIS271SIGN UP FOR THE HOT ONES MONTHLY HOT SAUCE SUB BOX: https://bit.ly/2veY50PSIGN UP FOR THE FIRST WE FEAST NEWSLETTER: http://firstwefeast.com/signupSubscribe to First We Feast on YouTube: http://goo.gl/UxFzhKCheck out more of First We Feast here:http://firstwefeast.com/https://twitter.com/firstwefeasthttps://www.facebook.com/FirstWeFeasthttp://instagram.com/firstwefeastFirst We Feast videos offer an iconoclastic view into the culinary world, taking you behind-the-scenes with some of the country’s best chefs and finding the unexpected places where food and pop culture intersect. #HotOnes #PostMalone"
"QUpqyWvjSOQ","NCT DREAM 엔시티 드림 'Beatbox' MV Teaser","2022-05-28T15:00:22Z","UCEf_Bc-KVd7onSeifS3py9g","SMTOWN","10","22.29.05","NCT DREAM|엔시티드림|드림|드림 컴백|Beatbox|비트박스|2집 리패키지 앨범|repackage album|마크|재민|제노|런쥔|해찬|지성|천러|MARK|JAEMIN|JENO|RENJUN|HAECHAN|JISUNG|CHENLE|dreamsquad|드림스쿼드|티저|teaser|mv teaser|뮤비 티저","1303272","319168","9562","https://i.ytimg.com/vi/QUpqyWvjSOQ/default.jpg","False","False","NCT DREAM's 2nd album repackage Beatbox will be released on May 30th, 6PM (KST).NCT DREAM Officialhttps://www.youtube.com/nctdreamhttps://www.instagram.com/nct_dreamhttps://www.tiktok.com/@official_ncthttps://twitter.com/NCTsmtown_DREAMhttps://www.facebook.com/NCTDREAM.smtown#NCTDREAM #Beatbox#NCTDREAM_BeatboxNCT DREAM 엔시티 드림 'Beatbox' MV Teaser ℗ SM Entertainment"
"HP9Djg8TpaE","Hanging Out With NLE CHOPPA!","2022-05-27T18:45:06Z","UC8pOnl4XYXcKfZ_aWBO0o_A","JiDionPremium","24","22.29.05","jidion|jidion premium|funny|vlog|prank","1018330","78731","2281","https://i.ytimg.com/vi/HP9Djg8TpaE/default.jpg","False","False","Discord:https://discord.gg/jidionInstagram: https://www.instagram.com/jidion_/Editor: https://instagram.com/blazen.psd?igsh...Merch: https://shopjidion.com/Outro Song: https://youtu.be/hFbfNLbML4ISnapchat: Jidon_14Business Email: jidionbusinesscontact@gmail.comCashApp: $jidion1"
"OZrftoPOXfY","Testing Scary Minecraft Myths To Prove Them Wrong","2022-05-28T02:00:05Z","UC-g_O9HWb5B0rVDG1hLd5Hw","Eystreem","20","22.29.05","Eystreem|eyestream|eystream|minecraft|minecraft pe|family friendly|roleplay|funny|troll|trolling|prank|secret|hidden|tutorial|minecraft phone|minecraft bedrock edition|testing scary minecraft|scary minecraft myths|testing scary minecraft myths|scary minecraft|minecraft myth|minecraft blood golem|scary blood golem|scary iron golem|cursed villager|testing scary minecraft myths to prove them wrong|minecraft blood villager|blood villager|scary villager","1323390","37737","2462","https://i.ytimg.com/vi/OZrftoPOXfY/default.jpg","False","False","The Terrifying Story of the Blood Villager! What happens if you open a Minecraft Beta World in 1.18? The answer will shock you...Play Minecraft with ME and be IN VIDEOS! 😝 Just click the 'JOIN' button here ▶https://www.youtube.com/channel/UC-g_O9HWb5B0rVDG1hLd5Hw/join❤️ Tik Tok: https://direct.me/eystreem📷 Instagram: https://direct.me/eystreem🎮 My Minecraft Server Address: play.eyserver.comYou can join this server on Bedrock Edition (Phones, Consoles and Tablets) and Java Edition (PC and Mac)💙 Huge thanks and credit to these awesome creators for inspiring today's video: https://docs.google.com/document/d/1_UilMRDHRNSZ3VyzxhW0fQ6_T5GfizFUlMGCI20vPGI/edit?usp=sharing🎵 Music from: http://share.epidemicsound.com/wn87w#Eystreem #Minecraft"
"wc74cMicvxo","BYE","2022-05-27T19:09:35Z","UCDDgfKQE3eaD1H08VHRAfig","PontiacMadeDDG VLOGS","26","22.29.05","[none]","278013","19792","1503","https://i.ytimg.com/vi/wc74cMicvxo/default.jpg","False","False","marathon starts june 1st"
"9yf4_q71_Bg","I Google Translated Minecraft Mobs 200 Times","2022-05-28T01:06:11Z","UCMZXnRko82oLtJHLLD6rLdQ","Omziscool","20","22.29.05","I google translated minecraft mobs 200 times|minecraft mod|google translate minecraft|minecraft google translate|google translate|i google translated minecraft|minecraft|minecraft google translated|making a minecraft mod|cursed minecraft|remaking minecraft|how to make a minecraft mod|putting minecraft through google translate|realistic minecraft|mommy long legs|poppy playtime|poppy playtime chapter 2|i remade every mob in minecraft|poppy playtime minecraft","365976","9458","265","https://i.ytimg.com/vi/9yf4_q71_Bg/default.jpg","False","False","I google translated minecraft mobs 200 timesIn this video, I took it upon myself to google translate minecraft mobs 200 times in Minecraft 1.19 then remade the mob... This Minecraft video is cursed but hilarious (Challenge)I google translated minecraft mobs 100 times then remade as many as i can from the new minecraft, the wild update 1.19 and remake them in the newest minecraft update. Then try to beat minecraft with the google translated custom mobs! I made mario , joker , spider man , Mommy Long Legs from Poppy Playtime , and huggy wuggy ! Kirby and much more! They look super Realistic and cool! This video was inspired by  Toiu I Google Translated Minecraft 300 Times, Then Made The Resulthttps://youtu.be/cdBudb1JSbMand Halvetone I remade every mob into Poppy Playtime in minecraft #Minecraft #Mod #MinecraftMod"
"2b7nCbCRyIs","The Man Who Took Down a $3 Billion Funeral Empire","2022-05-27T13:16:59Z","UCi5iiEyLwSLvlqnMi02u5gQ","Ask a Mortician","27","22.29.05","funeral home|funeral law|cemetery law|Jeremiah O'Keefe|Willie Gary|Loewen Group|funeral corporation|corporate funeral home|Ray Loewen|funeral director|court drama|burial|Death|Death rights|Morticians|Ask a Mortician|Caitlin Doughty","372943","32021","3041","https://i.ytimg.com/vi/2b7nCbCRyIs/default.jpg","False","False","“I made a huge mistake.” – Ray Loewen (probably)Thank you Patron deathlings, who make this all possible!http://www.patreon.com/thegooddeath*$5+ PATRONS! Check out Caitlin’s SECRET Shop for a limited edition item inspired by this video*: https://the-order-of-the-good-death.myshopify.com/collections/patreon-exclusive***CAITLIN CONTENT***Books: http://caitlindoughty.com/booksMORTAL course: https://www.mortalcourse.com/Our podcast on iTunes: https://apple.co/2yK6c6GSpotify:  https://spoti.fi/2QZEVEMGoogle Play: https://bit.ly/2AdEvojThe Order of the Good Death – articles, resources, and more: http://www.orderofthegooddeath.com/***WHERE ELSE YOU CAN FIND ME***Instagram: http://www.instagram.com/thegooddeathTwitter: http://www.twitter.com/thegooddeath***WAYS TO SUPPORT AND GROW THE ORDER OF THE GOOD DEATH***Donations: https://www.orderofthegooddeath.com/donateBecome a member! The Order of the Good Death's Store: https://the-order-of-the-good-death.myshopify.com/***PRODUCTION CREDITS***Mortician and Writer: Caitlin DoughtyProducer and Writer: Louise Hung (@LouiseHung1)Editor & Graphics: Andy WindakThumbnail: Landis Blair (@LandisBlair) Thank you to our friend Tanya Marsh, professor of funeral and cemetery law, for lending her eyes to our script and helping us navigate all the legal speak and courtroom drama as we created this video.  https://law.wfu.edu/faculty/profile/marshtd/***SELECTED SOURCES & ADDITIONAL READING***“Fight to the Death”http://content.time.com/time/magazine/article/0,9171,135163,00.html“In Mississippi, deal with funeral home giant helped sway a jury”https://www.tampabay.com/archive/1997/10/25/in-mississippi-deal-with-funeral-home-giant-helped-sway-a-jury/“The Burial” by Jonathan Harrhttp://www.condenet.com/mags/newyorker/asme/categories/artwork/pdf/11_01_99_Harr_Well.pdf“Brash Funeral Chain Meets Its Match in Old South”https://www.nytimes.com/1996/01/27/us/brash-funeral-chain-meets-its-match-in-old-south.html“A Homegrown Disaster”https://www.buzzfeednews.com/article/chrishamby/homegrown-disaster“IN THE MATTER OF: THE LOEWEN GROUP, INC. and RAYMOND L. LOEWEN,Claimants/Investors,v.THE UNITED STATES OF AMERICA, Respondent/Party.”https://www.italaw.com/sites/default/files/case-documents/italaw9047_0.pdf“History of the Loewen Group Inc.”https://www.referenceforbusiness.com/history2/58/The-Loewen-Group-Inc.html"
