video_id,title,publishedAt,channelId,channelTitle,categoryId,trending_date,tags,view_count,likes,comment_count,thumbnail_link,comments_disabled,ratings_disabled,description
"SDCMos-4QQE","Ewan McGregor: The Prequels were underrated | Agree to Disagree | @LADbible TV","2022-05-24T16:30:02Z","UC4oVjJptcsvtgIMrdIUQYlQ","LADbible TV","24","22.29.05","the lad bible|lad bible|lad|bible|videos|viral videos|viral|funny|comedy|funny videos|documentaries|exclusives|interviews|ewan mcgregor|ewan mcgregor obi wan kenobi|ewan mcgregor interview|hayden christensen and ewan mcgregor interview|obi-wan kenobi|agree to disagree|star wars have the best fans|Star Wars is better than marvel|star wars|Samuel L Jackson|Samuel L Jackson star wars|Pineapple on pizza debate|darth vader hayden christensen|padawan braid star wars","2755251","145293","7094","https://i.ytimg.com/vi/SDCMos-4QQE/default.jpg","False","False","We pitted Ewan McGregor and Hayden Christensen against each other to argue over some of the internets biggest debates. We find out if they think the Star Wars prequels were underrated, if they believe Darth Vader is the best villain in movie history and if they think the Star Wars universe and their fanbase is the best.Obi-Wan Kenobi debuts exclusively on Disney+ from 27th May.Subscribe To Our Channel: http://bit.ly/SubscribeLADbibleBe In Our Videos: http://instagram.com/ladbiblecastingFacebook: https://www.facebook.com/ladbible/Instagram: https://www.instagram.com/ladbible/Twitter: https://twitter.com/ladbible#LADbible #UNILADTo license this video please email: licensing@ladbiblegroup.com"
"bNheoCmErvc","Shooting at Texas elementary school kills at least 21","2022-05-25T02:31:24Z","UCKjU3KzdbJE1EFcHVqXC3_g","CBC News: The National","25","22.29.05","texas shooting|texas school shooting|texas school shooter|uvalde|uvalde texas|uvalde texas shooting|robb elementary school|robb elementary school texas|robb elementary school shooting|shooting usa|school shooting texas|joe biden|joe biden texas|joe biden uvalde|Susan Ormiston|CBC|The National|gunman at texas shooting","578831","4858","0","https://i.ytimg.com/vi/bNheoCmErvc/default.jpg","True","False","A shooting at an elementary school in Uvalde, Texas, has killed at least 18 children and three adults. The 18-year-old suspect was found dead, according to officials who did not confirm a motive for the shooting. UPDATE: Officials say at least 19 children and two adults were killed. Read the latest here: https://www.cbc.ca/1.6464315Watch The National live on YouTube Sunday-Friday at 9 p.m. ETSubscribe to The National: https://www.youtube.com/user/CBCTheNational?sub_confirmation=1Connect with The National online:Facebook | https://www.facebook.com/thenationalTwitter | https://twitter.com/CBCTheNationalInstagram | https://www.instagram.com/cbcthenationalMore from CBC News | https://www.cbc.ca/newsThe National is CBC's flagship nightly news program, featuring the day's top stories with in-depth and original journalism, with hosts Adrienne Arsenault and Andrew Chang in Toronto, Ian Hanomansing in Vancouver and the CBC's chief political correspondent, Rosemary Barton in Ottawa."
"7cUeeTmyWds","Artwork Reveal - Call of Duty: Modern Warfare II","2022-05-24T16:29:53Z","UC9YydG57epLqxA9cTzZXSeQ","Call of Duty","20","22.29.05","activision|call of duty|COD|video game|gaming|new games|online gaming|multiplayer|game|fps|first person shooter|blizzard|xbox|playstation|pc|Modern Warfare 2|Modern Warfare|Call of Duty: Modern Warfare 2|COD: Modern Warfare 2|MW2|new release|new Call of Duty|MW2 remake|remastered|MW2019|Captain Price|Ghost|Soap|Gaz|Captain John Price|Simon “Ghost” Riley|John “Soap” MacTavish|Kyle 'Gaz' Garrick.|cod|cod mw2|cod 2022|cod mwii|mwii|mw2 cod|mw2 release","2472773","74713","6543","https://i.ytimg.com/vi/7cUeeTmyWds/default.jpg","False","False","Task Force 141 makes its massive return with a global squad of iconic veterans, these Operators include Captain John Price,  Simon “Ghost” Riley, John “Soap” MacTavish, Kyle 'Gaz' Garrick and introducing Mexican Special Forces Colonel Alejandro VargasModern Warfare® II releases October 28, 2022.#ModernWarfare2 #CallOfDutyFollow #CallofDuty for the latest intel:Twitter: http://twitter.com/CallofDutyInstagram: http://instagram.com/callofdutyFacebook: http://facebook.com/CallofDutyTikTok: http://www.tiktok.com/@callofduty"
"1S9ZV67kdn8","#2 CELTICS at #1 HEAT | FULL GAME HIGHLIGHTS | May 25, 2022","2022-05-26T03:09:29Z","UCWJ2lWNubArHWmf3FIHbfcQ","NBA","17","22.29.05","Basketball|G League|NBA|game-0042100305","2621273","24836","2764","https://i.ytimg.com/vi/1S9ZV67kdn8/default.jpg","False","False","Stay up-to-date on news, live scores and stats with the NBA App: https://app.link.nba.com/app22After outscoring Miami 56-38 in the 2nd half, the No. 2 seed Boston Celtics defeated the No. 1 seed Miami Heat in Game 5, 93-80. Jayson Tatum recorded 22 PTS, 12 REB and 9 AST for the Celtics, while Jaylen Brown added a game-high 25 PTS (13 PTS, 5-6 FG in the 4th quarter) in the victory. Bam Adebayo tallied 18 PTS and 10 REB for the Heat. The Celtics lead this best-of-seven series 3-2."
"nEX4Umn5Bx8","Character Teaser - Yelan: Inevitable Justice | Genshin Impact","2022-05-25T04:00:29Z","UCiS882YPwZt1NfaM0gR0D9Q","Genshin Impact","20","22.29.05","Amber|amber vtuber|genshi|genshi game|genshi impact|genshi video|genshin|genshin game|genshin impact|genshin impact 2020|genshin impact game|genshin impact good|genshin impact graphics|genshin impact introduction|genshin impact manga|genshin impact wiki|geshin|geshin game|Teyvat|yuanshen game|miHoYo China|miHoYo Japan|adventure story|open world game|anime style|MMORPG|anime games|mobile game|MMO PlayStation|yt:cc=on","2799013","262437","10302","https://i.ytimg.com/vi/nEX4Umn5Bx8/default.jpg","False","False","A spider doesn't need to be in the center of the web to feel the slightest vibration from each thread.When the trapped prey sees the hunter emerging from the darkness, its fate is already doomed.Download FREE: https://genshin.hoyoverse.com/en#GenshinImpact #HoYoverse↓ Follow us for the latest news ↓Official Website: https://genshin.hoyoverse.com/enOfficial Community: https://www.hoyolab.com/genshin/Facebook: https://www.facebook.com/GenshinImpact/Twitter: https://twitter.com/GenshinImpactTwitch: https://www.twitch.tv/genshinimpactofficialInstagram: https://www.instagram.com/genshinimpact/Reddit: https://www.reddit.com/r/Genshin_Impact/"
"TvFxQIvUHms","Son Heung-min introduces the best Korean BBQ to Spurs players","2022-05-25T11:46:54Z","UCg-p3lQIqmhh7gHpyaOmOiQ","영국남자 Korean Englishman","23","22.29.05","Korean|영국남자|영국|조쉬|올리|Josh|Ollie|KoreanEnglish|English|Man|englishman|food|음식|외국인|반응|영상|웃긴|남자|외국|도전|매운|조니|조엘|신부님|크리스|올리아빠|해물|치킨|삼겹살|korean|BBQ|fried|chicken|라면|불닭볶음면|미친남자","6314643","226056","9112","https://i.ytimg.com/vi/TvFxQIvUHms/default.jpg","False","False","For more information on the Coupang Play Series click here!  https://coupangplay.app.link/N2wx1MRKfqbYou can watch the full video on Coupang Play.Today we were invited to meet some of Tottenham's top players at the Spurs training ground. We couldn’t give pro footballers loads of food, so we got everything checked off with their nutritionist and made sure that it was the highest quality Korean beef BBQ we could find!--쿠팡플레이 시리즈에 대한 자세한 내용을 원하시면 이 링크로 들어가보세요! https://coupangplay.app.link/N2wx1MRKfqb영상 풀버전은 쿠팡플레이에서 보실 수 있습니다.오늘은 토트넘 훈련장에서 최고의 토트넘 선수들을 만나게 되었어요! 프로 선수분들이시기에 전담 영양사님께 확인을 받고 저희가 찾을 수 있는 최상급 한국 소고기를 준비해 갔습니다!"
"OLuUhgRY5w4","The Pit Stop AS7 E02 | Bob The Drag Queen And Eureka O’Hara Are Here! | RuPaul’s Drag Race All Stars","2022-05-24T20:00:37Z","UC0sEIyXXalzD1lbwm3D2xpA","RuPaul's Drag Race","24","22.29.05","vh1|rupaul|rupaul's drag race|drag race|Rupauls Drag race Season 14 Queens|Rupauls Drag race Drama|Drag Race Fights|Drag Queen Fashion|RuPaul|Rupauls Drag Race|The Pit Stop|Pit Stop all stars 7|Drag Race episodes|Drag Race clips|Drag Race discussion|the pit stop all stars 7|drag race the pit stop|rupauls drag race all stars 7 queens|bob the drag queen|eureka o'hara|The Pit Stop AS7 Bob The Drag Queen And Eureka O’Hara Are Here! | RuPaul’s Drag Race All Stars","999678","37934","3606","https://i.ytimg.com/vi/OLuUhgRY5w4/default.jpg","False","False","Get snatched away with All-Star Eureka O’Hara and Host Bob the Drag Queen, as the duo recap the latest episode of RuPaul’s Drag Race All Stars 7. Pull up to The Pit Stop because this road-tripping twosome are talking Snatch Game and gagging over pleather, as they recap the legendary All Winners season… GURL!#VH1 #DragRace #AllStars7Paramount+ is here! Stream all your favorite shows now on Paramount+. Try it FREE at https://bit.ly/3qyOeOfNow on YouTube TV: https://tv.youtube.com/welcome/ More from RuPaul's Drag Race:Official Website: http://www.vh1.com/shows/rupauls-drag-raceFollow RuPaul's Drag Race on Twitter: https://twitter.com/rupaulsdragraceFollow RuPaul's Drag Race on Instagram: https://www.instagram.com/rupaulsdragrace Follow RuPaul's Drag Race on TikTok: https://www.tiktok.com/@rupaulsdragraceLike RuPaul's Drag Race on Facebook: https://www.facebook.com/rupaulsdragrace"
"diLv4LFeO2s","Inside the NBA talk about Tragic Shooting in Texas","2022-05-25T00:24:50Z","UCqQo7ewe87aYAe7ub5UqXMw","House of Highlights","17","22.29.05","[none]","1631714","30350","7999","https://i.ytimg.com/vi/diLv4LFeO2s/default.jpg","False","False","📌 SHOP OUR MERCH: https://hoh.world📌 Follow our Instagram: https://www.instagram.com/houseofhighlights📌 Follow our TikTok: https://www.tiktok.com/@houseofhighlights📌 Follow our Facebook: https://www.facebook.com/houseofhighlights#HouseofHighlights #NBA #HoH"
"I9HPuOSzFuk","21 killed in Texas elementary school shooting; gunman dead","2022-05-25T01:16:06Z","UCFuzExfO2fUVmNK5_COvsNg","8 News NOW Las Vegas","25","22.29.05","video|news|en español|Texas|School shooting","1132884","6903","0","https://i.ytimg.com/vi/I9HPuOSzFuk/default.jpg","False","False","21 killed in Texas elementary school shooting; gunman dead"
"aQZObPme23Q","Marshawn Lynch Shows Kevin Hart Beast Mode In The Cold Tubs | Cold as Balls | Laugh Out Loud Network","2022-05-24T15:02:29Z","UCLRmIdRJgLfmdpJufmBhBuA","LOL Network","23","22.29.05","kevin hart|hartbeat productions|funny|comedy|comedian|plastic cup boyz|actor|stand up|lol|laugh out loud|LOL Network|laugh out loud network|african american","1741770","33795","1525","https://i.ytimg.com/vi/aQZObPme23Q/default.jpg","False","False","#PoweredByOldSpice #MarshawnLynch joins #KevinHart in the ice tubs and talks about that 1-yard Super Bowl play, how to stay warm in an ice tub, and all things #beastmode.SUBSCRIBE▶︎http://bit.ly/SubscribeLOLFOLLOW THE FUNNY:Facebook▶ http://bit.ly/LOLNetwork-FBTwitter▶ http://bit.ly/LOLNetwork-TWInstagram▶ http://bit.ly/LOLNetwork-IGYouTube▶ http://bit.ly/LOLNetwork-YouTubeSnapchat▶ LOLNetworkOfficial Website▶ http://www.laughoutloud.com Laugh Out Loud is a comedy brand and multi-platform network founded by the world’s top comedian Kevin Hart. Through his network, Hart delivers his vision for the future of comedy: social, mobile, multicultural and seriously funny. From stand-up legends to globally-recognized digital influencers, Hart and LOL curate comedy’s boldest voices to produce original scripted and unscripted series, stand-up specials, live broadcasts and special events.  Hart brings the groundbreaking social-first strategy that earned him 100 million+ followers to Laugh Out Loud, with one core mission: keep the world laughing.  Dope Comedy. Delivered Daily. Always On. Always Loud. Directly from Kevin Hart and his hand-picked crew of comedic rockstars."
"vMAPW7ZoOLw","Harry Styles - Wet Dream (Wet Leg cover) in the Live Lounge","2022-05-24T10:20:01Z","UCKoafhJ9dkAWaEvlXCiBBwA","BBCRadio1VEVO","10","22.29.05","Harry|Styles|Wet|Dream|(Wet|Leg|cover)|the|Live|Lounge|Columbia/SONY|Pop","1285752","87372","2101","https://i.ytimg.com/vi/vMAPW7ZoOLw/default.jpg","False","False","Harry Styles covers Wet Dream by Wet Leg in the BBC Radio 1 Live Lounge"
"ELZNClmKX1E","Kane Brown - Like I Love Country Music (Official Music Video)","2022-05-24T18:00:10Z","UCsEj8E122ibbJetQe8BoV7g","KaneBrownVEVO","10","22.29.05","kane brown new music|kb new song|kb3|kane brown new album|kane brown radio song|kane brown new single|new country music|brooks and dunn|johnny and June|johnny cash|brand new man|willie nelson|George jones|walk the line|country music heroes|new music Friday|hot country|country heat|new kb|kb country music song|tiktok viral|viral country song|viral tiktok dance|country music hall of fame|country love songs|line|dancing","372979","13365","1302","https://i.ytimg.com/vi/ELZNClmKX1E/default.jpg","False","False","“Like I Love Country Music” is out now!Listen On: Apple Music: https://KB.lnk.to/LILCMAY/applemusiciTunes: https://KB.lnk.to/LILCMAY/itunesSpotify: https://KB.lnk.to/LILCMAY/spotifyAmazon Music: https://KB.lnk.to/LILCMAY/amazonmusicYouTube Music: https://KB.lnk.to/LILCMAY/youtubemusicPandora: https://KB.lnk.to/LILCMAY/pandoraListen to Kane on your smart speaker. Just say “Play ‘Like I Love Country Music’ by Kane Brown.”Subscribe to Kane’s YouTube: https://KB.lnk.to/YTSubscribeAYConnect with Kane:Newsletter: https://smarturl.it/kbemailsubscribeOfficial Website: https://kanebrownmusic.comInstagram: https://www.instagram.com/kanebrown_m...Facebook: https://www.facebook.com/kaneallenbrownTikTok: https://www.tiktok.com/@kanebrownTwitter: https://twitter.com/kanebrownText Kane at 615-205-1717Chorus:You get me high as Willie, girlYou get me gone as JonesYou turn me on as much as I turn on my radioLet’s take our time, walk the lineKinda like Johnny and June didYeah, let’s do thisBaby, I love you like I love country music"
"hZms3n_qvc0","I let Twitch Chat decorate my new room","2022-05-24T19:38:33Z","UClyGlKOhDUooPJFy4v_mqPg","DougDoug","20","22.29.05","DougDoug|DougDoug Youtube Channel|Channel Youtube DougDoug|doug doug|twitch|twitch chat|dougdoug twitch chat|twitch chat plays|dougdoug twitch|fat albert|ball pit|decoration|roommate|room|house|timer|whale|balls|amazon|cherry|ragingcherry","694085","57386","2088","https://i.ytimg.com/vi/hZms3n_qvc0/default.jpg","False","False","I gave them a bunch of money, here's how they spent itThis was streamed live on Twitch! https://bit.ly/DougTwitchFull stream recording: https://www.youtube.com/watch?v=CKUFe7EasEkMy 2nd Channel: http://bit.ly/dougdoug2Twitter: https://twitter.com/DougDougFoodSubscribe: https://bit.ly/dougdougsubsubEdited by Berry Bebop! https://www.youtube.com/c/berrybebopMore DugDug:Latest Uploads: https://www.youtube.com/watch?v=rp4cH7mb4X4&list=PLzTxt5iYdhziB3Zf03HR_aZWgJ49ffj-d&index=2Explained with Food: https://www.youtube.com/playlist?list=PLzTxt5iYdhzjMJF--_xpj4s4jgOPe0NWFDougDoug Challenges: https://www.youtube.com/playlist?list=PLzTxt5iYdhzh_SW60_g3HPVjBupwUZOFAPopular Videos: https://www.youtube.com/playlist?list=PLzTxt5iYdhzgrLpm-SQNNAVOw0gVs8Iu_About DougDoug:Doug is a sentient bell pepper who was hired by the FBI to crack gaming challenges and also talk about things with food#DormRoom #TwitchChat #BallPit"
"1mLsbCAsKRo","HIGHLIGHTS | A-LEAGUE ALL STARS 2-3 BARÇA 🔵🔴","2022-05-25T13:04:25Z","UC14UlmYlSNiQCBe9Eookf_A","FC Barcelona","17","22.29.05","FC Barcelona|برشلونة،|Fútbol|FUTBOL|soccer|FUTEBOL|Sepakbola|サッカー|كرة القدم|football|FCB|Barça|Sport|Club|Barcelona|CAMP NOU|ter stegen|pique|busquets|goat|dembele|lenglet|yt:cc=on|ansu fati|riqui puig|koeman|coutinho|pedri|de Jong|Memphis|depay|Kun Agüero|Aguero|2-3|Australia|A-LEAGUE ALL STARS|BARÇA|Friendly|Sydney","1077709","50417","1122","https://i.ytimg.com/vi/1mLsbCAsKRo/default.jpg","False","False","FC Barcelona’s first ever trip to Australia has been a resounding success. A huge crowd at the Accor Stadium, Sydney was treated to a fabulous game of football that saw the lead change hands twice, and the visitors eventually seeing off the A-League All Stars 3-2.SUBSCRIBE NOW:▶ https://www.youtube.com/user/fcbarcelona ⚽ BARÇATV+: http://barca.link/wT1w30qMyQO​💎 Official Culers Membership: http://barca.link/plXS30rAhfC​🌐 Site: http://www.fcbarcelona.com📱 App: https://go.onelink.me/xndC/DownloadAppYouTube🔵 Facebook: http://www.facebook.com/fcbarcelona📸 Instagram: http://www.instagram.com/fcbarcelona🐦 Twitter: http://twitter.com/FCBarcelona🎶 Tiktok: https://www.tiktok.com/@fcbarcelona 📱 Viber: http://chats.viber.com/fcbarcelona🛍 Get all official Barça apparel from FC Barcelona's online store: http://barca.link/j8QH30qQh4Y 🔵🔴 #FCBarcelona"
"TDqSw5nNB1Q","King Lil Jay - Pressed ( Official Music Video )","2022-05-24T20:00:08Z","UCpMWp4QesDV1RFvkqRRF1Og","king liljay","22","22.29.05","[none]","318320","19744","2561","https://i.ytimg.com/vi/TDqSw5nNB1Q/default.jpg","False","False","#KingLilJay #Pressed King Lil Jay - Pressed ( Official Music Video ) Shot by @Billy Kauck  prod by @Muff The Producer. Visit Kingliljay.comTeamCloutLordhttps://t.me/+eVZ2m63C8jo0YjgxFollow King Lil Jay:Instagram - https://instagram.com/wto_ceoTikTok - https://www.tiktok.com/@wto_ceoListen to King Lil Jay:Apple Music: https://apple.co/3uUnWKQSpotify: https://spoti.fi/385wipVSubscribe: https://bit.ly/3vwurT8"
"me6UxA0Ly5s","THOR LOVE AND THUNDER TRAILER BREAKDOWN! Easter Eggs & Details You Missed!","2022-05-24T22:26:10Z","UC7yRILFFJ2QZCykymr8LPwA","New Rockstars","24","22.29.05","new rockstars|new rockstars youtube|youtube new rockstars|thor love and thunder|thor love and thunder trailer|gorr|gorr the god butcher|who is gorr|thor 4|thor 4 trailer|living tribunal|loki|erik voss","1980001","71153","2585","https://i.ytimg.com/vi/me6UxA0Ly5s/default.jpg","False","False","Thor Love and Thunder Trailer frame-by-frame breakdown by New Rockstars’ Erik Voss! Visit http://shortboxed.com/newrockstars to enter the giveaway and to receive a promo code for 10% off your Shortboxed order of $100 or more.Thor Love and Thunder trailer reveals GORR THE GOD BUTCHER, Thor’s new tattoos, and a mysterious chamber filled with statues honoring the Living Tribunal, the Watcher, Death, and more! Erik Voss breaks down this Thor 4 trailer shot by shot for all the interesting Easter Eggs and details you missed!Check out our sweet, sweet merch! http://www.newrockstarsmerch.comJoin the nerdy conversation on Discord! https://discord.io/newrockstarsSubscribe:​ ​http://bit.ly/SubNewRockstars​ | Enable ALL push notifications ​ 🔔Watch the NEWEST videos: https://www.youtube.com/playlist?list=PL4xEo4XxrSJbbjsGMSWDN62z8XB6QzHFyNew Rockstars supports efforts to end racial violence. Please help those struggling, however you can: https://secure.actblue.com/donate/ms_blm_homepage_2019Follow New Rockstars​:Instagram: ​https://instagram.com/newrockstars Facebook: ​https://facebook.com/NewMediaRockstars Twitter: ​https://twitter.com/newrockstarsPatreon: ​http://patreon.com/newrockstarsWatch more New Rockstars:Movie/TV Breakdowns: ​https://youtube.com/playlist?list=PL4xEo4XxrSJYIc41RsaDb9ffBm1U3xuNc&playnext=1News & Theories: ​https://youtube.com/playlist?list=PL4xEo4XxrSJbRbibTPzfQGG8OL6BYPgiW&playnext=1Trailer Breakdowns: ​https://youtube.com/playlist?list=PL4xEo4XxrSJan8z8kY31ox5GC9kdQILud&playnext=1Newest Videos: https://www.youtube.com/playlist?list=PL4xEo4XxrSJbbjsGMSWDN62z8XB6QzHFyMost Popular: ​https://www.youtube.com/playlist?list=PL4xEo4XxrSJb4yLVNzDNWuDqrmQZwCcKbAbout New Rockstars:Hey everyone, welcome to the official New Rockstars YouTube channel! We cover what the internet cares about. From Marvel to the Walking Dead, Rick and Morty to Stranger Things, James Bond to Star Wars, and more. We got you covered in every movie and television show you might love! Don’t forget to subscribe and enable all push notifications so you never miss a review, breakdown, or theory.PATREON PRODUCERS:Comically Inclined StudiosLadimaLookNoHandsKaren WangRick DenmonRXJediProducer: Erik Voss http://www.twitter.com/eavossProducer: Zach HuddlestonProducer: Brandon BarrickWriter: Erik VossWriter/Host: MasterTainmentWriter/Host: Whitney Van LaninghamNRDS Chief Creative Officer: Filup Molina http://www.twitter.com/filupmolinaPost Production Supervisor: Riley AuskelisStaff Editors: Drew Coombs, Joshua Steven Hurd, & Songvit KiatpiryiaEditors: Aaron Carrion, Devin Cleary"
"1Ho-xGRnMaU","OUR GENDER REVEAL!","2022-05-24T01:00:00Z","UCDSJCBYqL7VQrlXfhr1RtwA","Les Do Makeup","26","22.29.05","[none]","1719599","114664","14134","https://i.ytimg.com/vi/1Ho-xGRnMaU/default.jpg","False","False","Use code LESDOMAKEUP16 for up to 16 FREE MEALS + 3 Surprise Gifts across 6 HelloFresh boxes plus free shipping at https://bit.ly/3JPLJk5!—————————————————Hi babygirls! Thank you so much for watching, supporting,  and being apart of our lifes❤️ I LOVE YOU!!! 🥲❤️————————————————FOLLOW US! ❤️❤️LES Instagram- https://www.instagram.com/lesdomakeup/ALEX Instagram - https://instagram.com/vlexgalindo?igs...LES Twitter- https://twitter.com/LEXXXLIEEEALEX Twitter - https://twitter.com/VLEXXXGALINDOFacebook- https://www.facebook.com/Lesdomakeup1/———————————————————————————Business inquires only: lesdomakeup@revel-mgmt.com———————————————————————————"
"hgIuqivhHR4","CHP officers ambushed  in East LA outside King Taco","2022-05-25T01:00:01Z","UCkH1uDkyuO9sVjSqdqBygOg","CBS Los Angeles","25","22.29.05","CBS 2 News Evening","556661","4774","3218","https://i.ytimg.com/vi/hgIuqivhHR4/default.jpg","False","False","Jeff Nguyen reports from East LA where a shooting involving law enforcement officers in East Los Angeles was under investigation Tuesday."
"p2nubPAIGcA","Humans VS Robots: 100 Challenges","2022-05-23T19:35:20Z","UCyps-v4WNjWDnYRKmZ4BUGw","Airrack","24","22.29.05","[none]","5229421","174299","9704","https://i.ytimg.com/vi/p2nubPAIGcA/default.jpg","False","False","Follow me on Instagram!INSTAGRAM ▶️ https://urlgeni.us/instagram/jBHgThanks to Sky Elements for the drone show: https://skyelementsdrones.comFOLLOW MY FRIENDS:Salim: https://youtube.com/channel/UC1Kb31O1t-zPeTUwZGwxZzwMack: https://www.instagram.com/mackTyler: https://www.youtube.com/c/tylerblanchardBeans: https://instagram.com/samuelj_thomas?igshid=YmMyMTA2M2Y=Exosapien: https://www.youtube.com/c/ExosapienTechnologiesOuttro song ▶️ Axel Thesleff - Bad KarmaYouTube: https://bit.ly/3k6UadjSpotify: https://spoti.fi/3odq3TNInstagram: https://bit.ly/3lsccaz"
"vY661u93lLk","BEL'VETH, RIOT'S NEW CREATION IS LEGIT MADNESS! (7.0 ATTACK SPEED, PENTAKILL)","2022-05-24T23:44:55Z","UCpUS8oR-IJSP3gFYrGAWEuQ","TC Zwag","20","22.29.05","[none]","585288","24382","2349","https://i.ytimg.com/vi/vY661u93lLk/default.jpg","False","False","BEL'VETH, RIOT'S NEW CREATION IS LEGIT MADNESS! (7.0 ATTACK SPEED, PENTAKILL)League of Legends season 12 Bel'Veth Gameplay!  Check out my channel with Heizman: https://www.youtube.com/channel/UCjiRDEkRru-ejjppwHw9gRgCheck out my merch!: https://www.Zwag.ggFollow my stream!: https://www.twitch.tv/ZwagFollow my twitter!: https://twitter.com/ZwagLoL----------------------------------------------------------------------------------------------------------✔ Subscribe to my second channel for XERATH ONLY content!►https://www.youtube.com/channel/UCYf1mExa37eLyxY-iEjnanQ"
"DfdbNFn8rqo","FIGHT HIGHLIGHTS | Canelo Álvarez vs. Dmitry Bivol","2022-05-08T06:41:19Z","UCurvRE5fGcdUgCYWgh-BDsg","DAZN Boxing","17","22.29.05","dazn|boxing|highlights|full fight|ko|knockout|top 10|The DAZN Boxing Show|Pelea|Boxeo|Pugile|dazn boxing|Canelo Álvarez vs. Dmitry Bivol fight|Canelo Álvarez vs. Dmitry Bivol highlights|Canelo Álvarez Dmitry Bivol|Canelo Álvarez highlights|Dmitry Bivol highlights|Canelo fights|Dmitry Bivol fights|Canelo Álvarez|Dmitry Bivol|Canelo","11061731","146321","24602","https://i.ytimg.com/vi/DfdbNFn8rqo/default.jpg","False","False","May 7th, 2022 -- Canelo Álvarez vs. Dmitry Bivol from Las Vegas.Subscribe to our YouTube channel 👉  http://bit.ly/DAZNBoxingYouTubeDownload the DAZN app now 👉  http://bit.ly/DAZNYoutubeFollow DAZN Boxing On Social Media 👇Twitter: https://www.twitter.com/DAZNBoxingInstagram: https://www.instagram.com/DAZNBoxingFacebook: https://www.facebook.com/DAZNThe DAZN Boxing Show ► https://bit.ly/3EQ70HNDazn Rewind ► https://bit.ly/32iAaRT#Dazn #DaznBoxing #CaneloÁlvarez #DmitryBivol"
"xM4XNV6UizM","Russia retaliates against Finland as Sweden weighs joining NATO","2022-05-14T16:04:54Z","UCBi2mrWuNuyYy4gbM6fU18Q","ABC News","25","22.29.05","Finland|President|Russia|Sweden|Ukraine|Ukrainian|Volodymyr|Zelenskyy|gma|invasion|military|nato|p_cmsid=2494279|p_vid=news-84716537|war","1908893","17801","5428","https://i.ytimg.com/vi/xM4XNV6UizM/default.jpg","False","False","Ukrainian President Volodymyr Zelenskyy said his forces have taken down 200 Russian military aircraft as Pentagon officials warn about a possible delay of aid from the U.S.SUBSCRIBE to ABC News: https://bit.ly/2vZb6yPWATCH MORE on http://abcnews.go.com/LIKE ABC News on FACEBOOK: https://www.facebook.com/abcnewsFOLLOW ABC News on TWITTER: https://twitter.com/abc#ABCNews #GMA #Russia #NATO #Ukraine"
