video_id,title,publishedAt,channelId,channelTitle,categoryId,trending_date,tags,view_count,likes,comment_count,thumbnail_link,comments_disabled,ratings_disabled,description
"JLrR56BU5lU","Basketball but The Wheel Controls Me!","2022-05-26T21:57:21Z","UCTs5PJGf9AwnA7mNV3ejNTQ","ZackTTG","20","22.29.05","Let|Wheel|Decide|My|Basketball|Move|TTG|Runs|Zack|I let a wheel decide my basketball move|Basketball move|NBA|Three Pointer|TTG Runs|I let a wheel decide my basketball move TTG Runs","186483","6577","198","https://i.ytimg.com/vi/JLrR56BU5lU/default.jpg","False","False","SUBSCRIBE IF YOU SEE THIS!! In this video, we have another TTG Run, but with a twist...2HYPE + FaZe Rug All Sports Challenge  !!https://youtu.be/a3J8tPaBHEANBA Playoff Basketball CHALLENGES Level 1 to Level 100!!https://youtu.be/mLQReb47hdkRecreating College + NBA Playoff Buzzer Beaters! --https://youtu.be/icmNj1H3TV0TikTok: ZackTTGShout out to the guys for being in the video!Jeff - @Jeffrey Bui  Johnny - ​@Johnny Carmack Trav - @Travis Fukumoto Mawcho - @Mawcho  ★ 2HYPE MEMBERS ★@Jesser@Jiedel@CashNasty @Kristopher London @Moochie Girlfriend's Socialshttps://www.instagram.com/jade_meadowshttps://www.youtube.com/channel/UC4V9RNrBTBO595dwyeNJXigMake sure to follow my socials!!IG: ZackTTG Twitter: ZackTTGamerTwitch: ZackTTGEditor!Isaiah CarterIG: zaycvrterProduction!Neal SchnoorIG: NealSchnoor#2HYPE #basketball"
"gU-bilE6qfo","#4 MAVERICKS vs #3 WARRIORS | FULL GAME HIGHLIGHTS | May 26, 2022","2022-05-27T03:33:02Z","UCWJ2lWNubArHWmf3FIHbfcQ","NBA","17","22.29.05","Basketball|G League|NBA|game-0042100315","3258582","41873","4520","https://i.ytimg.com/vi/gU-bilE6qfo/default.jpg","False","False","Stay up-to-date on news, live scores and stats with the NBA App:https://app.link.nba.com/-App22Led by Klay Thompson’s 32 PTS (8-16 3pt FG), the No. 3 seed Golden State Warriors defeated the No. 4 seed Dallas Mavericks in Game 5, 120-110. Stephen Curry (15 PTS, 9 AST) and Draymond Green (17 PTS, 6 REB, 9 AST) added a combined 32 points for the Warriors in the victory, while Luka Doncic tallied 28 PTS, 9 REB and 6 AST for the Mavericks. After closing out this best-of-seven series 4-1, the Warriors will advance to the 2022 #NBAFinals presented by YouTube TV to face the winner of the Boston Celtics-Miami Heat series."
"Je3XdLzduhQ","Modded GTA 5 Sumo with a Chaos Mod was a mistake","2022-05-26T22:00:07Z","UCzXwjTI6c6mVn6oui_p6oiw","SMii7Y","20","22.29.05","gta 5|gta 5 mods|grand theft auto|gta 5 mod|gta 5 online|grand theft auto v|grand theft auto 5|gta|gta v|gta v online|gta race|gta 5 races|gta v races|gta online|gta 5 funny moments|smii7y|smii7yplus|gta 5 sumo|sumo|gta v sumo|gta 5 mods pc|gta 5 chaos mod|gta v chaos mod","1540917","102870","2165","https://i.ytimg.com/vi/Je3XdLzduhQ/default.jpg","False","False","https://smii7y.store/We played a Sumo Mode with the Chaos Mod enabled in GTA 5. It did not go well.Leave a like and Subscribe if you enjoyed! Thanks =)Subscribe! - http://bitly.com/SubscribeToSMii7YHereCheck out my other channels!SMii7Y➕  https://www.youtube.com/c/SMii7YplusSMii7Y➖  https://www.youtube.com/c/SMii7YminusFollow my social medias and stream!📺 Stream  -  http://www.twitch.tv/smii7y🐦 Twitter  -  https://twitter.com/SMii7Y📷 Instagram  -  https://www.instagram.com/smii7y/👕 Merch - https://smii7y.store/Friends in the video:@Blarg @Nogla @Bigpuffer 🎵 Music by:http://www.epidemicsound.com/http://www.premiumbeat.com/http://audiojungle.net/incompetech.com Licensed under Creative Commons: By Attribution 3.0http://creativecommons.org/licenses/by/3.0/https://99sounds.org/Outro Music Created by:  @Mattercell Entertainment ​"
"XP5k3ZzPf_0","Go up SpaceX's Starship-catching robotic launch tower with Elon Musk!","2022-05-26T13:30:00Z","UC6uKrU_WqJ1R2HMTY3LIx5Q","Everyday Astronaut","28","22.29.05","Elon Musk|ElonMusk|Elen Musk|Starbase|Starbase Tour|Starship Tour|Starship update|Starship tour|Tim Dodd|Everyday Astronaut|SpaceX Starlink|SpaceX|Starship Leak|Starlink Leak|Starlink 2|Starship nose|Starship heatshield|Starship thrusters|Starship engines|SpaceX rocket engine|SpaceX tour|Tour Starbase|New Starbase|Elon Musk interview|Interview with Elon Musk|Elon Starbase 2022|2022|SpaceX launch tower|inside SpaceX tower|Inside Starbase","906934","48394","5020","https://i.ytimg.com/vi/XP5k3ZzPf_0/default.jpg","False","False","Today we’re going up SpaceX's Orbital Launch Tower with the ultimate tour guide, Elon Musk. He’s going to walk us around the bottom, explain how they plan to catch the booster with the chopsticks and then we'll go up the elevator stopping at the quick disconnect and on the upper deck!Recommended videos to help with some context [Playlist] - https://youtube.com/playlist?list=PLWzKfs3icbT55w6f9wGqXkhk_SlanIhnrHuge thanks to Ryan Chylinksi from Cosmic Perspective for helping shoot this video! - https://www.youtube.com/c/CosmicPerspective & http://patreon.com/cosmicperspective00:00 - Intro00:45 - Tour Begins02:00 - How to catch Starship10:45 - Starlink 2 details12:40 - Elevator up the tower14:15 - Quick Disconnect Arm17:20 - Top of tower20:20 - The importance of making humans multi-planetary26:00 - Growing the economy30:20 - Orbital Propellant Farm32:00 - Outro--------------------------Want to support what I do? Consider becoming a Patreon supporter for access to exclusive livestreams, our discord channel! - http://patreon.com/everydayastronautAnd extra big thanks to our Mission Directors! Get your name in the credits by becoming a Mission Director on Patreon! Mac Malkawi, Ole Mathias Aarseth Heggem, Tomdmay , Jared smith, TTTA , Max Haot, John Malkin, DLB, Héctor Ramos, David Glover, Simon Pilkington, Tristan Edwards, Arthur Carty, Frans de Wet, Chad Souter, Sam Fisher, Chris Dibbs, Seth Pascale, Manalope , Vincent Argiro, Taron Lexton, Corey Coddington, Tim Engle, David A. Greer, Robin Haerens, Ares Lovlyn, Mark Krieger, Roger Oldfield, Vignan Velivela, Damian Borth, Scott Ferreira, Steven Hosac, Bravishma Narayan, Eric Johnson, Robert Maynard, Dakota Flemmer, George Anthony Ray, John and Justin HookOr become a YouTube member for some bonus perks as well! - https://www.youtube.com/channel/UC6uKrU_WqJ1R2HMTY3LIx5Q/joinThe best place for all your space merch needs!https://everydayastronaut.com/shop/All music is original! Check out my album Maximum Aerodynamic Pressure anywhere you listen to music (Spotify, iTunes, Google Play, Amazon, etc) or click here for easy links - http://everydayastronaut.com/music"
"L5E2jF6eNU4","Unboxing A $250,000 Sneaker Mystery Box (FIRST EVER)","2022-05-26T22:03:20Z","UCZpZNTJd7aUDfAVajDyEUsA","Harrison Nevel","26","22.29.05","streetwear|Harrison Nevel|$250000 mystery box|mystery box|mr beast mystery box|most expensive mystery box|sneaker mystery box|ultimate mystery box","396968","23027","1401","https://i.ytimg.com/vi/L5E2jF6eNU4/default.jpg","False","False","Giveaway #1 for cactus air max 1!RULES HERE:1. Follow https://instagram.com/projectblitz?igshid=YmMyMTA2M2Y=2. Follow https://instagram.com/yeezybusta?igshid=YmMyMTA2M2Y=3. Followhttps://instagram.com/croatianstyle?igshid=YmMyMTA2M2Y=Comment on this post:https://www.instagram.com/p/CeCYyiNOxrp/?igshid=YmMyMTA2M2Y=Travis Scott Jordan 1 Giveaway:https://www.instagram.com/p/CeB0S12uhnY/Text me! Stay up to do and get exclusive discounts on future drops!470-761-3811Project blitz:https://projectblitz.com// I N S T A G R A M : https://instagram.com/harrisonnevel/// T W I T T E R : https://twitter.com/harrisonnevel// S N A P C H A T : harrisonnevel// F A C E B O O K : www.facebook.com/harrisonnevelytMy Cameraman: https://www.instagram.com/hazelwoodfilm/My Website Where I Sell Sneakers, Hypebeast Mystery Boxes and More!https://www.harrisonnevel.comMy Second Channel where I make car content: https://www.youtube.com/user/HarrisonNevel"
"Go8nTmfrQd8","Marvel Studios' Thor: Love and Thunder | Official Trailer","2022-05-24T01:46:47Z","UCvC4D8onUfXzvjTOM-dBfEA","Marvel Entertainment","24","22.29.05","marvel|comics","33160385","1366875","53555","https://i.ytimg.com/vi/Go8nTmfrQd8/default.jpg","False","False","“Let me tell you the story of the space viking, Thor Odinson…”Watch the brand-new trailer for Marvel Studios’ Thor: Love and Thunder and witness it only in theaters July 8.► Watch Marvel on Disney+: https://bit.ly/2XyBSIW► Subscribe to Marvel on YouTube: http://bit.ly/WeO3YJFollow Marvel on Twitter: ‪https://twitter.com/marvelLike Marvel on Facebook: ‪https://www.facebook.com/marvelWatch Marvel on Twitch: https://www.twitch.tv/marvelReward your Marvel fandom by joining Marvel Insider!Earn points, then redeem for awesome rewards.Terms and conditions apply. Learn more at https://www.marvel.com/insider?Osocial=YT&CID=MarvelInsiderFor even more news, stay tuned to:Tumblr: ‪http://marvelentertainment.tumblr.com/Instagram: https://www.instagram.com/marvelPinterest: ‪http://pinterest.com/marvelofficialReddit: http://reddit.com/u/marvel-official"
"NTfH0pX9nVQ","if we laugh the video ends (with eddie)","2022-05-26T17:51:42Z","UCK0VozPhniGe4Eb2zcju1uw","DubDaddy","23","22.29.05","joshdub|dubdaddy|gaming|among us|the boys|eddie|juicy|mully|narrator","338633","22250","659","https://i.ytimg.com/vi/NTfH0pX9nVQ/default.jpg","False","False","- FOLLOW THESE FOR MORE COOKED CONTENT -INSTRAGRAM - https://www.instagram.com/joshdubgaming​TWITTER - https://twitter.com/joshdub​FACEBOOK - https://facebook.com/joshdubgaming​DISCORD - https://discord.gg/RBJkYBe​MERCHANDISE - https://joshdub.store​- SUB TO THE BOYS -MULLY - https://www.youtube.com/c/mullyvr​NARRATOR - https://www.youtube.com/channel/UChfY...​JUICY - https://www.youtube.com/channel/UCqW1...​EDDIE - https://www.youtube.com/channel/UCYHn...​REE KID - https://www.youtube.com/channel/UCBQW...​SMASHING - https://www.youtube.com/user/HotFudge...​- INTRO MUSIC -BUBBLES by Tokyo MachineListen on Spotify: https://open.spotify.com/album/6n7nqf...​iTunes Download Link: https://geo.itunes.apple.com/us/album...​iTunes Download Link: https://geo.itunes.apple.com/us/album...​- MUSIC -https://www.purple-planet.com​https://www.epidemicsound.com/"
"nofiRSEWTfk","Aftonbuilt","2022-05-25T19:59:45Z","UC7_YxT-KID8kRbqZo7MyscQ","Markiplier","20","22.29.05","aftonbuilt|five nights at freddy's|fnaf|fan game|markiplier|foxy|scrapyard|scary games|scariest|spooky|jumpscares|horror games|indie horror|fanverse|scott","3330056","197225","6199","https://i.ytimg.com/vi/nofiRSEWTfk/default.jpg","False","False","Aftonbuilt is a surprisingly well made Five Nights at Freddy's Fan Game that didn't make it into the Fanverse!LISTEN TO DISTRACTIBLE ►► https://open.spotify.com/show/2X40qLyoj1wQ2qE5FVpA7xPlay Aftonbuilt ► https://gamejolt.com/games/Aftonbuilt/708093Edited By ► https://www.youtube.com/LixianTVScary Games Playlist ► https://www.youtube.com/playlist?list=PL3tRBEVW0hiBSFOFhTC5wt75P2BES0rAoHorror Outro ► https://soundcloud.com/shurkofficial/hauntedHappy Outro ► https://soundcloud.com/hielia/minimusicman-crazy-la-paint"
"qlQ4jaKoN7A","10 Incredible Cut Content Secrets in Elden Ring","2022-05-26T05:11:13Z","UCe0DNp0mKMqrYVaTundyr9w","VaatiVidya","20","22.29.05","guide|walkthrough|lore|dark|souls|dlc|two|bloodborne|story|vaatividya|vaati|vidya|videos|(video|game)|shadows|twice|from|software|sekiro|combat|tips|tricks|elden|ring|trailer|demon's souls|remake|ps5|playstation 5|demigods|radagon|godwyn|morgott|radahn|malenia|miquella|melina|omen|scarlet rot|outer god|demi|gods|asimi|silver tear|mimic tear|questline|rhico|dream brew|zullie the witch|lance mcdonald|illusorywall|cut dialogue|godfrey|godrick|colosseum|arena|pvp|boss rematch","860665","54729","2183","https://i.ytimg.com/vi/qlQ4jaKoN7A/default.jpg","False","False","Go to http://www.audible.com/vaatividya or text vaatividya to 500 500 to get your free trial. SUBSCRIBE TO THE DATAMINERS ▼▼▼►Recreated Mimic Questline by Nullrinn: https://youtu.be/1z9IG6Rnnac►Cut Dreambrew Questline by Lance: https://youtu.be/2IT-DPhIxX8►Limgrave's Burning Stone Heads by Lance: https://youtu.be/sPPHMJHRJQc►Map Changes Over Time by Illusory wall: https://youtu.be/jxnn0CpxpUo►Leonard & Radahn by Zullie the Witch: https://youtu.be/rPU3LdoiFwU►Snake Soul info by Zullie the Witch: https://youtu.be/uBzelJ70lCM►Godrick's Cut Dialogue by SekiroDubi: https://youtu.be/GjYxqsnehLc►Godfrey's Cut Dialogue by SekiroDubi: https://youtu.be/zMu7FvNP2Z4►The Mystery of the Colosseum by SekiroDubi: https://youtu.be/0wKB-zAZSkgTIMESTAMPS00:00 Intro00:14 Blaidd's Tower00:51 MimicTear Questline04:22 Dreambrew Questline06:39 Burning Giant Heads07:48 Map Changes Over Time08:38 Radahn & Leonard09:32 SnakeSoul10:43 Godrick Cut Dialogue11:58 Godfrey Cut Dialogue12:43 The Arenas of the Lands Between14:27 Audible SponsorshipKINDLE THE CHANNEL [become a patron]►http://www.patreon.com/vaatividyaSPECIAL THANKS TO►TheParryGod, for editing many recent videos - https://www.youtube.com/user/xricsxPLAYLISTS►My Best Videos: http://bit.ly/2oMp66a►Elden Ring News: https://bit.ly/2ZkDV2d►Sekiro Lore: https://bit.ly/2KGEzD1►Sekiro Secrets: https://bit.ly/2IsObhW►Dark Souls 3 Lore: http://bit.ly/2n0bU13►Dark Souls 3 News: http://bit.ly/1NQbgbW►Bloodborne Lore: http://bit.ly/1X9doOQ►Demon's Souls Lore: http://bit.ly/16mIF86►Dark Souls Remastered Lore: http://bit.ly/13x6nNs►Dark Souls 2 Lore: http://bit.ly/1dedWjI►Souls-like: http://bit.ly/1xCPDnuSOCIAL►Follow me on Twitter: https://twitter.com/VaatiVidya►Follow me on Tumblr: http://vaatividya.tumblr.com/►Follow me on Twitch.tv: http://www.twitch.tv/vaatividya►Follow me on Facebook: https://www.facebook.com/Vaatividya►Follow me on Patreon: http://www.patreon.com/vaatividya►Join me on Discord: http://discord.gg/vaatividyaTHUMBNAIL ART►Janice ChuPATRONS►I'd like to give sincere thanks to all my patrons - your contributions have changed the course of my life, allowing me to put more emphasis on video production in the future.►Special thanks to Soul of Cinder-tier Patrons: Aidan, Aishlinn, AJ, Aj Banasiak, AmazinShawn, Andreas, Andronikos, anthony, Aritz, Armand, Axel, Benjamin, budhawillyboy, Cat, Chase, Chattan, Croonz, Dain, David, deathbydishwasher, Aydian, Diablo, Erlend, Finbarwrong, GoldenSunX, Goon1234, HugDucks, Ian, Italian, Jacob, Joshua, Justin, Justin, Kejo, Kuvoc, Kyle, Lena, Liam, Lucat, Lucian, Lucratiel, Loak, M, Malik, Matthew, Meistermuall, Michael, michael, Mike, & Morgan."
"FlVCPCeqQTI","Rolando Rolly Romero speaks after getting pushed off the stage at weigh-in | Davis vs Tank","2022-05-27T17:02:46Z","UCWXYAGB9SadlL6p5Bb66wWw","Premier Boxing Champions","17","22.29.05","Boxing|PBC|premier boxing champions|ko|tko|knockouts|fighter|boxer|mayweather|al haymon|showtime boxing|wilder|thurman|spence|porter|broner|fighting|best of|highlights|wbo|wba|wbc|ibo|ibf|boxing highlights|press conference|pbc on showtime|live stream|gervonta davis|rolando romero|davis vs romero|tank vs rolly|showtime ppv|weigh-in|rolly romero|rolando rolly romero|romero vs davis weigh in|davis romero weigh in|davis romero|tank davis","421067","5122","1823","https://i.ytimg.com/vi/FlVCPCeqQTI/default.jpg","False","False","Rolando Rolly Romero speaks with the Showtime crew excluding confidence ahead of his bout against Gervonta Davis. Order #DavidRomero on SHOWTIME PPV: https://pbcham.ps/DavisRomero5#WeighIn #RollyRomeroVisit PremierBoxingChampions.com for more info.SIGN UP FOR FIGHT ALERTS: https://pbcham.ps/FightAlertsFOLLOW US:https://twitter.com/premierboxinghttps://instagram.com/premierboxinghttps://www.facebook.com/premierboxingchampions"
"6R2RPZUw2eQ","Elon Musk teases AOC on Twitter after declaring she will sell her Tesla","2022-05-27T05:38:26Z","UCO0akufu9MOzyz3nvGIXAAw","Sky News Australia","25","22.29.05","6306873275112|fb|fblink|msn|usa|world|yt","2113836","46234","12251","https://i.ytimg.com/vi/6R2RPZUw2eQ/default.jpg","False","False","Elon Musk has taken to Twitter to tease Alexandria Ocasio-Cortez after she told Bloomberg News she was considering selling her Tesla following the billionaire's tweet last month where he told her to “stop hitting on” him."
"YjG3rOKGWGc","'DANGER ZONE' UPDATE TEASER / WAR THUNDER","2022-05-26T16:00:27Z","UCPZsNertSS82YCT2qX9-wHA","War Thunder. Official channel.","20","22.29.05","war thunder|wt|war thunder update|war thunder trailer|war thunder 2022|war thunder danger zone|war thunder f-14","584688","38473","6545","https://i.ytimg.com/vi/YjG3rOKGWGc/default.jpg","False","False","The next major update on the horizon.Song: Unsecret x Neoni - Fallout🔘 Site: http://warthunder.com/ 🔘 Twitch: https://www.twitch.tv/warthunder🔘 Twitter: http://twitter.com/warthunder🔘 Facebook: http://www.facebook.com/WarThunder🔘 Forum: http://forum.warthunder.com/#WarThunder"
"eejjbgbMOc8","Eyewitness Says He Knew Suspect In Uvalde, TX School Shooting, Saw What Happened Moments Before","2022-05-25T01:52:00Z","UCTln5ss6h6L_xNfMeujfPbg","Newsy","25","22.29.05","Newsy|fact-based journalism|facts|news|breaking news|unbiased|no agenda news|top story|what really happened|unbiased news|unbiased news on youtube|fair news|fact based|news today|unbiased reporting","3068433","20299","13359","https://i.ytimg.com/vi/eejjbgbMOc8/default.jpg","False","False","UPDATE: Authorities say the victim death toll from the Texas school shooting now stands at 19 children and two adults.PREVIOUS: Newsy's JohnMone is on the ground in Uvalde, TX and spoke to an eyewitness who says he knew the shooter, the shooter's grandmother, and saw what happened in the moments before the shooter entered the school. #texas #schoolshooting #newsy -------------------------------------Newsy is your source for news and analysis covering the top stories from around the world. With persistent curiosity and no agenda, we strive to fuel meaningful conversations by highlighting multiple sides of every story. It’s news with the why.Join our newsletter at http://bit.ly/2q1teprSee more at http://www.newsy.com/Like Newsy on Facebook: http://www.facebook.com/newsy/Follow us on Twitter: http://www.twitter.com/newsy"
"Q5x4eHn_3tA","Steve Kerr Delivers Powerful Message After Mass Shooting At Elementary School","2022-05-25T00:13:16Z","UC9-OpMMVoNP5o10_Iyq7Ndw","Bleacher Report","17","22.29.05","bleacher report|br|nba|steve kerr|steve kerr warriors|steve kerr interview","2641210","87391","14886","https://i.ytimg.com/vi/Q5x4eHn_3tA/default.jpg","False","False","Steve Kerr spoke on the mass shooting at Robb Elementary School in Uvalde, TexasSubscribe: https://www.youtube.com/user/BleacherReport?sub_confirmation=1Follow on IG: http://www.instagram.com/f/bleacherreportFollow us on Twitter: http://www.twitter.com/bleacherreportLike us on Facebook: http://www.facebook.com/bleacherreport"
"thJgU9jkdU4","Rammstein - Dicke Titten (Official Video)","2022-05-25T16:00:11Z","UCYp3rk70ACGXQ4gFAiMr1SQ","Rammstein Official","10","22.29.05","Rammstein|Rammstein Official|Official|Official Video|Rammstein Musik|Rammstein Official Video|Rammstein.Official|Rammstein Channel|Heavy|Metal|Germany|Rammstein Video|Dicke Titten|Rammstein Dicke Titten|Dicke Titten Rammstein|Dicke Titten Musikvideo|Dicke Titten Music video|Dicke Titten Official|Official Dicke Titten|Rammstein Dicke Titten Official|Rammstein Dicke Titten Official Video|Rammstein Titten|Titten Rammstein|Rammstein Titten Official|Ramms","8871405","445266","0","https://i.ytimg.com/vi/thJgU9jkdU4/default.jpg","True","False","Order the new album: https://rammstein.lnk.to/ZeitOrder the Dicke Titten single: https://rammstein.lnk.to/DickeTittenRammstein areChristoph Schneider Paul LandersTill LindemannRichard Z. KruspeOliver RiedelFlake LorenzDirected byJoern HeitmannA Katapult ProductionDirector Of PhotographyThomas KuerzlProducerAlexander KieningIngo GeorgiLine ProducerLisa CordesSteve RennerEditorPatrick WilfertColor Grading Nadir Mansouri1st AD Martin ZillmannUnit ManagerBen VogtBase ManagerNathaniel Huempfner1st ACReno Rieger2nd ACPeter PulkaDigital Imaging TechnicianClara SchemmelGafferJoerg MohrBest BoyGernot DanningerElectricianWolfgang FraisslChristopher SchramekGripSven T. HaklikUdo RavensteinProduction DesignJosche AllwardtUlrich LamsfussCostume DesignMarkus ErnstAlina BergerMake Up BandStéphanie BachKatrin WesterhausenMake Up CastLisa PendlSabrina KoeckBand DriverRonny FischerSebastian ZiegltrumDriverNorman DausterPlaybackBjörn GrundtProduction Assistant Saskia HeinrichPhotographerJens KochPost ProducerBjörn GrundtVisual EffectsAcht FrankfurtRalf DrechslerEditing SuiteCinegrellHendrik TeltauGrading SuiteMogradeSarah TrostorffThanks to Peter MoserTourismusverband Wilder KaiserLeo - Heimat Museum EllmauChristian - Ellmauer HofCorinna, Anett & FamilyRoland, Lois, PatrickTamara, Judith, Monika, SaskiaJosefine, Sandrathe whole cast and teamAndSächsische Staatskapelle Dresden1st Clarinet – Wolfram Grosse2nd Clarinet – Jan Seifert1st Trumpet – Helmut Fuchs2nd Trumpet – Sebastian Böhner1st Tenor Horn – Uwe Voigt / Jonathan Nuss2nd Tenor Horn – Joachim Hans3rd Tenor Horn / Oboe – Bernd SchoberTuba – Dominik NussMixingOlsen InvoltiniMasteringSvante ForsbäckBand ManagementBirgit FordyceStefan MehnertBand Personal LiaisonsPaulo San Martin________________________Ich leb alleine schon viele JahreDas Leben stumpf, der Alltag grauVerlier Geduld, Verstand und HaareIch hätte gerne eine FrauUnd die Hoffnung will mir schwindenEine Partnerin zu findenDie mir ebenbürtig istNein, da ist kein Glück in SichtSie muss nicht schön seinSie muss nicht klug seinNeinSie muss nicht reich seinKein Model mit langen SchrittenDoch dicken TittenWie eine stetig offene WundeAus der Seele tropft das BlutEinzig Trost sind kleine HundeEin feines Fräulein wäre gutEin feines Fräulein wäre tollIch bin auch gar nicht anspruchsvollIch bin auch gar nicht wählerischAm Ende der GeschichtMuss sie nicht schön seinSie muss nicht klug seinNeinSie muss nicht reich seinDoch um eines möchte ich bittenDicke TittenIch bin auch gar nicht anspruchsvollDoch große Brüste wären tollSie muss nicht schön seinSie muss nicht klug seinSie muss nur reich seinAn Fettgewebe bitte, bitteSie wird nichts bei mir vermissenSie braucht mich auch gar nicht küssenBraucht mich nicht mit Trauben labenSie muss nur Riesentitten habenDicke Titten► Website: http://www.rammstein.com► RammsteinShop: http://shop.rammstein.de► Instagram: http://www.instagram.com/rammsteinofficial► TikTok: http://www.tiktok.com/@rammstein► Facebook: http://www.facebook.com/Rammstein► Twitter: http://twitter.com/RSprachrohr#Rammstein #RammsteinOfficial #DickeTitten"
"GrKXLL3NO3Y","I Secretly Cheated Using //build in a Minecraft Building Competition","2022-05-25T20:00:06Z","UCQVwQQvz8O_0aeFDBVcdhpg","Shark","20","22.29.05","minecraft|mcpe|shark|09sharkboy|challenge|funny|minecraft pe|shark pe|I Secretly Cheated Using //paste in a Minecraft Building Competition|i secretly cheated using auto build|minecraft auto build|auto build in minecraft|minecraft secretly cheating autobuild|i secreatly cheated using //paste in minecraft|//paste minecraft|//paste minecraft build|minecraft building","1038045","28888","782","https://i.ytimg.com/vi/GrKXLL3NO3Y/default.jpg","False","False","I Secretly Cheated Using //paste in a Minecraft Building CompetitionMerch - https://www.09sharkboy.comSubscribe! -  http://bit.ly/1GtTBWjJoin My Discord - https://discord.gg/kDEGYnTMy SocialsTwitter - @09sharkboySnapchat - TheLifeOfSharkInstagram - @09sharkboyFacebook - https://www.facebook.com/SharkMerchAdditional music provided by Epidemic SoundClick here for a free trial! 🡆 https://www.epidemicsound.com/referral/tutm3h/The Funniest Minecraft Video Ever with New Funny Mods makes Minecraft 1.16.4 even funnier & hilarious! It is lots of fun and laughs :) Not Minecraft, But Water Rises or Minecraft, But Lava Rises, or any other but challenge like that. This is a speed run / speed runner of Minecraft against a killer / assassin but it is me and my good friends playing the NEW FUNNIEST MINECRAFT MOD EVER! REAL Minecraft Tricks they defy the game / Minecraft hacks are just INSANE!#Minecraft"
"36_Q6fmkHF4","Multiversus - Looney Goons","2022-05-25T23:16:05Z","UC8kCtPyCPg50n3XjmjRraGw","Lythero","20","22.29.05","Lythero|Smash|Multiversus|Finn|Jake|Batman|Shaggy|UI Shaggy|Superman|DC","577866","49244","1342","https://i.ytimg.com/vi/36_Q6fmkHF4/default.jpg","False","False","#ad Thanks Multiverses for the #sponsored video.Find out how to play here: https://multiversus.com/en-gbTwitch streams every Mon/Wed/Fri night at 5pm EST:https://twitch.tv/LytheroPlayers: @- ThatsTheMixup, @I Heart Justice & @Xanfel Subtiltles by @Emerald Demond Thumbnail by @Krooked Glasses Also @Pringus McDingus  did the big funny Shaggy fraction of our power lineAlso @LUvvUcy did something idkQuit following me:https://twitter.com/LytheroMERCH:There's been a lot of happy customers, and a lot of UNhappy customers having problems with items not shipping all over the world. I'll update this description (and all other videos) with a proper merch store that works soon. Sorry for the trouble.Music:Scooby Doo Where are you:https://www.youtube.com/watch?v=E8KBgWS2K2YSkeleton Boomerang - Big Boned:https://www.youtube.com/watch?v=656b-Zp5NuEForest Maze [YM2151 + SEGA PCM]:https://soundcloud.com/fm_am4n/forest-maze-ym2151-sega-pcm(N163) Eschatos - Point of No Returnhttps://www.youtube.com/watch?v=DwDVAM3unLs(N163) Eschatos - SILVER LINING:https://www.youtube.com/watch?v=-10qqJ_f8akEschatos Arrange Tracks - TRIUMPHAL MARCH [RANKING 2]:https://www.youtube.com/watch?v=8Y_nTNtXowQ"
