video_id,title,publishedAt,channelId,channelTitle,categoryId,trending_date,tags,view_count,likes,comment_count,thumbnail_link,comments_disabled,ratings_disabled,description
"usvf-N17TgA","Mario Strikers: Battle League - So Much Fun It Hurts - Nintendo Switch","2022-05-23T14:29:51Z","UCGIY_O-8vW4rfX98KlMkvRg","Nintendo","20","22.31.05","nintendo|game|gameplay|fun|video game|action|adventure|rpg|play|switch|nintendo switch|Mario Strikers: Battle League|Mario Strikers: Battle League trailer|Mario Strikers: Battle League nintendo switch|Mario Strikers: Battle League switch|available now|trailer|launch trailer|launch|Mario Strikers: Battle League nintendo|Mario Strikers: Battle League switch gameplay|switch trailer|nintendo switch trailer|switch gameplay|release date|release|available|announcement|teaser","1241248","38418","2443","https://i.ytimg.com/vi/usvf-N17TgA/default.jpg","False","False","You're gonna get hit with the unexpected in Mario Strikers: Battle League! Tackle, pass, and score your way to victory in this chaotic soccer-ish sport. It'll be so much fun, it hurts! Available June 10th only on Nintendo Switch. ESRB Rating: Everyone 10 and Up with Cartoon Violence, Comic MischiefPre-order today: http://ninten.do/6008bK13g#MarioStrikersBattleLeague #NintendoSwitchSubscribe for more Nintendo fun! https://goo.gl/HYYsotVisit Nintendo.com for all the latest! http://www.nintendo.com/Like Nintendo on Facebook: http://www.facebook.com/NintendoFollow us on Twitter: http://twitter.com/NintendoAmericaFollow us on Instagram: http://instagram.com/NintendoFollow us on Pinterest: http://pinterest.com/Nintendo"
"xM4XNV6UizM","Russia retaliates against Finland as Sweden weighs joining NATO","2022-05-14T16:04:54Z","UCBi2mrWuNuyYy4gbM6fU18Q","ABC News","25","22.31.05","Finland|President|Russia|Sweden|Ukraine|Ukrainian|Volodymyr|Zelenskyy|gma|invasion|military|nato|p_cmsid=2494279|p_vid=news-84716537|war","1909403","17802","5402","https://i.ytimg.com/vi/xM4XNV6UizM/default.jpg","False","False","Ukrainian President Volodymyr Zelenskyy said his forces have taken down 200 Russian military aircraft as Pentagon officials warn about a possible delay of aid from the U.S.SUBSCRIBE to ABC News: https://bit.ly/2vZb6yPWATCH MORE on http://abcnews.go.com/LIKE ABC News on FACEBOOK: https://www.facebook.com/abcnewsFOLLOW ABC News on TWITTER: https://twitter.com/abc#ABCNews #GMA #Russia #NATO #Ukraine"
"Ns8o-5t3ieU","MAMIII","2022-05-12T10:03:27Z","UC3UkDuAQjoRvTH7OEWm3cHQ","Becky G - Topic","10","22.31.05","Becky G|ベッキージー|KAROL G|ESQUEMAS|MAMIII","2995007","30954","0","https://i.ytimg.com/vi/Ns8o-5t3ieU/default.jpg","False","False","Provided to YouTube by Kemosabe Records/RCA RecordsMAMIII · Becky G · KAROL GESQUEMAS℗ 2022 Kemosabe Records/RCA RecordsReleased on: 2022-05-13Associated  Performer: Becky G & KAROL GComposer, Lyricist: Rebbeca Marie GomezProducer: Ovy On The DrumsRecording  Engineer, Vocal  Producer: Carlos A. MolinaComposer, Lyricist, Recording  Engineer: Daniel Echavarría OviedoComposer, Lyricist: Elena RoseAssistant  Engineer: Namln KangComposer, Lyricist: Carolina Giraldo NavarroMixing  Engineer: Rob KinelskiAssistant  Engineer: Eli HeislerMastering  Engineer: Dave KutchComposer, Lyricist: Justin QuilesComposer, Lyricist: Luis Miguel Gomez CastañoComposer, Lyricist: Daniel UribeAuto-generated by YouTube."
"kBeQasWa3ts","THOR LOVE AND THUNDER TRAILER 2 REACTION!! Marvel Studios' Breakdown | Gorr The God Butcher | Thor 4","2022-05-24T03:15:15Z","UC7_WiJnJxpm4MRNesRttzWg","The Reel Rejects","24","22.31.05","reel rejects|thor|thor love and thunder|thor love and thunder trailer|thor love and thunder trailer breakdown|thor love and thunder reaction|thor love and thunder teaser trailer|thor love and thunder trailer reaction|love and thunder|thor love and thunder easter eggs|easter eggs|hidden details|things you missed|plot details|leaks|first look|christian bale|jane foster|gorr the butcher|marvel|marvel studios|mcu|korg|thor 4|guardians of the galaxy","432987","22423","1138","https://i.ytimg.com/vi/kBeQasWa3ts/default.jpg","False","False","CHRISTIAN BALE REVEAL! Prioritize your mental health. Get 10% off your first month of therapy: HTTPS://betterhelp.com/reelrejects #MHAM  - Thank you to BetterHelp for sponsoring this video!THOR 4 OFFICIAL TRAILER!! Mighty Thor (Jane Foster) debuts alongside the Guardians of the Galaxy in the next MCU Thor film lead by Chris Hemsworth, Christian Bale Gorr The God Butcher, Russell Crowe Zeus, Valkyrie Tessa Thompson, directed by Taikai Waititi (Korg)#ThorLoveAndThunder #Marvel #MCU #Thor #Thor4 #GuardiansOfTheGalaxy BetterHelp is not a crisis line. If you are someone you know is in danger please consult these resources for immediate help: https://www.betterhelp.com/gethelpnow/ 0:00 Leave A Like!0:55 Marvel Studios' Thor: Love and Thunder | Official Trailer4:54 Thor Love & Thunder Trailer Breakdown5:10 Gorr The God Butcher Explained7:16 Symbiote, Knull9:05 Jane Foster Mighty Thor 10:27 Taikai Waititi Direction 11:53 Russel Crowe Zeus- Doctor Strange in the Multiverse of Madness Review: https://youtu.be/V385DyKnH0U- The Batman Trailer 3 Reaction: https://youtu.be/aeFyy639dwI- Moonknight Trailer Reaction: https://youtu.be/-223jAcyIBk- Peacemaker Episode 1 Reaction: https://youtu.be/BO5OnBOLEJs- Spider-Man No Way Home Spoiler Review (Tobey Maguire Andrew Garfield): https://youtu.be/MrmenzdWbJE- The Flash 2022 Movie Trailer Reaction: https://youtu.be/wmmCaI3VZEQ- Black Adam Trailer Reaction (First Look): https://youtu.be/ZT5wwEDOGfY- Squid Game Reactions: https://www.youtube.com/playlist?list=PL-bIhJVeYWw8VEv1Su2UPCtgo7fiCK2sv- Stranger Things Season 4 Trailer Reaction: https://youtu.be/PMEKTumOxHU Ask Us A QUESTION On CAMEO: https://www.cameo.com/thereelrejectsBecome A Super Sexy Reject  For Full Length T.V. Show Reactions!  https://www.patreon.com/thereelrejectsOriginal Video: Follow TheReelRejects On FACEBOOK, TWITTER, & INSTAGRAM: FB: https://www.facebook.com/TheReelRejects/INSTAGRAM: https://www.instagram.com/reelrejects/TWITTER: https://twitter.com/thereelrejectsFollow GREG On INSTAGRAM & TWITTER:INSTAGRAM: https://www.instagram.com/thegregalba/TWITTER: https://twitter.com/thegregalbaFollow JOHN HUMPHREY On INSTAGRAM & TWITTER:Twitter: https://twitter.com/datjohnhumphreyInstagram: https://www.instagram.com/datjohnhumphrey/PLAYLISTS:Trailer Reactions & Reviews:https://www.youtube.com/playlist?list=PL-bIhJVeYWw9ZsLdoAQFpx38s2hhyFgDeMovie Reviews:https://www.youtube.com/playlist?list=PL-bIhJVeYWw-comtadVs8b9JsZEWHUyr8Movie Talk (News, Spoiler Reviews, & Film Rumors!!!):https://www.youtube.com/playlist?list=PL-bIhJVeYWw8fPQ-21NVSb2IOwIiHbVt8Youtube Video Reactions & Discussions:https://www.youtube.com/playlist?list=PL-bIhJVeYWw_qwcPsN_vOxXC6IVzrOQYGSketches & Short Films:https://www.youtube.com/playlist?list=PL-bIhJVeYWw_zWuTRfBOUP3aYyIYRzc2yVlog:https://www.youtube.com/playlist?list=PL-bIhJVeYWw9TdRZC0NvGLve0eNWmUjzs"
"QW3uHakpzn4","What if I Become EVERYONE? (Poppy Playtime: Chapter 2)","2022-05-28T13:35:09Z","UCWo0VLsZSEoD3zR0vSshTTw","POPPY PLAY GAME","20","22.31.05","poppy|poppy playtime|huggy wuggy|huggy wuggy glitches|poppy glitch|poppy bugs|poppy playtime secrets|poppy playtime glitches|poppy playtime update|poppy playtime 2|poppy playtime mod|poppy playtime game|poppy playtime hack|poppy playtime funny|poppy playtime secret|poppy playtime mobile release|poppy mobile|poppy playtime chapter 2|poppy playtime chapter 2 gameplay|huggy wuggy chapter 2|poppy playtime chapter 2 trailer|puppy playtime","4520135","49610","652","https://i.ytimg.com/vi/QW3uHakpzn4/default.jpg","False","False","What if I Become EVERYONE? (Poppy Playtime: Chapter 2)Did you like the video? Subscribe to the channel!Hello! Welcome to the POPPY PLAY GAME channel! On my channel you will find cool videos on the game Poppy Play Time.__________________poppy playtime,huggy wuggy,poppy playtime huggy wuggy,poppy playtime gameplay,poppy,poppy playtime horror game,poppy playtime mod,poppy playtime secrets,horror game,poppy playtime game,poppy playtime chapter 1,poppy playtime logic,huggy wuggy poppy playtime,poppy playtime mods,poppy playtime hack,hacking poppy playtime,huggy wuggy mod,poppy playtime funny,poppy playtime secret,from huggy wuggy,huggy wuggy was able to cry,he ran away,in the pit,able,poppy,poppy playtime,huggy wuggy,hugy wugy,huggy wuggy glitches,kissy missy,poppy glitch,poppy bugs,poppy playtime 2 chapter,poppy playtime secrets,poppy playtime glitches,poppy playtime update,poppy woppy,woppy"
"IZ0oQ6nzKxo","GOT7 NANANA OFFICIAL M/V","2022-05-23T10:00:07Z","UCNtZPzvkjjB3EuPMNY71cmA","GOT7","10","22.31.05","GOT7|갓세븐|마크|제이비|잭슨|진영|영재|뱀뱀|유겸|아가새|IGOT7|GOT7 EP 《GOT7》 'NANANA' OFFICIAL M/V","18315391","1274706","124997","https://i.ytimg.com/vi/IZ0oQ6nzKxo/default.jpg","False","False","GOT7 NANANA OFFICIAL M/VGOT7 EP 《GOT7》 🐥💚https://WMK.lnk.to/GOT7GOT7 Official https://bio.to/GOT7_isournameWebsite : https://www.warnermusic.co.kr/artists/got7/Twitter : https://twitter.com/GOT7Instagram : https://www.instagram.com/got7_isourname/TikTok : https://www.tiktok.com/@got7_isourname#GOT7 #IGOT7 #NANANA[Lyrics][KOR]I’ve got a message message나 지금 심심해란 말이 툭내 손이 바빠 바빠대화가 끊기지 않게맞춰가고 싶어 너에게 가로세로처럼취향을 말해줘 널 알아가게마음과 마음이 닿게 손과 손이 닿게쉬다 가도 돼 넌 나의 품에 uh uh uh오늘 니 옆자리 나나나널 웃게 해 줄 사람 나나나기부니가 좋아 나나나 모든 게 난 궁금해 Oh eh oh oh eh ohOh eh oh oh eh oh자꾸 실없이 웃음이나 픽픽천천히 줄어가는 우리의 거리 리택시 미터기 말이 걸어가듯 내 맘이조금 답답하지만 참는 자에게 복이 있잖아 ay자연스레 시작해 서로에 대한 얘기어쩌면 아찔한 얘기들 까지도모든 길은 열어둬 선은 지워놔 줘 짓궂어도 뭐 어때 이대로 좋잖아오늘 니 옆자리 나나나널 웃게 해 줄 사람 나나나기부니가 좋아 나나나 모든 게 난 궁금해 Oh eh oh oh eh ohOh eh oh oh eh oh아마 우린 같은 생각하고 있는 것 같은데대체 뭐가 망설여져조금씩 맘을 풀어놔도 돼알고 싶어져 너의 모든 게 다 사소하더라도 알려줘 네 모든 걸오늘 니 옆자리 나나나널 웃게 해 줄 사람 나나나기부니가 좋아 나나나 모든 게 난 궁금해 Oh eh oh oh eh ohOh eh oh oh eh oh[ENG]I’ve got a message message“I’m bored” just sayingMy hands are busy busySo that our conversations won’t dry upI want to be fitted to you from up and downTell me your type, so I can get to know youSo that our hearts can be touchedSo that our hands can be touchedYou can rest up in my chest uh uh uhThe seat next to you is NANANAThe one who can make you smile is NANANAI’m feeling good NANANAI want to know everythingOh eh oh oh eh ohOh eh oh oh eh ohJust smiling for no reasonSlowly we are getting closerMy heart is like a racing horse on a taxi meterI know it’s frustrating, but blessed are those who endure, ayWe talk about us just naturallyincluding a bit of naughty talksOpen up all the roads and remove the linesI know it’s a bit mischievous, but we like it like thatThe seat next to you is NANANAThe one who can make you smile is NANANAI’m feeling good NANANAI want to know everythingOh eh oh oh eh ohOh eh oh oh eh ohI think we are thinking the same wayWhy are you hesitatingIt’s okay to open up your mindI want to know everything about youTell me everything, even the small things, tooThe seat next to you is NANANAThe one who can make you smile is NANANAI’m feeling good NANANAI want to know everythingOh eh oh oh eh ohOh eh oh oh eh oh[CHINESE]NANANA接收到信息说到：我很无聊我手头忙这忙那这样对话就可以一直持续我想要从头到脚和你完美匹配告诉我你的类型，这样我就可以了解你这样我们的心就可以彼此靠近我们的手就可以互相碰触在我的怀里休息一会儿uh uh uh你旁边的位置是我能让你开怀大笑的是我我现在感觉很好NANANA想要知道一切Oh eh oh oh eh ohOh eh oh oh eh oh总是无厘头傻笑我们渐渐靠近我的心跳得很快虽然有点令人沮丧 但是他们说能忍耐的人一定有福气 自然而然地开始谈论彼此还有些淘气的对话拓宽所有道路，抛开边界我知道有点调皮但是气氛刚刚好你旁边的位置是我能让你开怀大笑的是我我现在感觉很好NANANA想要知道一切Oh eh oh oh eh ohOh eh oh oh eh oh我觉得我们想的一样你还在犹豫什么你可以对我敞开心扉我想要知道关于你的一切哪怕是最小的事情也请告诉我你旁边的位置是我能让你开怀大笑的是我我现在感觉很好NANANA想要知道一切Oh eh oh oh eh ohOh eh oh oh eh oh[THAI]I’ve got message messageบอกว่าตอนนี้ “เบื่อๆ”มือผมพิมพ์ไม่หยุดเลยเพื่อไม่ให้บทสนทนาของเราจบลงผมอยากเข้ากับคุณได้อย่างสมบูรณ์แบบบอกมาสิ ว่าคุณชอบแบบไหน ผมจะได้รู้จักคุณมากกว่านี้เพื่อให้ใจสัมผัสใจ  เพื่อให้มือเราสัมผัสกันถ้าเหนื่อยก็ซบอกผมก่อนได้นะ  คนที่อยู่นั่งข้างคุณในวันนี้คือผม NANANAคนที่ทำให้คุณยิ้มได้คือผม NANANAคนที่มีความสุขคือผม NANANAผมอยากรู้ทุกอย่างเกี่ยวกับคุณเลยOh eh oh oh eh ohOh eh oh oh eh oh บ่อยครั้งที่ยิ้มออกมาโดยไม่มีเหตุผล ระยะห่างระหว่างเราค่อย ๆ ลดลง หัวใจของผมเต้นรัว ราวกับมิเตอร์แท็กซี่แม้จะอึดอัดสักหน่อย แต่ถ้าผ่านไปได้จะมีความสุขนะ เราพูดคุยกันอย่างสนิทใจกันมากขึ้นแม้กระทั่งเรื่องวาบหวิวพวกนั้น ทำลายกำแพงลง แล้วเปิดใจทุกเรื่องกันเถอะถึงแม้จะเป็นเรื่องพวกนั้น แต่เราก็ชอบนี่นา คนที่อยู่นั่งข้างคุณในวันนี้คือผม NANANAคนที่ทำให้คุณยิ้มได้คือผม NANANAคนที่มีความสุขคือผม NANANAผมอยากรู้ทุกอย่างเกี่ยวกับคุณเลย Oh eh oh oh eh ohOh eh oh oh eh ohบางทีเราอาจจะคิดเหมือนกันแล้วคุณลังเลอะไรอยู่ค่อยเป็นค่อยไปก็ได้นะผมอยากรู้ทุกเรื่องของคุณช่วยเล่าให้ฟังหน่อยสิ แม้จะเป็นเรื่องเล็ก ๆ ก็ตาม คนที่อยู่นั่งข้างคุณในวันนี้คือผม NANANAคนที่ทำให้คุณยิ้มได้คือผม NANANAคนที่มีความสุขคือผม NANANAผมอยากรู้ทุกอย่างเกี่ยวกับคุณเลยOh eh oh oh eh ohOh eh oh oh eh oh"
"3KZY41SqaTI","How This Man Just Caused a $45 BILLION Crash [Terra Luna]","2022-05-20T13:06:54Z","UC4QZ_LsYcvcq7qOsOhpAX4A","ColdFusion","28","22.31.05","Coldfusion|TV|Dagogo|Altraide|Technology|Apple|Google|Samsung|Facebook|Tesla","1795318","60085","11853","https://i.ytimg.com/vi/3KZY41SqaTI/default.jpg","False","False","Do Kwon thought he could rule the crypto world with Terra Luna, instead what followed was the largest failure to occur in the crypto space.Correction at 1:58 I showed the screenshot of the wrong project, it's supposed to be 'Basis Cash', not 'Basis Markets'. Sorry about that.--- About ColdFusion ---ColdFusion is an Australian based online media company independently run by Dagogo Altraide since 2009. Topics cover anything in science, technology, history and business in a calm and relaxed environment. » ColdFusion Discord:  https://discord.gg/coldfusion» Twitter | @ColdFusion_TV» Instagram | coldfusiontv» Facebook | https://www.facebook.com/ColdFusioncollective» Podcast I Co-host: https://www.youtube.com/channel/UC6jKUaNXSnuW52CxexLcOJg» Podcast Version of Videos: https://open.spotify.com/show/3dj6YGjgK3eA4Ti6G2Il8Hhttps://podcasts.apple.com/us/podcast/coldfusion/id1467404358ColdFusion Music Channel: https://www.youtube.com/channel/UCGkpFfEMF0eMJlh9xXj2lMwColdFusion Merch:INTERNATIONAL: https://store.coldfusioncollective.com/AUSTRALIA: https://shop.coldfusioncollective.com/If you enjoy my content, please consider subscribing!I'm also on Patreon: https://www.patreon.com/ColdFusion_TVBitcoin address: 13SjyCXPB9o3iN4LitYQ2wYKeqYTShPub8--- New Thinking written by Dagogo Altraide ---This book was rated the 9th best technology history book by book authority.In the book you’ll learn the stories of those who invented the things we use everyday and how it all fits together to form our modern world.Get the book on Amazon: http://bit.ly/NewThinkingbookGet the book on Google Play: http://bit.ly/NewThinkingGooglePlayhttps://newthinkingbook.squarespace.com/about/Sources:Personal interviews with sources at Terra Labshttps://www.coindesk.com/business/2022/05/08/ust-briefly-loses-peg-luna-drops-10/https://www.bloomberg.com/news/articles/2022-05-15/luna-crash-this-crypto-insider-warned-of-terra-ust-s-collapsehttps://www.coindesk.com/layer2/2022/04/22/built-to-fail-why-terrausds-growth-is-giving-finance-experts-nightmares/https://www.euronews.com/next/2022/05/12/terra-luna-stablecoin-collapse-is-this-the-2008-financial-crash-moment-of-cryptocurrencyhttps://decrypt.co/100434/what-happened-terras-bitcoin-reserve-ust-luna-crashedhttps://fortune.com/2022/05/13/terra-ust-stablecoin-crash-suspicious-potential-attack-george-soros/https://coinjournal.net/news/the-10-million-luna-twitter-bet-who-will-win/https://www.coindesk.com/business/2022/05/09/ust-stablecoin-falls-below-dollar-peg-for-second-time-in-48-hours/My Music Channel:  https://www.youtube.com/channel/UCGkpFfEMF0eMJlh9xXj2lMw//Soundtrack//Vesky - With YouDavid Keno - Golden Ticket (Original Mix)Deccies - SubtleZero 7 - Out of TownGoing Deeper - EscapeMogwai - Take Me Somewhere NiceGiyo - Are the Animals GoneJónsi & Alex - Boy 1904Psalm Trees, Guillaume Muschalle - Forever Tired Ft. Thomas RenwickBurn Water - Yellow Jade» Music I produce | http://burnwater.bandcamp.com or » http://www.soundcloud.com/burnwater» https://www.patreon.com/ColdFusion_TV» Collection of music used in videos: https://www.youtube.com/watch?v=YOrJJKW31OAProducer: Dagogo Altraide"
"KM0V1sMFjyA","Shipping Weird Items Prank","2022-05-28T21:30:40Z","UCpn_ODet9knMmEj5DB0_KnQ","Kanel Joseph","24","22.31.05","kanel|kanel joseph|pranks|prank|vlog","399940","27240","1942","https://i.ytimg.com/vi/KM0V1sMFjyA/default.jpg","False","False","Thanks for watching! You guys are the best!Merch: https://kaneljoseph.com/Instagram-  https://www.instagram.com/kaneljoseph/Twitter-  https://twitter.com/kaneljosephFacebook- https://www.facebook.com/mrkaneljosephBusiness Email: kaneljosephcontact@gmail.com"
"wDY__aoHkaA","COMPETING IN MARIO KART IN REAL LIFE FOR $10,000","2022-05-22T21:35:26Z","UC-O9o5coq8iFSVthivq__tw","Lexi Hensler","1","22.31.05","Brent Rivera|Pierson Wodzynski|ben Azelart|Lexi Rivera|faze rug|Mr beast|Ryan treyhan|airrack|Speed running a rhythm game is hard|rip papa Jim|dads vs daughters|Who is stronger|I survived 24 hours in the deep dark|I survived 100 days as sonic|busting 100 superhero myths in 24 hours","576037","26969","734","https://i.ytimg.com/vi/wDY__aoHkaA/default.jpg","False","False","We played Mario kart in real life for $10,000…Friends in the video:@Alexa Rivera HUDSON:https://instagram.com/hudsongrxnt?igshid=YmMyMTA2M2Y=CHAD:https://instagram.com/chad_hall_?igshid=YmMyMTA2M2Y="
"1e75DPhSLZU","Last to Leave the Pokémon Discord WINS.","2022-05-21T14:02:27Z","UCrer50j4M2Lv9wda2ZpqzRA","Purplecliffe","20","22.31.05","Purplecliffe|Last to leave VC|Pokemon|Discord|Pokemon discord|Shiny Hunter|L2LVC|Ukena|Gapp|Triceppps|purplecliffe funny","522993","21640","1717","https://i.ytimg.com/vi/1e75DPhSLZU/default.jpg","False","False","i was not prepared for this amount of chaos.Check out isaacwhy's version: https://www.youtube.com/watch?v=vyVxKh_VU0cJOIN THE DISCORD: http://discord.gg/purplecliffeFRIENDS IN THIS VIDEOTriceppps : https://www.youtube.com/c/TricepppsPaPaSea: https://www.youtube.com/c/PaPaSeaGapp: https://www.youtube.com/c/GappYTUkena: https://www.youtube.com/c/UkenalolMaximyss: https://bit.ly/MaximyssYThttps://twitter.com/MaximyssJLPartyPoppers: https://twitter.com/PartyPoppersOGKATIE: https://twitter.com/KayteaR17angelsalad: he doesn’t have a youtube but he says hi to everyone and thanks for asking!This video was made possible by this legend:Edited & produced by: Gdubshttps://twitter.com/GDubs___In this video, I invited 8 of my friends to joina Discord server, and whoever was the last one to stay awake won a HUGE mystery box! There are challenges that kick players out, but all they have to do is catch a shiny pokemon and they are okay! If you like this style of video, please let me know in the comments.SUBSCRIBE FOR MORE VIDEOS: ➡️ http://bit.ly/purplecliffe_ ​ ⬅️Follow all of these or you're bald:🎮 Livestreams! https://www.youtube.com/c/purplecliffevods✍🏻 Twitter! https://twitter.com/NotPurplecliffe📸Instagram! https://www.instagram.com/purplecliffe/?hl=en⏰TikTok! https://www.tiktok.com/@purplecliffe👾Reddit! https://www.reddit.com/r/Purplecliffe/More Purplecliffe:2ND Channel: https://www.youtube.com/c/Purplecliffe2ROBLOX Channel: https://www.youtube.com/channel/UCu3-IxhfwD1Yws-Xoot-K_QVODS Channel: https://www.youtube.com/c/PurplecliffeVodstold you this summer was going to be big ;)"
"7N90ngNtR3k","Mommy Long Legs with the Grinder / Making Grinder's Room [Poppy Playtime Chapter 2]","2022-05-19T10:51:35Z","UCWn1Vg2ssyWXJOGjv1khVsw","GURU Clay","20","22.31.05","Making Huggy|Huggy Wuggy's Room|Poppy Playtime|Poppy|Playtime|Huggy|Wuggy|Wuggy's Room|huggy wuggy poppy playtime|poppy playtime chapter 2|Huggy Wuggy|wuggy huggy|guru clay|making poppy playtime|making mommy long legs|POPPY PLAYTIME CHAPTER 2|PLAYTIME CHAPTER 2|CHAPTER 2|Mommy Long Legs|Mommy|Long Legs|mommy poppy play time|long legs poppy|long leg|fly in web|chapter 2 fly in web|with the Grinder|Grinder ROOM","6769342","75575","756","https://i.ytimg.com/vi/7N90ngNtR3k/default.jpg","False","False","Making Mommy Long Legs with the Grinder [Poppy Playtime Chapter 2]POPPY PLAYTIME CHAPTER 2 / Mommy Long Legs Ft. Huggy Wuggy's Room / FLY IN WEBhttps://www.youtube.com/watch?v=oshM4Zki1FI&t=11sMaking Poppy Playtime Huggy Wuggy X BOYFRIEND [ FNF ]https://www.youtube.com/watch?v=IN46JPmgBr8&t=3s#HUGGYWUGGY #mommylonglegs​​​ #poppplaytimeFB: https://goo.gl/5bgkvA​​​YT: youtube.com/c/guruanimation​​​instagram : https://goo.gl/7qdppC"
"diLv4LFeO2s","Inside the NBA talk about Tragic Shooting in Texas","2022-05-25T00:24:50Z","UCqQo7ewe87aYAe7ub5UqXMw","House of Highlights","17","22.31.05","[none]","1698154","31477","8342","https://i.ytimg.com/vi/diLv4LFeO2s/default.jpg","False","False","📌 SHOP OUR MERCH: https://hoh.world📌 Follow our Instagram: https://www.instagram.com/houseofhighlights📌 Follow our TikTok: https://www.tiktok.com/@houseofhighlights📌 Follow our Facebook: https://www.facebook.com/houseofhighlights#HouseofHighlights #NBA #HoH"
