video_id,title,publishedAt,channelId,channelTitle,categoryId,trending_date,tags,view_count,likes,comment_count,thumbnail_link,comments_disabled,ratings_disabled,description
"DfdbNFn8rqo","FIGHT HIGHLIGHTS | Canelo Álvarez vs. Dmitry Bivol","2022-05-08T06:41:19Z","UCurvRE5fGcdUgCYWgh-BDsg","DAZN Boxing","17","22.31.05","dazn|boxing|highlights|full fight|ko|knockout|top 10|The DAZN Boxing Show|Pelea|Boxeo|Pugile|dazn boxing|Canelo Álvarez vs. Dmitry Bivol fight|Canelo Álvarez vs. Dmitry Bivol highlights|Canelo Álvarez Dmitry Bivol|Canelo Álvarez highlights|Dmitry Bivol highlights|Canelo fights|Dmitry Bivol fights|Canelo Álvarez|Dmitry Bivol|Canelo","11107048","146672","24586","https://i.ytimg.com/vi/DfdbNFn8rqo/default.jpg","False","False","May 7th, 2022 -- Canelo Álvarez vs. Dmitry Bivol from Las Vegas.Subscribe to our YouTube channel 👉  http://bit.ly/DAZNBoxingYouTubeDownload the DAZN app now 👉  http://bit.ly/DAZNYoutubeFollow DAZN Boxing On Social Media 👇Twitter: https://www.twitter.com/DAZNBoxingInstagram: https://www.instagram.com/DAZNBoxingFacebook: https://www.facebook.com/DAZNThe DAZN Boxing Show ► https://bit.ly/3EQ70HNDazn Rewind ► https://bit.ly/32iAaRT#Dazn #DaznBoxing #CaneloÁlvarez #DmitryBivol"
"y0P96wmLzcQ","#1 HEAT at #2 CELTICS | FULL GAME HIGHLIGHTS | May 27, 2022","2022-05-28T03:42:43Z","UCWJ2lWNubArHWmf3FIHbfcQ","NBA","17","22.31.05","Basketball|G League|NBA|game-0042100306","2948262","31953","4023","https://i.ytimg.com/vi/y0P96wmLzcQ/default.jpg","False","False","Stay up-to-date on news, live scores and stats with the NBA App:https://app.link.nba.com/-App22Led by Jimmy Butler’s Playoff career-high 47 PTS (16-29 FG), along with 9 REB, 8 AST and 4 STL, the No. 1 seed Miami Heat defeated the No. 2 seed Boston Celtics in Game 6, 111-103. Kyle Lowry added 18 PTS and 10 AST for the Heat in the victory, while Jayson Tatum tallied 30 PTS and 9 REB for the Celtics. This best-of-seven series is now tied 3-3."
"U5bijOlB-4I","Food Theory: NEVER Eat The Right Twix!","2022-05-29T17:05:53Z","UCHYoe8kQ-7Gn9ASOlmI0k6Q","The Food Theorists","26","22.31.05","twix|twix commercial|left twix|right twix|chocolate|candy|candy bar|candy bar taste test|chocolate taste test|twix left right|left vs right|commercial|candy commercial|food theory|food theorists|matpat|game theory|film theory|asmr twix","1259960","78955","5063","https://i.ytimg.com/vi/U5bijOlB-4I/default.jpg","False","False","Get Your Core TheoryWear NOW! ► https://theorywear.com/Do you prefer eating the left or right Twix bar first? Is there even a difference? Well the marketing team at Twix sure wants you to think so! Today we are peeling back the wrapper on this question to find out if one side of your Twix candy bar is ACTUALLY superior!Get Your TheoryWear NOW! ► https://theorywear.com/SUBSCRIBE for Every Theory! ►► https://bit.ly/2CdCooV   Want More FOOD THEORY?You've Been SCAMMED! (Supermarket Secrets) ► https://youtu.be/EqviBPG2uPETootsie Pops, How Many Licks? ► https://youtu.be/qOS5NAdyWDwNever Order McDonald's Medium Fries! ► https://youtu.be/c_jnZkVlNtwKool Aid Man Is A Marvel Villain! ► https://youtu.be/CuZ14w_g3WA  Don't Trust Your Cake! ► https://youtu.be/dulS3GGiJ7M  Join our other Theorist Communities!Game Theory! ► http://bit.ly/1qV8fd6  Film Theory! ► http://bit.ly/1dI8VBH  Need Royalty Free Music for your Content? Try Epidemic Sound.Get A 30 Day Free Trial! ►  http://share.epidemicsound.com/theFoodTheoristsCredits:Writers: Matthew Patrick and Justin KuiperEditors: Koen Verhagen, Jerika (NekoOnigiri), and Daniel ZemkeAssistant Editor: Caitie Turner (Caiterpillart)Sound Editor: Yosi Berman#Twix #TwixCommercial #Candy #Chocolate #LeftTwix #RightTwix #Commercial #FoodTheory #MatPat #GameTheory #FilmTheory"
"hZms3n_qvc0","I let Twitch Chat decorate my new room","2022-05-24T19:38:33Z","UClyGlKOhDUooPJFy4v_mqPg","DougDoug","20","22.31.05","DougDoug|DougDoug Youtube Channel|Channel Youtube DougDoug|doug doug|twitch|twitch chat|dougdoug twitch chat|twitch chat plays|dougdoug twitch|fat albert|ball pit|decoration|roommate|room|house|timer|whale|balls|amazon|cherry|ragingcherry","752270","60327","2152","https://i.ytimg.com/vi/hZms3n_qvc0/default.jpg","False","False","I gave them a bunch of money, here's how they spent itThis was streamed live on Twitch! https://bit.ly/DougTwitchFull stream recording: https://www.youtube.com/watch?v=CKUFe7EasEkMy 2nd Channel: http://bit.ly/dougdoug2Twitter: https://twitter.com/DougDougFoodSubscribe: https://bit.ly/dougdougsubsubEdited by Berry Bebop! https://www.youtube.com/c/berrybebopMore DugDug:Latest Uploads: https://www.youtube.com/watch?v=rp4cH7mb4X4&list=PLzTxt5iYdhziB3Zf03HR_aZWgJ49ffj-d&index=2Explained with Food: https://www.youtube.com/playlist?list=PLzTxt5iYdhzjMJF--_xpj4s4jgOPe0NWFDougDoug Challenges: https://www.youtube.com/playlist?list=PLzTxt5iYdhzh_SW60_g3HPVjBupwUZOFAPopular Videos: https://www.youtube.com/playlist?list=PLzTxt5iYdhzgrLpm-SQNNAVOw0gVs8Iu_About DougDoug:Doug is a sentient bell pepper who was hired by the FBI to crack gaming challenges and also talk about things with food#DormRoom #TwitchChat #BallPit"
"1mLsbCAsKRo","HIGHLIGHTS | A-LEAGUE ALL STARS 2-3 BARÇA 🔵🔴","2022-05-25T13:04:25Z","UC14UlmYlSNiQCBe9Eookf_A","FC Barcelona","17","22.31.05","FC Barcelona|برشلونة،|Fútbol|FUTBOL|soccer|FUTEBOL|Sepakbola|サッカー|كرة القدم|football|FCB|Barça|Sport|Club|Barcelona|CAMP NOU|ter stegen|pique|busquets|goat|dembele|lenglet|yt:cc=on|ansu fati|riqui puig|koeman|coutinho|pedri|de Jong|Memphis|depay|Kun Agüero|Aguero|2-3|Australia|A-LEAGUE ALL STARS|BARÇA|Friendly|Sydney","1187091","53120","1152","https://i.ytimg.com/vi/1mLsbCAsKRo/default.jpg","False","False","FC Barcelona’s first ever trip to Australia has been a resounding success. A huge crowd at the Accor Stadium, Sydney was treated to a fabulous game of football that saw the lead change hands twice, and the visitors eventually seeing off the A-League All Stars 3-2.SUBSCRIBE NOW:▶ https://www.youtube.com/user/fcbarcelona ⚽ BARÇATV+: http://barca.link/wT1w30qMyQO​💎 Official Culers Membership: http://barca.link/plXS30rAhfC​🌐 Site: http://www.fcbarcelona.com📱 App: https://go.onelink.me/xndC/DownloadAppYouTube🔵 Facebook: http://www.facebook.com/fcbarcelona📸 Instagram: http://www.instagram.com/fcbarcelona🐦 Twitter: http://twitter.com/FCBarcelona🎶 Tiktok: https://www.tiktok.com/@fcbarcelona 📱 Viber: http://chats.viber.com/fcbarcelona🛍 Get all official Barça apparel from FC Barcelona's online store: http://barca.link/j8QH30qQh4Y 🔵🔴 #FCBarcelona"
"wc74cMicvxo","BYE","2022-05-27T19:09:35Z","UCDDgfKQE3eaD1H08VHRAfig","PontiacMadeDDG VLOGS","26","22.31.05","[none]","297097","20862","1491","https://i.ytimg.com/vi/wc74cMicvxo/default.jpg","False","False","marathon starts june 1st"
"waX5YJgc8Kc","Destiny 2: The Witch Queen - Season of the Haunted Trailer","2022-05-24T00:47:13Z","UC52XYgEExV9VG6Rt-6vnzVA","Destiny 2","20","22.31.05","Destiny|destiny 2|games|gaming|redacted|hype|ps5|xbox|stadia|steam|FPS|MMO","1012657","48617","5834","https://i.ytimg.com/vi/waX5YJgc8Kc/default.jpg","False","False","Driven by an insatiable lust for power, Calus seeks the approval of a new master. His once-opulent ship, now derelict and corrupted, has returned to our galaxy—its sights set on the power promised by the Pyramid ship lying dormant on the Moon. As the Leviathan forms a connection with the Pyramid, Nightmares of humanity’s past awaken and threaten to torment any who dare intervene. Stare into the abyss and find bravery within the mantle of the reaper and the steel of the scythe. Learn More: https://bung.ie/hauntedFOLLOW DESTINY:Facebook: https://www.facebook.com/DestinyTheGameTwitter: https://www.twitter.com/destinythegameInstagram: https://www.instagram.com/destinythegameDiscord: http://www.discord.gg/destinygame FOLLOW BUNGIE:Facebook: https://www.facebook.com/Bungie/Twitter: https://www.twitter.com/bungieInstagram: https://www.instagram.com/bungie/⠀ ⠀ ⠀ ⠀Dive into the free-to-play world of Destiny 2 to experience responsive first-person shooter combat, explore the mysteries of our solar system, and unleash elemental abilities against powerful enemies. Create your Guardian and collect unique weapons, armor, and gear to customize your look and playstyle. Experience Destiny 2’s cinematic story alone or with friends, join other Guardians for challenging co-op missions, or compete against them in a variety of PvP modes."
"k7H2C5L8X7I","XXXTENTACION & YE - True Love (Official Audio)","2022-05-27T04:00:13Z","UCM9r1xn6s30OnlJWb-jc3Sw","XXXTENTACION","10","22.31.05","xxxtentacion|true love|ye|kanye west|kanyewest|kanye|makeouthill","2797566","350218","25391","https://i.ytimg.com/vi/k7H2C5L8X7I/default.jpg","False","False","Listen & Download “True Love” out now: https://xxxtentacion.lnk.to/TrueLoveNew merch at https://shopxxxtentacion.comFollow XXXTENTACIONInstagram - https://www.instagram.com/xxxtentacion/Twitter - https://mobile.twitter.com/xxxtentacion https://www.makeouthill.com/ #XXXTENTACION #TrueLove #YE"
"7qxDNkSOrmI","Stuffing The largest Engine We Could Find in the Wrecker","2022-05-22T13:15:01Z","UCwdVOry0oNF9WIe_3uCfz9Q","Matt's Off Road Recovery","2","22.31.05","Off road recovery|Rescue|Matts off road recovery|Sand Trap|road recovery|Recovery|Difficult rescue|Winder Towing|Towing|Sand dunes|dunes|Jeep|Sand Hollow|utah|off road recovery fails|off road recovery truck|Rescuing|matts off road recovery|morrvair|banana|off road recovery|jeep recovery|off road towing|off road fails|broken down|off road sand dunes|worlds largest off road wrecker|wrecker build|off road wrecker|8.1 big block|massive engine|engine swap","954448","46811","2264","https://i.ytimg.com/vi/7qxDNkSOrmI/default.jpg","False","False","So I got a build project and I got to fit this massive engine into the off road wrecker.If you would like to make a donation to help us with the all abilities park, you can do that here. https://mattsoffroadrecovery.com/collections/donationsSubscribe  https://www.youtube.com/channel/UCwdVOry0oNF9WIe_3uCfz9Q/?sub_confirmation=1 Watch MORR Videos:Lying To Your Mom, Big Mistake! Dead Ford Next To Lakehttps://www.youtube.com/watch?v=O7VQLKnohi0&list=PLEi6DFDVEqybxvABm2SDL4iqKO3PHRFVYCustomer Goes Off A Cliff! Lucky To Be Alivehttps://www.youtube.com/watch?v=nIDRSWETUF4&list=PLEi6DFDVEqybxvABm2SDL4iqKO3PHRFVYMassive Springs For A Massive Wrecker!https://www.youtube.com/watch?v=EUwaOxMvMqk&list=PLEi6DFDVEqybxvABm2SDL4iqKO3PHRFVY&index=2You Don't See This Everyday!https://www.youtube.com/watch?v=hqDu_Xmr_xY&list=PLEi6DFDVEqybxvABm2SDL4iqKO3PHRFVYWorld's Largest Off Road Wrecker Get's Some Springshttps://www.youtube.com/watch?v=sFe1ynzEAIc&list=PLEi6DFDVEqybxvABm2SDL4iqKO3PHRFVYI Don’t Think This Is Legal… Forced To Break The Lawhttps://www.youtube.com/watch?v=u1_3-8oa2qk&list=PLEi6DFDVEqybxvABm2SDL4iqKO3PHRFVYIs This How The Worlds Largest Off-Road Wrecker Will Look?https://www.youtube.com/watch?v=IdwRmQMJPoo&list=PLEi6DFDVEqybxvABm2SDL4iqKO3PHRFVY50,000 Pounds! This Might Be Too Heavy For The Bananahttps://www.youtube.com/watch?v=Nx-X5rKisqM&list=PLEi6DFDVEqybxvABm2SDL4iqKO3PHRFVYMatt's Off Road shirts, hats, hoodies, keychains and stickers!https://www.mattsoffroadrecovery.comMatt’s rope of choice 30Matt's Recovery Rope by Yankum Ropeshttps://www.mattsoffroadrecovery.com/Tank Straps, how we tie down our vehicleshttps://amzn.to/3dXBImJ10% Off the best parts for your Off Road Vehicle Barnes 4WDhttps://www.barnes4wd.com/?ApplyPromo=morrJeep Cherokee XJ bags, we use ours for first aid.https://www.amazon.com/gp/product/B071RXKC7M/ref=as_li_tl?ie=UTF8&camp=1789&creative=9325&creativeASIN=B071RXKC7M&linkCode=as2&tag=windertowing-20&linkId=8168ff9f968defa533bd00654952d1a8Follow us on Facebook! https://www.facebook.com/mattsoffroadrecoveryFollow us on Instagram!https://tinyurl.com/y6pkp3mgPlease like, subscribe, and share! Thanks for watching, from all of us at Matt's off-road recovery!"
"ktluMBr4VXM","Gervonta Tank Davis KOs Rolando Rolly Romero in RD6","2022-05-29T05:05:17Z","UCWXYAGB9SadlL6p5Bb66wWw","Premier Boxing Champions","17","22.31.05","Boxing|PBC|premier boxing champions|ko|tko|knockouts|al haymon|showtime boxing|wilder|broner|fighting|highlights|wbo|wba|wbc|ibo|ibf|boxing highlights|gervonta davis|gervonta davis knockouts|gervonta davis highlights|gervonta tank davis|tank davis|davis vs romero|davis ko romero|davis knockout|Davis vs Romero highlights|davis vs romero KO|rolly romero ko|gervonta davis KO|rolly romero|rolando romero|romero knockout|gervonta davis vs rolando romero","3827387","33063","6817","https://i.ytimg.com/vi/ktluMBr4VXM/default.jpg","False","False","Gervonta Davis said he wanted to deliver punishment to Rolando Rolly Romero for all the talking he's done in the build up the fight. In RD6 he lands a beautiful left hook that sent Romero face first into the ropes.An incredible finish to an incredible fight.#DavisRomero #GervontaDavis #RollyRomeroVisit PremierBoxingChampions.com for more info.SIGN UP FOR FIGHT ALERTS: https://pbcham.ps/FightAlertsFOLLOW US:https://twitter.com/premierboxinghttps://instagram.com/premierboxinghttps://www.facebook.com/premierboxingchampions"
"YQ8iIp33_EY","Ewan McGregor and Hayden Christensen Take The Stage At SWCA 2022 | Star Wars Celebration Live!","2022-05-27T01:25:27Z","UCZGYJFUizSax-yElQaFDp5Q","Star Wars","24","22.31.05","Obi-Wan Kenobi|Kenobi|Anakin|Anakin Skywalker|Star Wars|Darth Vader|Star Wars Celebration|Ewan Mcgregor|Hayden Christensen","1626692","71748","3703","https://i.ytimg.com/vi/YQ8iIp33_EY/default.jpg","False","False","Watch Ewan McGregor and Hayden Christensen's interview at Star Wars Celebration Anaheim 2022."
"pM3stM3uI00","Take 1/2 Cup of This Before Bed to SLEEP LIKE A BABY","2022-05-23T10:05:54Z","UC3w193M5tYPJqF0Hi-7U-2g","Dr. Eric Berg DC","27","22.31.05","take 1/2 cup of this before bed to sleep like a baby|how to sleep better|sleep better|sleep|better sleep quality|natural remedy for sleep|sleep tips|better sleep|how to get better sleep|tips to sleep better|kefir|benefits of kefir|kefir benefits|kefir for sleep|how to sleep fast|improve sleep|sleep better at night|home remedies|sleep remedies|serotonin|sleep better dr berg|kefir dr. berg|dr. berg on sleep|dr. eric berg|eric berg|dr. berg|berg","1705946","40849","2480","https://i.ytimg.com/vi/pM3stM3uI00/default.jpg","False","False","KEFIR WEBSITE HERE: https://www.happyherbalist.comFind out how this simple remedy can help you sleep better. DATA:https://journals.plos.org/plosone/article?id=10.1371/journal.pone.0146643#https://www.ffhdj.com/index.php/ffhd/article/view/572#:https://www.happyherbalist.com/kefir-live-grains-milk-kefir/0:00 Introduction: The best natural remedy for sleep 0:20 What is kefir? 1:27 Kefir benefits 1:45 Kefir for better sleep 3:55 The best type of kefir to consume 4:30 How to make kefir 5:40 Check out my video on other things that help promote sleep!Sleep is so important, and I believe this remedy will help you get the sleep you need. The best natural remedy for sleep is kefir. Consume 1/2 cup of kefir before bed for better sleep. Kefir is similar to yogurt, but it’s better. It has more healthy, diverse microbes than yogurt. Many of these friendly microbes also survive your stomach acids, whereas the microbes in yogurt don’t.Kefir not only has friendly bacteria but friendly yeast, too. This combination is essential. People with lactose intolerance also have an easier time digesting kefir than yogurt. Health benefits of kefir: • Decreased liver fat  • Fewer allergy symptoms  • Improved immune system  • Decreased inflammation  • Less constipation  • Better blood sugar  • Better blood pressure  • Decreased pathogens Certain microbes make serotonin. The more of the right microbes you have, the more serotonin you’ll have. Serotonin is a hormone that can positively affect your mood and reduce stress. Kefir provides microbes that make melatonin, which is a sleep hormone. Not only that, but kefir contains microbes that make the amino acid tryptophan. Tryptophan turns into serotonin and then melatonin. Kefir is a good source of bioavailable calcium, which can help you get to sleep and stay asleep. The microbes in kefir also make certain B vitamins, which can greatly help with stress and calm a busy mind. The lactobacillus in kefir helps reduce cortisol, which will also help you sleep better. I highly recommend making your own kefir. You need something called kefir live grains (there is no grain in it) to get started. I like using goat milk, but you can use cow milk. The website I use to buy my kefir grains (happyherbalist.com) explains exactly how to make kefir. Basically, you add 1 Tbsp of the kefir grains to 1 to 2 cups of milk. Then, you set it on the counter and cover it using a cloth or paper towel and a rubber band. After 24 hours, you’ll have kefir. ADD YOUR SUCCESS STORY HERE:https://www.drberg.com/add-client-success-story?utm_source=youtube&utm_medium=descriptionFREE COURSE➜ ➜ http://bit.ly/BulletproofImmuneSystemCourseTalk to a Product Advisor to find the best product for you!Call 1-540-299-1556 with your questions about Dr. Berg's products. Product Advisors are available Monday through Friday 8am-6pm and Saturday 9am-5pm EST. * At this time, we no longer offer Keto Consulting and our Product Advisors will only be advising on which product is best for you and advise on how to take them.Dr. Eric Berg DC Bio:Dr. Berg, age 56, is a chiropractor who specializes in Healthy Ketosis & Intermittent Fasting. He is the author of the best-selling book The Healthy Keto Plan, and is the Director of Dr. Berg Nutritionals. He no longer practices, but focuses on health education through social media.Follow Me On Social Media:Facebook:  https://bit.ly/FB-DrBergInstagram:  https://bit.ly/IG-DrBergAnchor:  https://bit.ly/Anchor-DrBergTikTok:  https://bit.ly/TikTok-DrBergDR. BERG'S SHOP: http://shop.drberg.com/Send a Message to his team: https://m.me/DrEricBergABOUT DR. BERG: https://www.drberg.com/dr-eric-berg/bioDisclaimer:Dr. Eric Berg received his Doctor of Chiropractic degree from Palmer College of Chiropractic in 1988.  His use of “doctor” or “Dr.” in relation to himself solely refers to that degree.  Dr. Berg is a licensed chiropractor in Virginia, California, and Louisiana, but he no longer practices chiropractic in any state and does not see patients so he can focus on educating people as a full time activity, yet he maintains an active license. This video is for general informational purposes only.  It should not be used to self-diagnose and it is not a substitute for a medical exam, cure, treatment, diagnosis, and prescription or recommendation.  It does not create a doctor-patient relationship between Dr. Berg and you.  You should not make any change in your health regimen or diet before first consulting a physician and obtaining a medical exam, diagnosis, and recommendation.  Always seek the advice of a physician or other qualified health provider with any questions you may have regarding a medical condition. #keto #ketodiet #weightloss #ketolifestyleThanks for watching! Try this great tip to help promote better sleep. I’ll see you in the next video."
"oQUyovbOIJo","Power Book III: Raising Kanan | Season 2 Official Teaser | STARZ","2022-05-27T13:00:24Z","UCXVxMuWK6l_pCyxEk07EIRw","STARZ","24","22.31.05","Power book III|Raising Kanan|Power Kanan|Power never ends|legacy|sneak peek|preview|Starz|television|tv|new power|aftermath|spinoff|Power spinoff|finale|new|new episodes|Power|Power on Starz|Power III on Starz|Power Book III: Kanan clip|Power book III: Raising Kanan Official Clip|power book kanan|Trailer|Kanan Power Book Trailer|raising kanan sneak peek|season preview|ep 6|episode 6|sneak preview","342015","7122","576","https://i.ytimg.com/vi/oQUyovbOIJo/default.jpg","False","False","It's a family business. Raising Kanan premieres 8/14, on @Starz.#PowerNeverEnds #STARZ #RaisingKananSubscribe to the STARZ YouTube Channel for more Power: http://bit.ly/1kalhP0Get your special offer of the STARZ app: https://starz.tv/32s4aGTLike Raising Kanan on Facebook: https://bit.ly/3aCYxuEFollow Raising Kanan on Twitter:  https://bit.ly/3xqd9qVFollow Raising Kanan on Instagram: https://bit.ly/3vmiVrXLike STARZ on Facebook: http://starz.tv/STARZFacebookYTFollow STARZ on Twitter: http://starz.tv/STARZTwitterYTFollow STARZ on Instagram: http://starz.tv/STARZInstagramYTVisit STARZ on YouTube: http://bit.ly/1mkHKgZ"
"ZLTZWGx3G9o","This is what happens when you let Jake Paul watch your kids...","2022-05-25T19:36:32Z","UCfFsZu7Ed20xKDOmzdpF3EQ","Trav and Cor","22","22.31.05","trav and cor|tydus|titus|tidus|mini Jake paul|ryry|knock knock|nock nock|scary|shocking|bad|surprise|surprising|the scientist|the clone|ruined|Jake paul|cry|cried|fight|crying|fights|presents|caught|opened|blamed|clone|clones|crush|sister|brother|boy|girl|mom|dad|big trouble|footage|Ryry clone|catching|Tydus clone|basement|baby|awful|Katie taylor|Amanda serrano|boxing|match|new york|bully|babysit|Julia rose|Jake Paul girlfriend|waterpark|water slide|babysitting","1049452","23615","3107","https://i.ytimg.com/vi/ZLTZWGx3G9o/default.jpg","False","False","We let Jake Paul and Julia Rose babysit our kids and this happened...GIVE this video a THUMBS UP,  SUBSCRIBE,  and COMMENT to have a chance to win the NINTENDO SWITCH OLED Giveaway!!!!!!😀SUBSCRIBE👉 http://bit.ly/TravandCor**TURN On POST NOTIFICATIONS**_________________________________________________________________Download GONNA BE on Apple Music:https://music.apple.com/us/album/gonna-be-single/1572065698Download GONNA BE on Spotify:https://open.spotify.com/album/6zGdtUzLyc7pVmCBB6DyVsFollow Tydus on TikTok: @thetydustalbott________________________________________________________________FOLLOW US ON INSTAGRAM:@travandcor https://www.instagram.com/travandcor/@tydushttps://www.instagram.com/tydus/@minijakepaulhttps://www.instagram.com/minijakepaul/@ryatttalbotthttps://www.instagram.com/ryatttalbott/@bowietalbott https://www.instagram.com/bowietalbott/@travistalbotthttps://www.instagram.com/travistalbott/@coreytalbotthttps://www.instagram.com/coreytalbott/__________________________________________Follow Tydus on TikTok: @thetydustalbott________________________________________________________Download Happy Hallo-Scream on Apple Music: https://music.apple.com/us/album/happy-hallo-scream-single/1536557020Download Happy Hallo-Scream on Spotify: https://open.spotify.com/album/3dDtZzXThJZEdY3foKvT7XCheckout Happy Hallo-Scream on Amazon Music:https://www.amazon.com/Happy-Hallo-Scream/dp/B08LNJ3WZL/ref=sr_1_1?dchild=1&keywords=tydus+happy+hallo-scream&qid=1603554017&s=music&sr=1_____________________________________________________________________________Download Hit That Combo on Apple Music: https://music.apple.com/us/album/hit-that-combo-single/1508885885Download Hit That Combo on Spotify: https://open.spotify.com/track/5L3A2Svd9LOaEFgrluc6wM?si=S0GGh52DS0aTy7PtpR_qRA________________________________________________________Stream Tydus's song First Girlfriend on Spotify:https://open.spotify.com/track/7wlQ8W5kpk06CvpVLp5E8C?si=Lvg5VEXPR2u43mcOD1DGgQStream First Girlfriend on iTunes:https://music.apple.com/us/album/first-girlfriend/1491314126?i=1491314134TYDUS - First Girlfriend (Official Music Video):https://www.youtube.com/watch?v=auDZa5YAq-YWatch these other KNOCK KNOCK videos:https://www.youtube.com/watch?v=PVJiY8XKl0w&t=196shttps://www.youtube.com/watch?v=oDMVGHZzrLY"
"OuF203w5nHo","Ellen Says Goodbye","2022-05-26T20:02:13Z","UCp0hYYBW6IMayGgR-WeoCvQ","TheEllenShow","24","22.31.05","[none]","2246874","110031","5930","https://i.ytimg.com/vi/OuF203w5nHo/default.jpg","False","False","Ellen shared her gratitude and said goodbye to her talk show after 19 seasons. #Ellen #TheEllenShow #EllenDeGeneresSubscribe to The Ellen Show: https://ellen.tv/3D6Sewq FOLLOW THE ELLEN SHOWInstagram: https://www.instagram.com/theellenshow/Facebook: https://www.facebook.com/ellentv/Twitter: https://twitter.com/TheEllenShowTikTok: https://www.tiktok.com/@ellendegeneres Website: https://www.ellentube.com/The place for laughs, joy, stars, surprises, and everything Ellen.Ellen Says Goodbyehttps://youtu.be/OuF203w5nHo"
"R2XoWbxiCD8","2022 RACE HIGHLIGHTS // 106TH RUNNING OF THE INDIANAPOLIS 500 PRES. BY GAINBRIDGE","2022-05-29T23:35:20Z","UCy1F61QvUUQXAXi2Voa_fUw","NTT INDYCAR SERIES","17","22.31.05","IndyCar|Racing|Motorsports|NTT|NTT IndyCar Series|Open-Wheel|NTT DATA|Autosports|Indy car|Indy|Indianapolis 500|Marcus Ericsson|Indianapolis Motor Speedway|Indy 500|Indianapolis|Chip Ganassi Racing|Ganassi|Ericsson|Honda","290569","5360","729","https://i.ytimg.com/vi/R2XoWbxiCD8/default.jpg","False","False","After 200 laps and 500 miles, there's a new Indy 500 champion.Check out all the highlights from race day at the Indianapolis Motor Speedway.Download the INDYCAR App Powered by NTT DATA: https://www.indycar.com/mobile-appFollow the NTT INDYCAR SERIES:Twitter // https://twitter.com/IndyCarFacebook // https://www.facebook.com/indycarInstagram // https://www.instagram.com/indycar"
