video_id,title,publishedAt,channelId,channelTitle,categoryId,trending_date,tags,view_count,likes,comment_count,thumbnail_link,comments_disabled,ratings_disabled,description
"l7PsjG_cUFs","Poppy Playtime: Chapter 3 - NEW TRAILER 2022 | NetPro's Concept Version","2022-05-28T10:57:59Z","UCgLKyuJH2kaZX5sIJLKZ_aQ","NetPro","20","22.31.05","poppy|poppy playtime|huggy wuggy|huggy wuggy glitches|poppy glitch|poppy playtime secrets|poppy playtime glitches|poppy playtime update|poppy garys|poppy playtime 2|poppy playtime mod|poppy playtime game|poppy playtime hack|poppy playtime funny|poppy playtime chapter 3|poppy playtime chapter 3 gameplay|huggy wuggy chapter 3|poppy playtime chapter 3 trailer|chapter 3|chapter 3 trailer|chapter|poppy playtime 3","4170390","69028","1771","https://i.ytimg.com/vi/l7PsjG_cUFs/default.jpg","False","False","Poppy Playtime: Chapter 3 - NEW TRAILER 2022 | NetPro's Concept VersionThis trailer is a concept-mashup that shows my idea of ​​how the teaser trailer for Poppy Playtime Chapter 3 might look like.       ____________________________________________◖Made/Edited By NetPro ◗▻ netfl.pro192@gmail.com____________________________________________◅ On our channel we create а trailer mashups ▻also known as recut trailers, involve collecting multiple pieces of film footage from one or multiple movies and editing them to create a new trailer. Trailer mashups are often created for a movie that does not exist now or to change the genre of an existing film. These are derivative works as defined by the United States Copyright Act 17 U.S.C. § 101, and as such, may find protection from copyright claims under the doctrine of fair use.There is no intention of infringing on anyone's intellectual property. This is not intended to deceive or defraud anyone; rather, it is intended to give fans a taste of what the film may be like. I don't own the material; I simply produce trailers for fans and others who are excited about a movie.The trailer mashups are not only a user generated form of digital creativity but a way to create anticipation for future releases, working in tandem with current movie trailers. Movie trailers are designed to give minimal plot detail and to create hype and anticipation. Fan made trailer mashups allow the audience to perform their own cinematic spin on current movie footage. This allows the trailer to focus on a specific actor or portion of the film. It could even change the plot or genre of the film entirely.____________________________________________About Poppy Playtime:A survival horror video game with puzzle elements, developed and published by indie developer MOB Games. It was released on Steam for Windows on October 12, 2021. The game tells the story of a former employee who visits an abandoned factory of children's toys, formerly owned by the gaming company Playtime Co., 10 years after its employees disappeared without a trace."
"OZrftoPOXfY","Testing Scary Minecraft Myths To Prove Them Wrong","2022-05-28T02:00:05Z","UC-g_O9HWb5B0rVDG1hLd5Hw","Eystreem","20","22.31.05","Eystreem|eyestream|eystream|minecraft|minecraft pe|family friendly|roleplay|funny|troll|trolling|prank|secret|hidden|tutorial|minecraft phone|minecraft bedrock edition|testing scary minecraft|scary minecraft myths|testing scary minecraft myths|scary minecraft|minecraft myth|minecraft blood golem|scary blood golem|scary iron golem|cursed villager|testing scary minecraft myths to prove them wrong|minecraft blood villager|blood villager|scary villager","1593035","42540","2726","https://i.ytimg.com/vi/OZrftoPOXfY/default.jpg","False","False","The Terrifying Story of the Blood Villager! What happens if you open a Minecraft Beta World in 1.18? The answer will shock you...Play Minecraft with ME and be IN VIDEOS! 😝 Just click the 'JOIN' button here ▶https://www.youtube.com/channel/UC-g_O9HWb5B0rVDG1hLd5Hw/join❤️ Tik Tok: https://direct.me/eystreem📷 Instagram: https://direct.me/eystreem🎮 My Minecraft Server Address: play.eyserver.comYou can join this server on Bedrock Edition (Phones, Consoles and Tablets) and Java Edition (PC and Mac)💙 Huge thanks and credit to these awesome creators for inspiring today's video: https://docs.google.com/document/d/1_UilMRDHRNSZ3VyzxhW0fQ6_T5GfizFUlMGCI20vPGI/edit?usp=sharing🎵 Music from: http://share.epidemicsound.com/wn87w#Eystreem #Minecraft"
"7xidOWnzSu4","Baymax! | Official Trailer 2 | Disney+","2022-05-20T14:00:12Z","UC_976xMxPgzIa290Hqtk-9g","Walt Disney Animation Studios","1","22.31.05","Disney|Walt Disney Animation Studios|Disney Animation|Walt Disney|Animation","4835473","200120","3750","https://i.ytimg.com/vi/7xidOWnzSu4/default.jpg","False","False","In celebration of National Streaming Day, Disney+ has released a new trailer and key art for Walt Disney Animation Studios’ “Baymax!” Streaming exclusively on Disney+ on June 29, the all-new series of healthcare capers returns to the fantastical city of San Fransokyo where the affable, inflatable, inimitable healthcare companion robot, Baymax, sets out to do what he was programmed to do: help others. “I thought it would be fun to do a Disney+ series with Baymax interacting with normal folks,” said series creator Don Hall, who helmed 2014’s Oscar®-winning film “Big Hero 6.” “In each of our six episodes, Baymax just wants to help someone—and a lot of times they don’t want to be helped. He sets out to fix a physical issue that he's identified, and in the process, gets to a deeper, more emotional place and can be almost transformative in that role.” “Baymax!” is produced by Roy Conli and Bradford Simonsen. The series’ episodes are directed by Dean Wellins (Eps 1, 2, 6), Lissa Treiman (Ep 3), Dan Abraham (Ep 4) and Mark Kennedy (Ep 5). Screenwriter is Cirocco Dunlap. Scott Adsit returns as the voice of Baymax. Voice talent featured in episodes include Ryan Potter, Maya Rudolph, Emily Kuroda, Lilimar, Zeno Robinson and Jaboukie Young-White.Twitter: @DisneyAnimationInstagram: @DisneyAnimationFacebook:  @DisneyAnimationHashtag: #DisneyPlus"
"G56XvqUWOd0","Camilo - Pegao (Official Video)","2022-05-19T16:00:08Z","UCXQIVincj_W4CYfWKB1iPVQ","CamiloVEVO","10","22.31.05","camilo|pegao|pegado|camilo pegao|pegao video oficial|official video pegao|pegao letra|letra pegao|pegao lyrics|lyrics pegao|video letra pegao|pegado camilo|camilo pegado|nueva cancion camilo|camilo nueva cancion|nuevo video camilo|lo nuevo de camilo|camilo 2022|camilo video nuevo|camilo indigo|pegado video oficial|pegao en indigo|pegao como lengua en vaso congelao|como la olla del arroz|como un perro con su dueño|como","10862794","329396","7912","https://i.ytimg.com/vi/G56XvqUWOd0/default.jpg","False","False","Camilo - Pegao (Official Video)Música:Apple Music: https://Camilo.lnk.to/Pegao/applemusic Spotify: https://Camilo.lnk.to/Pegao/spotify Amazon: https://Camilo.lnk.to/Pegao/amazonmusicstreaming YouTube: https://Camilo.lnk.to/Pegao/youtube iTunes: https://Camilo.lnk.to/Pegao/itunes Deezer: https://Camilo.lnk.to/Pegao/deezer TikTok: https://Camilo.lnk.to/Pegao/tiktokusemysound Pandora: https://Camilo.lnk.to/Pegao/pandora Letra:Yo sé que estas a dos pasos de miPero te siento lejos Acércate un poquito mas Mira que yo me dejoQuiero tenerte aquí conmigoRespirándome al oídoQue no queda el aire entre tu cuerpo y el míoPegao Como en iglesia de barrioPegaoComo lengua en vaso congelaoPegaoComo en discoteca de puebloTo’ el mundo pegao, pegaoPegaoComo camisa en cuerpo SudaoComo la olla del arrozPegaoYo quiero estar todo el día A tu lao pegao, pegaoPegao de tiDe tiPegao de tiInseparablesComo el agua de la sal del mar Como lava que hay en un volcánComo un perro con su dueñoLa luna y el cieloInseparablesInseparables Como un niño tras de su mamáQue se pone mal cuando no estaInseparablesComo Colombia, Venezuela y Panamá Pegao Como en iglesia de barrioPegaoComo lengua en vaso congelaoPegaoComo en discoteca de puebloTo’ el mundo pegao, pegaoPegaoComo camisa en cuerpo SudaoComo la olla del arrozPegaoYo quiero estar todo el día A tu lao pegao, pegaoPegao de tiFacebook: https://www.facebook.com/camilomusica Twitter: https://twitter.com/camilomusica Instagram: https://www.instagram.com/camiloTikTok: https://www.tiktok.com/@camilo#Camilo #PegaoDirigido por: Evaluna Montaner & Cristian SaumethMusic video by Camilo performing Pegao (Official Video). (C) 2022 Sony Music Entertainment US Latin LLC /Hecho A Mano Music (HAMM)"
"2rPEcmPTVfg","Bel’Veth, The Empress of the Void | Champion Trailer - League of Legends","2022-05-23T15:00:03Z","UC2t5bjwHdUX4vM2g8TRDq5g","League of Legends","20","22.31.05","Riot Games|Riot|League of Legends|League|LoL|MOBA|bel'veth|bel'veth champion|bel'veth lol|belveth|belveth lol|bel|veth|void|bel'veth skins|belveth skins|bel’veth teaser|bel’veth champion trailer|champion trailer|champ trailer|gameplay|gameplay trailer|lavender sea|the empress of the void|void empress|league bel'veth|new bel'veth|new champion lol|new void champ|story of bel’veth|bel’veth video|bel’veth animation|jungler","1728922","58436","4883","https://i.ytimg.com/vi/2rPEcmPTVfg/default.jpg","False","False","Her hunger is insatiable.League of Legends Sign Up & Downloadhttps://signup.leagueoflegends.com/Bel'Veth - All That Will Ever Be Cinematichttps://www.youtube.com/watch?v=hjPS3j5XNssBel'Veth - Music Themehttps://www.youtube.com/watch?v=Ie2ia4kyRx4Bel'Veth's Promise Champion Teaserhttps://www.youtube.com/watch?v=Gy05rWRUVQQBel'Veth's Warning Champion Teaserhttps://www.youtube.com/watch?v=bH8Ca-Rms_4Bel'Veth - Universe Pagehttps://universe.leagueoflegends.com/en_US/champion/belveth/Bel'Veth - Pinwheel Short Storyhttps://universe.leagueoflegends.com/en_US/story/belveth-color-story/"
"lPpsyBxQtro","BIGFOOT is BIG ANGRY","2022-05-20T16:09:04Z","UC7_YxT-KID8kRbqZo7MyscQ","Markiplier","20","22.31.05","markiplier|bigfoot|bigfoot game|bigfoot gameplay|bigfoot yeti|abominable snowman|scary games|scary bigfoot game|scare reactions|multiplayer horror|online horror|multiplayer scary games|markiplier scary games|muyskerm|lordminion777|mark bob wade","3318271","179281","4275","https://i.ytimg.com/vi/lPpsyBxQtro/default.jpg","False","False","LISTEN TO OUR PODCAST ►► https://open.spotify.com/show/2X40qLyoj1wQ2qE5FVpA7xBigfoot's cousin the Yeti makes an appearance as we dive into the snow map to try to tame the rampaging beast! It goes poorly!Play Bigfoot ► https://store.steampowered.com/app/509980/BIGFOOT/Edited By ► https://twitter.com/rad_rAnd ► https://www.youtube.com/LixianTVScary Games Playlist ► https://www.youtube.com/playlist?list=PL3tRBEVW0hiBSFOFhTC5wt75P2BES0rAoHorror Outro ► https://soundcloud.com/shurkofficial/haunted"
"wjI-wgDbN0g","Yahritza Y Su Esencia - Siendo Sincero ( Video Oficial )","2022-05-19T23:00:11Z","UC7ptwo_0Npl5Bji31j868fA","Yahritza Y Su Esencia","10","22.31.05","yahritza y su esencia|yahritza martinez|yahritza|yaritza|siendo sincero|regional mexicano|regional urbano\|lumbre music|obsessed|ep|esta noche|dejalo ir|soy el unico","1890303","80447","1726","https://i.ytimg.com/vi/wjI-wgDbN0g/default.jpg","False","False","Siendo sincero - Yahritza Y Su Esencia (cover) Merch :lumbremusic.comMusica: Apple Music: https://music.apple.com/us/album/obsessed-ep/1618287709Spotify: https://open.spotify.com/artist/51ZSh80McCt7vbqHouzW0A?si=2Zoct76TRvKtccrH-Bs32w Amazon: https://music.amazon.com/albums/B09XFJFWM5?marketplaceId=ATVPDKIKX0DER&musicTerritory=US&ref=dm_sh_ugYxtmZlNjKyXl0qqyOGt9vLpYouTube: https://www.youtube.com/channel/UC7ptwo_0Npl5Bji31j868fA Deezer: https://www.deezer.com/us/artist/164599407Redes Sociales ( Social Networks ) Facebook : https://www.facebook.com/YahritzaYSuEsenciainstagram : https://www.instagram.com/yahritzaysuesencia/Twitter : https://twitter.com/yahritza_yse?s=21&t=Ut8VLRNFwQWZx2QRYwLRhgtiktok : https://www.tiktok.com/@yahritza"
"JeTkMdw6RK8","World's Largest Experiment!","2022-05-22T18:00:05Z","UCIPPMRA040LQr5QPyJEbmXA","MrBeast Gaming","20","22.31.05","[none]","12472280","453393","17166","https://i.ytimg.com/vi/JeTkMdw6RK8/default.jpg","False","False","Thanks to Cheez-It and Pringles for sponsoring this video! Learn about the Build For Better contest and how you can get 350 Minecoins at https://www.kfr.com/minecraftWe tested the world's most insane Minecraft Experiments! SUBSCRIBE OR YOU'LL HAVE BAD LUCKNew Merch - https://shopmrbeast.comJoin our discord server for your chance to compete in future Minecraft challenges!https://discord.gg/mrbeastgaming----------------------------------------------------------------follow all of these or i will kick you• Facebook - https://www.facebook.com/MrBeast6000/• Twitter - https://twitter.com/MrBeast•  Instagram - https://www.instagram.com/mrbeast--------------------------------------------------------------------"
"L5E2jF6eNU4","Unboxing A $250,000 Sneaker Mystery Box (FIRST EVER)","2022-05-26T22:03:20Z","UCZpZNTJd7aUDfAVajDyEUsA","Harrison Nevel","26","22.31.05","streetwear|Harrison Nevel|$250000 mystery box|mystery box|mr beast mystery box|most expensive mystery box|sneaker mystery box|ultimate mystery box","567682","29308","1587","https://i.ytimg.com/vi/L5E2jF6eNU4/default.jpg","False","False","Giveaway #1 for cactus air max 1!RULES HERE:1. Follow https://instagram.com/projectblitz?igshid=YmMyMTA2M2Y=2. Follow https://instagram.com/yeezybusta?igshid=YmMyMTA2M2Y=3. Followhttps://instagram.com/croatianstyle?igshid=YmMyMTA2M2Y=Comment on this post:https://www.instagram.com/p/CeCYyiNOxrp/?igshid=YmMyMTA2M2Y=Travis Scott Jordan 1 Giveaway:https://www.instagram.com/p/CeB0S12uhnY/Text me! Stay up to do and get exclusive discounts on future drops!470-761-3811Project blitz:https://projectblitz.com// I N S T A G R A M : https://instagram.com/harrisonnevel/// T W I T T E R : https://twitter.com/harrisonnevel// S N A P C H A T : harrisonnevel// F A C E B O O K : www.facebook.com/harrisonnevelytMy Cameraman: https://www.instagram.com/hazelwoodfilm/My Website Where I Sell Sneakers, Hypebeast Mystery Boxes and More!https://www.harrisonnevel.comMy Second Channel where I make car content: https://www.youtube.com/user/HarrisonNevel"
"JbyGgiNY4tY","Trying Valentino & DESIGNER Makeup... Is It Jeffree Star Approved?!","2022-05-22T17:00:15Z","UCkvK_5omS-42Ovgah8KRKtg","jeffreestar","26","22.31.05","jeffree star|valentino makeup|jeffree star makeup review|jeffree star cosmetics|chanel makeup|testing designer makeup|trying expensive makeup|foundation review|jeffree star approved|jeffree star trying makeup|christian louboutin makeup|valentino foundation|jeffree star vlog|expensive makeup haul|nikkietutorials|jaclyn hill|sephora makeup","860837","28570","2191","https://i.ytimg.com/vi/JbyGgiNY4tY/default.jpg","False","False","It's time for a BRAND NEW makeup review! Welcome BACK to my channel... I recently flew to Milano, Italy for a business trip and had to take a moment to find new makeup I've never tried before. During the last year, a lot of new brands have launched and I haven't seen them in person.. Valentino Beauty being one of them! Today we're reviewing and testing out designer makeup. Is it worth it or all trash?? Watch to see the FULL experience.💜 SHOP the JEFFREE STAR SKIN CARE! ► https://jeffreestar.com/collections/shop-all*SHOP: http://www.jeffreestarcosmetics.com + FOLLOW MY BRAND ON Instagram: http://instagram.com/jeffreestarcosmetics +FOLLOW ME ON IG: http://instagram.com/jeffreestar +FOLLOW STAR YAK RANCH: https://www.staryaks.com+ SNAPCHAT: jeffreestar + TWITTER: @jeffreestarWATCH MORE VIDEOS...................❤️💉 WE GOT IN A HORRIBLE CAR ACCIDENT... ► https://bit.ly/3sggAyH💄 FINDING OUR MAKEUP AT A CLEARANCE STORE ▷ https://bit.ly/3bDmulT💜 ADDRESSING MY MENTAL HELP and SELLING MY HOUSE! ▷ https://bit.ly/3GCkJmU🔮 WATCH FULL FACE OF BRANDS THAT HATE ME  ► https://bit.ly/2O6GgJiTrack: Cajama - You Did Me Wrong [NCS Release]Music provided by NoCopyrightSoundsListen: https://www.youtube.com/watch?v=WroIBvPu5tw"
"5Yns80OCwjQ","Chicago man helps police rescue woman chained up in home in city's Pullman neighborhood","2022-05-23T02:12:59Z","UCFmofUYwZd1Ibf_O3PF71jg","FOX 32 Chicago","25","22.31.05","WFLD|video|local|national|third party|woman|kidnapped|prisoner|chicago|pullman|crime","1130709","18461","3043","https://i.ytimg.com/vi/5Yns80OCwjQ/default.jpg","False","False","Antoine Dobine was out walking along 119th and Eggleston when he heard screams coming from a home. As I get closer: 'Help!' Bam, bam bam! I said, 'Who is that?' 'Help!' That's when I called police, Dobine explained. Nate Rodgers reports. STORY: https://www.fox32chicago.com/news/chicago-man-helps-police-rescue-woman-chained-up-in-home-in-citys-pullman-neighborhoodSubscribe to FOX 32 Chicago: https://www.youtube.com/c/FOX32ChicagoNews?sub_confirmation=1Watch FOX 32 Chicago Live: https://www.fox32chicago.com/liveFOX 32 Chicago delivers breaking news, live events, investigations, politics, entertainment, business news and local stories from Chicago and across the nation.Watch more FOX 32 Chicago on YouTube:FOX 32 Headlines: https://youtube.com/playlist?list=PL2-nR6U1joOT92lWD_QLYoNijiDo9uYaPGood Day Chicago: https://youtube.com/playlist?list=PL2-nR6U1joORm02SSjflpEVzL0ydEqeFuSpecial reports and stories: https://youtube.com/playlist?list=PL2-nR6U1joOTGGgDx9B31HcT9IM60Al0-Download the FOX 32 Chicago News app: https://fox32chicago.onelink.me/KNQ9?pid=social&c=youtube&af_web_dp=https%3A%2F%2Fwww.fox32chicago.com%2FappsDownload the FOX 32 Chicago Weather app: https://euklz.app.link/Px4UxyP4PebFollow FOX 32 Chicago on Facebook: https://www.facebook.com/Fox32Chicago/Follow FOX 32 Chicago on Twitter: https://twitter.com/fox32news/Follow FOX 32 Chicago on Instagram: https://www.instagram.com/fox32news/Subscribe to the FOX 32 Chicago newsletter: https://www.fox32chicago.com/newsletters"
"SF17wfwM6m4","ENDERMAN ATTACK - Alex and Steve Life (Minecraft Animation)","2022-05-21T11:00:11Z","UCawEP-InoKYKutsgq_vqIXA","Black Plasma Studios","20","22.31.05","minecraft|minecraft animation|black plasma studios|animation|enderman|attack|endermen|alex and steve|alex and steve life|minecraft life|animation life|the end","4246789","143546","3963","https://i.ytimg.com/vi/SF17wfwM6m4/default.jpg","False","False","🌟  FUNNY BLOOPERShttps://youtu.be/0eTyPzO_M3AEveryone has been kidnapped and corrupted by Endermen- even Alex! Follow Steve in his journey to rescue Alex and the village residents. At the Endermen's base of operations, threatened by Steve's attack, the EnderKing decides to take the fight to more favorable ground- the dimension that Endermen use to teleport between place to place known as The Gap. DIRECTED BYMatthew Bliven_______________________________________________👕  BUY OUR MERCHANDISEhttps://teespring.com/stores/blackplasmastudios🧡  SUPPORT US ON PATREONhttps://www.patreon.com/BlackPlasmaStudios- Watch animations early!- Have your name in the credits!- And much more!💬  JOIN OUR DISCORD SERVERhttps://www.discord.gg/blackplasma#BlackPlasmaStudios #MinecraftAnimation #Minecraft"
"Z1O16vicEoo","3 Origins 💀💀💀 | Ep. 11 | Afterlife Minecraft SMP","2022-05-25T13:30:07Z","UCzTlXb7ivVzuFlugVCv3Kvg","LDShadowLady","20","22.31.05","ldshadowlady|minecraft|mini game|girl gamer|pink hair|funny|walkthrough","1170539","70054","6859","https://i.ytimg.com/vi/Z1O16vicEoo/default.jpg","False","False","Please *boop* the like button if you enjoy the video! :)Welcome to Afterlife SMP, a new Minecraft SMP. A modded multiplayer server with friends based around the Minecraft Origins ModYou get 10 lives in Afterlife SMP and every time you respawn you'll receive a new origin!Due to a massive oversight on our part, we have accidentally named this series after an already existing long-running vanilla SMP called Afterlife SMP 😬 We know this could unfortunately cause some disruption to their server and for that we are extremely sorry. However, I've had the joy of discovering a BUNCH of creators that are active on the original Afterlife SMP and here is a link so you too can check out the amazing stuff they're doing over on Afterlife SMP: https://streamerlinks.com/AfterLifeSMPp.s. please use #ALSMP to tag this SMP @Dangthatsalongname @fWhip@GeminiTay @Joey Graceffa @Katherine Elizabeth Gaming @LaurenzSide @TheMythicalSausage @RIPmika @SeaPeeKay @Shubble @SmallishBeans @Solidarity @Strawburry17Plays @TheOrionSound FOLLOW ME HERE:Twitter: https://twitter.com/LDShadowLadyFacebook: https://www.facebook.com/LDShadowLadyFBInstagram: http://www.instagram.com/ldshadowladyTwitch: http://www.twitch.tv/ldshadowladyCheck out Joel's gaming channel:http://www.youtube.com/SmallishBeans"
"6JX5OW8cOec","Star Wars: The Bad Batch | Season 2 Official Trailer | Disney+","2022-05-29T18:52:21Z","UCZGYJFUizSax-yElQaFDp5Q","Star Wars","24","22.31.05","[none]","4150289","193678","9739","https://i.ytimg.com/vi/6JX5OW8cOec/default.jpg","False","False","It is time for the new Era. Watch the trailer for the new season of Star Wars: #TheBadBatch. Coming to @Disney Plus this Fall."
"jkbCQ0KaCCc","It’s Decided, No More Engine For This Jeep","2022-05-29T14:00:37Z","UChK8eDXz4le2_waQX5_5iuw","Rudys Adventure and Design","2","22.31.05","[none]","292417","19408","1011","https://i.ytimg.com/vi/jkbCQ0KaCCc/default.jpg","False","False","I pulled both engines out of both of my jeeps"
"6bKPk_vBJVE","GERVONTA DAVIS VS ROLLY ROMERO HILARIOUS BACK & FORTH FINAL PRESS CONFERENCE & FACE OFF","2022-05-26T18:36:50Z","UCwdVyruxCCqMR4DtPLhtwlg","Fight Hub TV","17","22.31.05","boxing|fight hub|fight hub tv|fight hub tv youtube|fighthubtv|gervonta davis|rolly romero|rolando romero|gervonta davis rolly romero final press conference|tank davis vs rolly romero|gervonta davis vs rolando romero press conference|tank davis heated press conference|gervonta davis vs rolando romero|gervonta davis vs rolly romero press conference|davis vs romero","714205","9613","3483","https://i.ytimg.com/vi/6bKPk_vBJVE/default.jpg","False","False","Watch the full press conference featuring Gervonta Tank Davis and his opponent Rolando Rolly Romero as the two fighters sound off in an intense final press conference and face off before fight night on Saturday, May 28, 2022 at the  Barclays Center in Brooklyn, NY. Five-time world champ Tank Davis will defend his WBA lightweight title against no. 1 contender Rolly Romero. Live on Showtime PPV.Subscribe: http://goo.gl/vnzIb | Merch: https://merchlabs.shop/collections/fighthubtv Order SNAC FIGHTER'S TRAINING STACK. Get 25% OFF on all SNAC products w/ discount code FIGHTHUBTV1 https://snac.com/products/fighters-training-stackLIVE FAN Q & A EVERY MONDAY AT 5:45 PM PT!Follow Fight Hub TV Instagram: https://instagram.com/fighthubtv Twitter: https://twitter.com/FightHubTV Marcos Twitter: https://twitter.com/heyitsmarcosv Marcos Instagram: https://instagram.com/heyitsmarcosv Watch more videos! OUR NEWEST VIDEOS: https://youtube.com/playlist?list=PL_-4P2CTc7AW86gMVKzKQnqVdGKHl1NZxFIGHT HUB’S GREATEST HITS: https://youtube.com/playlist?list=PL_-4P2CTc7AU4QQO0a40FoBKflPoW4vadCRAZY KO'S : https://youtube.com/playlist?list=PL_-4P2CTc7AUjj5fd_vy25uqsLOP2qpaMBACK & FORTH FIGHTS: https://youtube.com/playlist?list=PL_-4P2CTc7AXz1BXa75dXsZlPyyZ_XTF7Fight Hub TV brings to you daily video content from the world of boxing, MMA and combat sports! On this channel you will find a variety of content like boxing news, MMA interviews, boxing interviews and more! Make sure to subscribe and enable all notifications! #boxing #FightHubTV"
"u-hoGPUHQps","PEANUTS","2022-05-21T14:24:35Z","UCQ8Nk1VgyMgM7Mx3sX8WhPw","Pringus McDingus","1","22.31.05","[none]","1014213","90205","2953","https://i.ytimg.com/vi/u-hoGPUHQps/default.jpg","False","False","they are her favorite after allSpecial thanks to:Voice of Yor:https://twitter.com/GrimmiVTVoice of Anya:https://twitter.com/catprotanoFollow and support me on:○ Patreon!https://www.patreon.com/PringusMcDingus○ Twitter!https://twitter.com/Armand_Gman○ Twitch!https://www.twitch.tv/pringus_mcdingus○ Newgrounds!PringsMcDingus"
"aSQUg-h8G4s","We Built Wells in Africa!","2022-05-21T00:31:33Z","UCAiLfjNXkNv24uhpzUgPa6A","Beast Philanthropy","22","22.31.05","[none]","12174780","948617","33550","https://i.ytimg.com/vi/aSQUg-h8G4s/default.jpg","False","False","Download Dragon City for free, collect all MrBeast Dragons and claim the special rewards: https://dragoncity.onelink.me/DDHl/BeastPhilBeast Philanthropy Video Disclaimer: This video was produced by Beast Philanthropy Productions, LLC, a North Carolina limited liability company. Any revenue generated for Beast Philanthropy Productions, LLC from this video will be donated to MrCharity, Inc. dba Beast Philanthropy, a North Carolina 501(c)(3) nonprofit corporation."
"4HLDaBGdnLc","Star Wars Jedi: Survivor - Official Teaser","2022-05-27T21:02:00Z","UCOsVSkmXD1tc6uiJ2hc0wYQ","EA Star Wars","20","22.31.05","Star Wars|star wars jedi survivor|jedi survivor|star wars survivor|star wars fallen order 2|jedi fallen order 2|survivor|fallen order 2|star wars game|SW|Jedi: Survivor|Survivor|JS|Jedi: Fallen Order|SWJFO|JFO|Jedi: Fallen Order 2|JFO 2|Cal Kestis|BD-1|Lightsaber|EA|EA Star Wars|EASW|Respawn|Respawn Star Wars|jedi fallen order|star wars jedi fallen order|star wars jedi trailer|star wars trailer|swjfo2","3682593","175975","10377","https://i.ytimg.com/vi/4HLDaBGdnLc/default.jpg","False","False","“What is your next move, Jedi?”Experience the next chapter of Cal Kestis’ journey in STAR WARS Jedi: Survivor - coming in 2023.Picking up five years after the events of STAR WARS Jedi: Fallen Order, Jedi: Survivor is a third person, narrative-driven action-adventure game from Respawn Entertainment, developed in collaboration with Lucasfilm Games.#jedisurvivor #starwarsjedisurvivor #starwars"
