video_id,title,publishedAt,channelId,channelTitle,categoryId,trending_date,tags,view_count,likes,comment_count,thumbnail_link,comments_disabled,ratings_disabled,description
"5Pqu5n-zao8","Destiny 2: Season of the Haunted - Solar 3.0 - Developer Insight","2022-05-24T14:58:11Z","UC52XYgEExV9VG6Rt-6vnzVA","Destiny 2","20","22.31.05","Destiny","448255","24060","2274","https://i.ytimg.com/vi/5Pqu5n-zao8/default.jpg","False","False","Burn it with fire.Operation: Caliente - Solar 3.0 has been designed to increase the spice level.Learn more: bung.ie/hauntedFOLLOW DESTINY:Facebook: https://www.facebook.com/DestinyTheGameTwitter: https://www.twitter.com/destinythegameInstagram: https://www.instagram.com/destinythegameDiscord: http://www.discord.gg/destinygame FOLLOW BUNGIE:Facebook: https://www.facebook.com/Bungie/Twitter: https://www.twitter.com/bungieInstagram: https://www.instagram.com/bungie/⠀ ⠀ ⠀ ⠀Dive into the free-to-play world of Destiny 2 to experience responsive first-person shooter combat, explore the mysteries of our solar system, and unleash elemental abilities against powerful enemies. Create your Guardian and collect unique weapons, armor, and gear to customize your look and playstyle. Experience Destiny 2’s cinematic story alone or with friends, join other Guardians for challenging co-op missions, or compete against them in a variety of PvP modes."
"vMAPW7ZoOLw","Harry Styles - Wet Dream (Wet Leg cover) in the Live Lounge","2022-05-24T10:20:01Z","UCKoafhJ9dkAWaEvlXCiBBwA","BBCRadio1VEVO","10","22.31.05","Harry|Styles|Wet|Dream|(Wet|Leg|cover)|the|Live|Lounge|Columbia/SONY|Pop","1538981","96881","2228","https://i.ytimg.com/vi/vMAPW7ZoOLw/default.jpg","False","False","Harry Styles covers Wet Dream by Wet Leg in the BBC Radio 1 Live Lounge"
"dBdAJl1Lwg4","I Ordered the 5 most VIRAL Tiktok Products","2022-05-28T14:45:02Z","UCAM2fyCjEdROyELretVTiiw","HopeScope","26","22.31.05","funny|relatable|beauty fail|fail|tik tok|tik tok beauty|beauty trend|tik tok trend|tik tok beauty trends|tik tok hacks|funny tik tok|life hack|trying tik tok products|tik tok fail|tiktok clothes|viral clothing|small business haul|tiktok dress|prom dress|mini objects|tiktok pants","802100","39121","1833","https://i.ytimg.com/vi/dBdAJl1Lwg4/default.jpg","False","False","Tiktok made me buy it all... lots of deals and lots of disasters! We have everything from beautiful dresses, to mini objects you can actually use.More videos like this:I Bought MORE viral Tiktok products:https://www.youtube.com/watch?v=Ih8oKtEj5QU&list=PLNwTWSLp87CyNnSKmg3zjZGIozUnz2Y16&index=1&t=20sI bought viral Tiktok DRESSES:https://www.youtube.com/watch?v=KoO3iQZ15SU&list=PLNwTWSLp87CyNnSKmg3zjZGIozUnz2Y16&index=8&t=4sand EVEN MORE viral Tiktok products:https://www.youtube.com/watch?v=TlkGUad2eWs&list=PLNwTWSLp87CyNnSKmg3zjZGIozUnz2Y16&index=9&t=237sSubscribe here!https://www.youtube.com/channel/UCnk1idRUmwhdpy_5Il1unfwSubscribe to my shorts channel!https://www.youtube.com/channel/UCnk1idRUmwhdpy_5Il1unfwHopeScope Merch:https://www.shophopescope.com/collections/hopescope-merch/products/hopescope-hatSHOP THIS VIDEO:Tiny Blender:https://amzn.to/3MRpSujColor Wow Root touch up:https://go.magik.ly/ml/1id8s/TEXT ME a “Hi’ to 1-310-582-5313 so we can stay in touch and you can be first to know about new videos :)(It's free! Available for US and Canada residents- regular text rates may apply)@HopeScope on INSTAGRAM for Giveaways, workouts and more!https://www.instagram.com/hopescope@HopeScope on TIKTOK for some laughsBUSINESS INQUIRIES:hopescopeofficial@gmail.com"
"HOfIQ_nEEw8","Catch the Bigger Pokémon to Win","2022-05-26T18:15:00Z","UCnepIUw_tvOatokJAB1yipA","MandJTV Plays","20","22.31.05","mandjtv|mandjtv pokevids|gameplay|let's play|pokemon|pokemon sword and shield|pokemon sword|pokemon shield|gen 8|new pokemon|pokemon let's play|playthrough|best pokemon|all pokemon|nintendo pokemon|original pokemon|pikachu|greninja|charizard|pokemon switch|brilliant diamond|shining pearl|legends arceus|pokemon legends arceus","500280","20921","1208","https://i.ytimg.com/vi/HOfIQ_nEEw8/default.jpg","False","False","Thanks to Keeps for sponsoring this video. Head to https://keeps.com/mandjtvplays to get 50% off your first order of hair loss treatment!Get the Mytey plush at https://mandjtvmerch.com/ for a limited time!PM7 and I compete to see who can catch bigger Pokemon in Legends Arceus!PM7: ➡️ http://bit.ly/pokemen7_plays ⬅️📽️Subscribe here! http://bit.ly/mandjtv_plays👕Merch store! https://mandjtvmerch.com/💸Support me on Patreon and get perks! http://bit.ly/mandjtv_patreon▶️Main Pokemon Channel! http://bit.ly/mandjtv_sub📱 TikTok! http://bit.ly/mandjtv_tiktok📸Instagram! http://bit.ly/mandjtv_insta👽Reddit! http://bit.ly/mandjtv_reddit🏪Amazon Storefront! http://bit.ly/mandjtv_shopEdited by Katie Rose"
"pokC8ZJ4fM8","Uncle Roger Visit Dumpling Factory","2022-05-29T14:00:18Z","UCVjlpEjEY9GpksqbEesJnNA","mrnigelng","23","22.31.05","nigel ng|uncle roger|nigel ng comedy","1112860","56433","2578","https://i.ytimg.com/vi/pokC8ZJ4fM8/default.jpg","False","False","Use code UNCLEROGER to get 10% off Uncle Roger's favorite soup dumplings (US only): https://thexcj.com/discount/UNCLEROGERThank you XCJ for sponsoring this weejio!💰 Support me so I can keep making weejios for you!Merch: https://unclerogermerch.com/Channel membership: https://www.youtube.com/channel/UCVjlpEjEY9GpksqbEesJnNA/joinShoutouts: https://www.cameo.com/mrnigelng---Edited by: Nigel Ng and Frankie LoweWritten by: Nigel Ng and Morgan ReesUncle Roger is the creation of comedian Nigel Ng.Follow my socials for more content ⬇️💬 Discord: https://discord.gg/2WT3gfc2Qw📸 Instagram: https://www.instagram.com/mrnigelng/👪 Facebook: https://www.facebook.com/nigelngcomedy/🤖 Reddit: https://www.reddit.com/r/UncleRoger/🕺 tiktok: https://www.tiktok.com/@mrnigelng🐦 Twitter: https://twitter.com/MrNigelNg🌎 If you want me to tour your area, put your city in here: http://bit.ly/nigelngmail© Orange Heart Productions"
"fpVGqqj6Mxo","I SURPRISED AMP WITH EXOTIC AFRICAN SNACKS","2022-05-23T21:41:58Z","UCpmGbhQHg0nf3Ec2OreFHoQ","Agent 00","24","22.31.05","agent 00|NHTSA|click it or ticket|click it don’t risk it|buckle up|seat belts|seat belt safety|NHTSA seat belt|NHTSA buckle up|seat belt psa","316275","18554","840","https://i.ytimg.com/vi/fpVGqqj6Mxo/default.jpg","False","False","Thanks to NHTSA for sponsoring a portion of this video. Learn more-  https://bit.ly/ClickIt2022A #ClickItorTicket #BuckleUpAMP tries Ethiopian food for the first time. I've surprised the guys with some unique eats in the past but this one here was special.🟪 STREAMS: https://www.twitch.tv/callmeagent00🟪 STREAM CLIPS: https://www.youtube.com/channel/UCZD0qjZUZzkQcgfbrmoUnXQ?sub_confirmation=1👉 GAMING: https://www.youtube.com/channel/UCVC5-Y6ez4sk3mtbUmN-SUQ?sub_confirmation=1🔴 PLAYBACK: https://t.co/EPV6i5A0dz?amp=1⚡ AMP: https://www.youtube.com/channel/UCJbYdyufHR-cxOuY96KIoqA?sub_confirmation=1🎤 PODCAST: https://www.youtube.com/channel/UC_q9jnFFLHSHgtVDc0ERNlg?sub_confirmation=1👕  Merch: http://www.agent.clothing/ 🐦 TWITTER: https://twitter.com/CallMeAgent00 📸 INSTAGRAM: https://www.instagram.com/callmeagentzero/ 👉🟪"
"IRm_sSERdYo","Game Theory: Bowser's LOST Child...Yoshi!","2022-05-26T18:05:04Z","UCo_IB5145EVNcf8hw1Kku7w","The Game Theorists","20","22.31.05","yoshi|mario|yoshi sound|yoshi's crafted world|yoshi's island|yoshis woolly world|mario odyssey|super mario|super mario bros|smash bros|super smash bros|what is yoshi|what is a yoshi|yoshi dragon|yoshi dragon or dinosaur|is yoshi a dinosaur|is yoshi a dragon|game theorists|game theory|matpat|game theory yoshi|NHTSA|click it or ticket|click it don’t risk it|buckle up|seat belts|seat belt safety|NHTSA seat belt|NHTSA buckle up|seat belt psa","2128082","111673","6213","https://i.ytimg.com/vi/IRm_sSERdYo/default.jpg","False","False","Special thanks to NHTSA for sponsoring a portion of this video!Learn more NOW! ► https://bit.ly/ClickIt2022TTheorists, I have something to tell you. I may have been WRONG in one of my previous theories. I know, I know! That is SHOCKING, very unexpected news but it merits revisiting a certain green companion. Yoshi. What IS Yoshi? Well, I think I figured out where I went wrong...Check out the official NHTSA channel ► https://www.youtube.com/user/USDOTNHTSAGet Your Theory Wear! ►  https://theorywear.com/SUBSCRIBE to Catch all the Theories! ► https://goo.gl/kQWHkJ    Need Royalty Free Music for your Content? Try Epidemic Sound.Get A 30 Day Free Trial! ► http://share.epidemicsound.com/MatPat   More THEORIES: FNAF, The FINAL Timeline ►► https://bit.ly/2MlHYFeFNAF, The Monster We MISSED! ►► https://youtu.be/_ygN8HLCaJgFNAF This Theory Changes Everything ► https://bit.ly/2JUQUn6FNAF, You Were Meant To Lose ► https://youtu.be/7bn8hM9k0b0FNAF 6, No More Secrets ► https://bit.ly/2LVCq4u   Credits:Writers: Matthew Patrick, Hannah Malek (HgMercury73) and Tom RobinsonEditors: Dan Cybert Seibert, Jerika (NekoOnigiri), and Pedro FreitasAssistant Editor: Caitie Turner (Caiterpillart)Sound Editor: Yosi Berman #Yoshi #Mario #Bowser #SuperMario #SuperMarioBros #SuperSmashBros #SmashBros #MatPat #Theory #GameTheory #ClickItorTicket #BuckleUp"
"AkDJ9aMeh28","BabyTron - Emperor of the Universe (Shot on iPhone by Cole Bennett)","2022-05-17T22:00:11Z","UCtylTUUVIGY_i5afsQYeBZA","Lyrical Lemonade","24","22.31.05","babytron|emperor of the universe|prince of the mitten|king of the galaxy|21 beats|21 locations|los angeles|Michael jordan|fake Michael jordan|shot on iphone|lyrical lemonade|Cole bennett|hollywood boulevard|wax museum|hard in the paint|trumpets|run it|bleed it|detroit|chicago|rap|hip hop|music video|iPhone music video","2233284","177382","11374","https://i.ytimg.com/vi/AkDJ9aMeh28/default.jpg","False","False","Lyrical Lemonade PresentsBabyTron - Emperor of the Universe21 Different Beats // 21 Different LocationsShot, Directed & Edited by Cole BennettProduced by Henrii Coleman & Jake MillanShot Entirely on iPhone Max Pro 13Special thanks to the Zac FTP, Wack100, Dro Fe, The Mcdonalds Employees, The Jamba Juice Employees & The Target Employees.These songs aren't cleared so if you are a record label watching this, please don't take it down. The video is not monetized. Let us have fun in peace. pleaaaaaase- colefollow babytron:http://instagram.com/babytronhttp://twitter.com/_babytron--Official Channel of Lyrical Lemonade Subscribe for updates on music videos, interviews, performance videos, etc.Lyrical Lemonade's Hot 25 Spotify Playlist:https://open.spotify.com/user/gh3vdz775oy18ah1wp9ucxsj5/playlist/5UuPeWDR2I8a8pORvW9vmrLyrical Lemonade Socials:http://www.twitter.com/lyricalemonadehttp://www.instagram.com/lyricalemonadehttp://www.facebook.com/lyricalemonadehttp://www.lyricallemonade.comCole Bennett Socials:http://www.twitter.com/_colebennett_http://www.instagram.com/_colebennett_LENNY ~ a hidden character representing happiness & good energyhttp://instagram.com/lenny"
"N0BufJyq1zA","GTA 5 Speedrun, but everything's launched every 10 seconds","2022-05-26T19:16:04Z","UClyGlKOhDUooPJFy4v_mqPg","DougDoug","20","22.31.05","DougDoug|DougDoug Youtube Channel|Channel Youtube DougDoug|doug doug|twitch|twitch chat|dougdoug twitch chat|twitch chat plays|dougdoug twitch|GTA 5|grand theft auto|GTA V|grand theft auto V|trevor|trevor %|flinging|launch|launched|mod|modding|speedrun|puns|pun","919258","54631","1364","https://i.ytimg.com/vi/N0BufJyq1zA/default.jpg","False","False","Can you beat the game if everything is violently flung around?This was streamed live on Twitch! https://bit.ly/DougTwitchFull stream recording: https://www.youtube.com/watch?v=nWIhdz2_QigEdited by CyVoltage! https://www.youtube.com/c/CyVoltageMy 2nd Channel: http://bit.ly/dougdoug2Twitter: https://twitter.com/DougDougFoodSubscribe: https://bit.ly/dougdougsubsubMore DugDug:Latest Uploads: https://www.youtube.com/watch?v=rp4cH7mb4X4&list=PLzTxt5iYdhziB3Zf03HR_aZWgJ49ffj-d&index=2Explained with Food: https://www.youtube.com/playlist?list=PLzTxt5iYdhzjMJF--_xpj4s4jgOPe0NWFDougDoug Challenges: https://www.youtube.com/playlist?list=PLzTxt5iYdhzh_SW60_g3HPVjBupwUZOFAPopular Videos: https://www.youtube.com/playlist?list=PLzTxt5iYdhzgrLpm-SQNNAVOw0gVs8Iu_About DougDoug:Doug is a sentient bell pepper who was hired by the FBI to crack gaming challenges and also talk about things with food#ClassRoom #GTA5 #Speedrun"
"Q5x4eHn_3tA","Steve Kerr Delivers Powerful Message After Mass Shooting At Elementary School","2022-05-25T00:13:16Z","UC9-OpMMVoNP5o10_Iyq7Ndw","Bleacher Report","17","22.31.05","bleacher report|br|nba|steve kerr|steve kerr warriors|steve kerr interview","2776174","91426","16037","https://i.ytimg.com/vi/Q5x4eHn_3tA/default.jpg","False","False","Steve Kerr spoke on the mass shooting at Robb Elementary School in Uvalde, TexasSubscribe: https://www.youtube.com/user/BleacherReport?sub_confirmation=1Follow on IG: http://www.instagram.com/f/bleacherreportFollow us on Twitter: http://www.twitter.com/bleacherreportLike us on Facebook: http://www.facebook.com/bleacherreport"
"H8GLbJqBIHw","I'M IN LEGIT TEARS!! Flight 1v1 Against Gio Wise!","2022-05-26T01:28:02Z","UCG5_ENrBMOXHDL1LM6_WzLg","CashNastyReacts","24","22.31.05","flight vs gio wise|flight reacts 1v1 basketball|cash reacts to flight|1v1 basketball|cash basketball|entertainment|funny videos clean|gio wise vs flight reacts|hooping","567251","33387","1550","https://i.ytimg.com/vi/H8GLbJqBIHw/default.jpg","False","False","-Follow me on Twitter!www.twitter.com/cashnastygaming-Instagram @cashnasty-Main channel:www.youtube.com/cashnastygaming-Tik-Tok@cashnastytiktok-For business inquiries: cash@longhaulmgmt.com-For copyright issues please contact me here: cashandashbusiness@gmail.com"
"ow3SDrq29_c","LOGAN PAUL'S FRIEND CAUGHT ME TALKING TO HIS EX","2022-05-29T00:12:03Z","UCmraHp1nkUsFWLqR7SWToIg","Jeff Wittek","23","22.31.05","Jeff's barbershop|Jeff wittek|vlog squad|David Dobrik|barber|barbershop|haircut|interview|podcast|MIKE Majlak|lana rhoades|new york|miami|impaulsive|toddy smith|Jake paul|hair products|noel miller|cody ko|Formula 1|F1","426343","27114","984","https://i.ytimg.com/vi/ow3SDrq29_c/default.jpg","False","False","Video Sponsored by Ridge Wallet. Check them out here: https://ridge.com/jeffsp Use Code “JEFFSP” for 15% off your orderBONUS CONTENT / BEHIND THE SCENEShttps://www.patreon.com/jeffwittekJeff’s Barbershop Hair product available now at 👇https://www.jeffwittek.comFollow my Instagramhttps://www.instagram.com/jeffTwitter https://www.twitter.com/jeffwittek People in this vid:@Mike Majlak Vlogs @Noel Miller @Ryan The Leader Stevenhttps://www.instagram.com/daddysteveOutro song bySimon Rexhttps://www.youtube.com/user/dirttothenastyCamera/ EditorOscar Alvahttps://www.instagram.com/oscaralvaCamera man/ Assistant EditorKyle Barperhttps://www.instagram.com/kylebarper"
"nEX4Umn5Bx8","Character Teaser - Yelan: Inevitable Justice | Genshin Impact","2022-05-25T04:00:29Z","UCiS882YPwZt1NfaM0gR0D9Q","Genshin Impact","20","22.31.05","Amber|amber vtuber|genshi|genshi game|genshi impact|genshi video|genshin|genshin game|genshin impact|genshin impact 2020|genshin impact game|genshin impact good|genshin impact graphics|genshin impact introduction|genshin impact manga|genshin impact wiki|geshin|geshin game|Teyvat|yuanshen game|miHoYo China|miHoYo Japan|adventure story|open world game|anime style|MMORPG|anime games|mobile game|MMO PlayStation|yt:cc=on","3036498","271796","10423","https://i.ytimg.com/vi/nEX4Umn5Bx8/default.jpg","False","False","A spider doesn't need to be in the center of the web to feel the slightest vibration from each thread.When the trapped prey sees the hunter emerging from the darkness, its fate is already doomed.Download FREE: https://genshin.hoyoverse.com/en#GenshinImpact #HoYoverse↓ Follow us for the latest news ↓Official Website: https://genshin.hoyoverse.com/enOfficial Community: https://www.hoyolab.com/genshin/Facebook: https://www.facebook.com/GenshinImpact/Twitter: https://twitter.com/GenshinImpactTwitch: https://www.twitch.tv/genshinimpactofficialInstagram: https://www.instagram.com/genshinimpact/Reddit: https://www.reddit.com/r/Genshin_Impact/"
"0-pGFK6Mssg","We Ruined Famous Fast Foods","2022-05-27T19:26:05Z","UCJGgP4txIUr_7JTDvOGVQrA","Ted Nivison","23","22.31.05","JehBerDeh|TedNivison|Ted|Nivison","579747","56686","1315","https://i.ytimg.com/vi/0-pGFK6Mssg/default.jpg","False","False","Get Honey for FREE today ▸ https://joinhoney.com/tedHoney finds coupons with one click. Thanks to Honey for sponsoring! In this video, I bring in some of my favorite people to recreate and improve famous fast foods to be better, and let me tell you: it was horrifying. GUESTS:@Emma Langevin @Will Neff @William Osman @Eddy Burback @Jaiden Animations ►Instagram: https://www.instagram.com/TedNivison►Twitch: https://www.twitch.tv/TedNivison►Follow my Twitter: https://twitter.com/TedNivison►Discord: https://discord.gg/c3qMbDMRoyalty Free Music by http://www.epidemicsound.com/Outro: Pls Proceed by Baron Grand"
"qlQ4jaKoN7A","10 Incredible Cut Content Secrets in Elden Ring","2022-05-26T05:11:13Z","UCe0DNp0mKMqrYVaTundyr9w","VaatiVidya","20","22.31.05","guide|walkthrough|lore|dark|souls|dlc|two|bloodborne|story|vaatividya|vaati|vidya|videos|(video|game)|shadows|twice|from|software|sekiro|combat|tips|tricks|elden|ring|trailer|demon's souls|remake|ps5|playstation 5|demigods|radagon|godwyn|morgott|radahn|malenia|miquella|melina|omen|scarlet rot|outer god|demi|gods|asimi|silver tear|mimic tear|questline|rhico|dream brew|zullie the witch|lance mcdonald|illusorywall|cut dialogue|godfrey|godrick|colosseum|arena|pvp|boss rematch","948345","57755","2274","https://i.ytimg.com/vi/qlQ4jaKoN7A/default.jpg","False","False","Go to http://www.audible.com/vaatividya or text vaatividya to 500 500 to get your free trial. SUBSCRIBE TO THE DATAMINERS ▼▼▼►Recreated Mimic Questline by Nullrinn: https://youtu.be/1z9IG6Rnnac►Cut Dreambrew Questline by Lance: https://youtu.be/2IT-DPhIxX8►Limgrave's Burning Stone Heads by Lance: https://youtu.be/sPPHMJHRJQc►Map Changes Over Time by Illusory wall: https://youtu.be/jxnn0CpxpUo►Leonard & Radahn by Zullie the Witch: https://youtu.be/rPU3LdoiFwU►Snake Soul info by Zullie the Witch: https://youtu.be/uBzelJ70lCM►Godrick's Cut Dialogue by SekiroDubi: https://youtu.be/GjYxqsnehLc►Godfrey's Cut Dialogue by SekiroDubi: https://youtu.be/zMu7FvNP2Z4►The Mystery of the Colosseum by SekiroDubi: https://youtu.be/0wKB-zAZSkgTIMESTAMPS00:00 Intro00:14 Blaidd's Tower00:51 MimicTear Questline04:22 Dreambrew Questline06:39 Burning Giant Heads07:48 Map Changes Over Time08:38 Radahn & Leonard09:32 SnakeSoul10:43 Godrick Cut Dialogue11:58 Godfrey Cut Dialogue12:43 The Arenas of the Lands Between14:27 Audible SponsorshipKINDLE THE CHANNEL [become a patron]►http://www.patreon.com/vaatividyaSPECIAL THANKS TO►TheParryGod, for editing many recent videos - https://www.youtube.com/user/xricsxPLAYLISTS►My Best Videos: http://bit.ly/2oMp66a►Elden Ring News: https://bit.ly/2ZkDV2d►Sekiro Lore: https://bit.ly/2KGEzD1►Sekiro Secrets: https://bit.ly/2IsObhW►Dark Souls 3 Lore: http://bit.ly/2n0bU13►Dark Souls 3 News: http://bit.ly/1NQbgbW►Bloodborne Lore: http://bit.ly/1X9doOQ►Demon's Souls Lore: http://bit.ly/16mIF86►Dark Souls Remastered Lore: http://bit.ly/13x6nNs►Dark Souls 2 Lore: http://bit.ly/1dedWjI►Souls-like: http://bit.ly/1xCPDnuSOCIAL►Follow me on Twitter: https://twitter.com/VaatiVidya►Follow me on Tumblr: http://vaatividya.tumblr.com/►Follow me on Twitch.tv: http://www.twitch.tv/vaatividya►Follow me on Facebook: https://www.facebook.com/Vaatividya►Follow me on Patreon: http://www.patreon.com/vaatividya►Join me on Discord: http://discord.gg/vaatividyaTHUMBNAIL ART►Janice ChuPATRONS►I'd like to give sincere thanks to all my patrons - your contributions have changed the course of my life, allowing me to put more emphasis on video production in the future.►Special thanks to Soul of Cinder-tier Patrons: Aidan, Aishlinn, AJ, Aj Banasiak, AmazinShawn, Andreas, Andronikos, anthony, Aritz, Armand, Axel, Benjamin, budhawillyboy, Cat, Chase, Chattan, Croonz, Dain, David, deathbydishwasher, Aydian, Diablo, Erlend, Finbarwrong, GoldenSunX, Goon1234, HugDucks, Ian, Italian, Jacob, Joshua, Justin, Justin, Kejo, Kuvoc, Kyle, Lena, Liam, Lucat, Lucian, Lucratiel, Loak, M, Malik, Matthew, Meistermuall, Michael, michael, Mike, & Morgan."
"ApKbSa4s-No","Extended Highlights | Playoff | PGA Championship | 2022","2022-05-23T03:00:08Z","UCnUYyAtDiyeaobSzKqVE_BA","PGA Championship","17","22.31.05","Golf|golf highlights|pga championship|pga championship highlights|2022 pga championship|2022 golf|golf major highlights|golf major|Southern Hills|Southern Hills Country Club|Wanamaker Trophy|major championship|justin thomas will zalatoris playoff|justin thomas playoff|pga championship playoff|2022 pga championship highlights|will zalatoris highlights|will zalatoris pga championship|will zalatoris|pga championship round 4","285036","1837","181","https://i.ytimg.com/vi/ApKbSa4s-No/default.jpg","False","False","See every shot from the three-hole playoff between Justin Thomas and Will Zalatoris at the 2022 PGA Championship at Southern Hills Country Club.Subscribe now: https://bit.ly/PGAChampionshipYT Contested each May, the PGA Championship is the second major championship in golf’s annual rotation, and perennially features the strongest field in the men's game based on the Official World Golf Rankings. Known for dramatic finishes and notable champions, the Wanamaker Trophy—which has been awarded to the winner since 1916—is inscribed with names such as Koepka, McIlroy, Woods, Mickelson, Nicklaus, and Player. The 2022 PGA Championship is set to take place between 19-22 May at Southern Hills Country Club. The reigning champion is Phil Mickelson.Website: https://pgachampionship.com/Facebook: https://www.facebook.com/pgachampionshipTwitter: https://twitter.com/pgachampionshipInstagram: https://instagram.com/pgachampionship/"
"X3o71W4uNHc","Prince Rupert's Drop EXPLODING in Epoxy Resin at 456,522 fps - Smarter Every Day 273","2022-05-29T14:00:03Z","UC6107grRI4m0o2-emgoDnAA","SmarterEveryDay","28","22.31.05","Smarter|Every|Day|Science|Physics|Destin|Sandlin|Education|Math|Smarter Every Day|experiment|nature|demonstration|slow|motion|slow motion|education|math|science|science education|what is science|Physics of|projects|experiments|science projects|Prince Rupert's Drop|Slow Motion|fps|Mechanics|fracture mechanics|what is a prince rupert's drop|Ballistics Gel","1497241","73224","5849","https://i.ytimg.com/vi/X3o71W4uNHc/default.jpg","False","False","Go to https://brilliant.org/smartereveryday to sign up for free, and also, get 20% off your annual premium membership~~~~~~~~~~~~~~~~~~~~~~~~~~~~Other videos related to Prince Rupert's Drops:http://www.princerupertsdrop.comPrince Rupert's Drop T-Shirt:https://www.smartereveryday.com/storeEmail List to be notified when I upload:https://www.smartereveryday.com/email-list~~~~~~~~~~~~~~~~~~~~~~~~~~~~Tweet Ideas to me at:http://twitter.com/smartereverydaySmarter Every Day on Facebookhttps://www.facebook.com/SmarterEveryDaySmarter Every Day on Patreonhttp://www.patreon.com/smartereverydaySmarter Every Day On Instagramhttp://www.instagram.com/smartereverydaySmarter Every Day SubReddithttp://www.reddit.com/r/smartereverydayAmbiance, audio and musicy things by: Gordon McGladdery https://www.ashellinthepit.com/http://ashellinthepit.bandcamp.com/If you feel like this video was worth your time and added value to your life, please SHARE THE VIDEO!If you REALLY liked it, feel free to pitch a few dollars Smarter Every Day by becoming a Patron.http://www.patreon.com/smartereverydayWarm Regards,Destin"
"sOClp6WbO4M","Super Mario 64 DS ROM Hacks | Different Console, Same Ol' Shenanigans","2022-05-29T21:00:31Z","UCp-XZhyQLcJ8X65eT1T3XyQ","AntDude","20","22.31.05","AntDude|Super Mario 64 ROM Hacks|Super Mario 64 DS ROM Hacks|sm64ds hacks|Super Mario 64 DS mods|sm64ds mods|Super Mario 64 mods|Best Mario 64 mods|Worst Mario 64 mods|Best Mario 64 DS mods|Best Mario 64 ds hacks|Worst Mario 64 ds hacks|sm64 ds hacks|sm64 ds mods|mario rom hacks|Super Mario 64 PC","162932","12116","759","https://i.ytimg.com/vi/sOClp6WbO4M/default.jpg","False","False","While Super Mario 64 hacking is all the rage, there's a community still growing and thriving on the DS! We may be on a different console, but the same shenanigans still apply here. Let's talk about the current state of Super Mario 64 DS ROM Hacks!▶ Subscribe!http://www.youtube.com/antdude92▶ Twitter: http://www.twitter.com/antdude92▶ Streaming Channel: http://www.youtube.com/antdudeplays▶ Logo Created By Nico Vliek: http://www.twitter.com/WhaddupNico▶ Intro Animated By Piranhartist - https://piranhartist.wixsite.com/portfolio▶ Thumbnail Created By Kevin Fagaragan: https://twitter.com/KevinFagaragan▶ Video Edited By Luis Illingworth: https://twitter.com/HeyRaguio▶ Consider picking up a shirt!: https://www.pixelempire.com/collections/antdude"
